,character,line,gender
618,JIM MORITA,"So, what are we supposed to do. I mean, it’s not like we can just knock on the front door.",MALE
619,STEVE ROGERS,Why not? That’s exactly what we’re gonna do.,MALE
620,RED SKULL,"Arrogance may not be a uniquely American trait, but I must say you do it better than anyone. But there are limits to what even you can do, Captain. Or did Erskine tell you otherwise?",MALE
621,STEVE ROGERS,He told me you were insane.,MALE
622,RED SKULL,"Ah. He resented my genius and tried to deny me what was rightfully mine. But he gave you everything. So, what made you so special?",MALE
623,STEVE ROGERS,Nothin’. I’m just a kid from Brooklyn.  I can do this all day.,MALE
624,RED SKULL,"Oh, of course you can. Of course. But unfortunately I am on a tight schedule.",MALE
625,STEVE ROGERS,So am I!,MALE
626,JAMES MONTGOMERY FALSWORTH,Rogers! You might need this!,MALE
627,STEVE ROGERS,Thanks!,MALE
628,JIM MORITA,"We’re in! Assault team, go!",MALE
629,COL. CHESTER PHILLIPS,Move out!  Keep your spacing!,MALE
630,HYDRA SOLDIER,"Cutt off one head, two more shall…",MALE
631,COL. CHESTER PHILLIPS,Let’s go find two more!,MALE
632,STEVE ROGERS,You’re late.,MALE
633,PEGGY CARTER,Weren’t you about to…,FEMALE
634,STEVE ROGERS,Right.  Keep it steady!,MALE
635,PEGGY CARTER,Wait!  Go get him.,FEMALE
636,COL. CHESTER PHILLIPS,I’m not kissin’ you!,MALE
637,RED SKULL,"You don’t give up, do you?",MALE
638,STEVE ROGERS,Nope!,MALE
639,RED SKULL,"You could have the power of the gods! Yet you wear a flag on your chest and think you fight a battle of nations! I have seen the future, Captain! There are no flags!",MALE
640,STEVE ROGERS,Not my future!,MALE
641,RED SKULL,What have you done? No.,MALE
642,STEVE ROGERS,Come in. This is Captain Rogers. Do you read me?,MALE
643,JIM MORITA,"Captain Rogers, what is your…",MALE
644,PEGGY CARTER,"Steve, is that you? Are you alright?",FEMALE
645,STEVE ROGERS,Peggy! Schmidt’s dead.,MALE
646,PEGGY CARTER,What about the plane?,FEMALE
647,STEVE ROGERS,That’s a little bit tougher to explain.,MALE
648,PEGGY CARTER,"Give me your coordinates, I’ll find you a safe landing site.",FEMALE
649,STEVE ROGERS,There’s not going to be a safe landing. But I can try and force it down.,MALE
650,PEGGY CARTER,"I’ll get Howard on the line, he’ll know what to do.",FEMALE
651,STEVE ROGERS,There’s not enough time. This thing’s moving too fast and it’s heading for New York.  I gotta put her in the water.,MALE
652,PEGGY CARTER,"Please, don’t do this. We have time. We can work it out.",FEMALE
653,STEVE ROGERS,"Right now I’m in the middle of nowhere. If I wait any longer a lot of people are gonna die. Peggy, this is my choice.  Peggy?",MALE
654,PEGGY CARTER,I’m here.,FEMALE
655,STEVE ROGERS,I’m gonna need a rain check on that dance.,MALE
656,PEGGY CARTER,"Alright. A week, next Saturday, at the Stork Club.",FEMALE
657,STEVE ROGERS,You got it.,MALE
658,PEGGY CARTER,Eight o’clock on the dot. Don’t you dare be late. Understood?,FEMALE
659,STEVE ROGERS,"You know, I still don’t know how to dance.",MALE
660,PEGGY CARTER,I’ll show you how. Just be there.,FEMALE
661,STEVE ROGERS,We’ll have the band play somethin’ slow. I’d hate to step on your…,MALE
662,PEGGY CARTER,Steve? Steve? Steve?,FEMALE
663,JAMES MONTGOMERY FALSWORTH,To the Captain.,MALE
664,STARK'S ENGINEER,Sir?,MALE
665,HOWARD STARK,Take us to the next grid point.,MALE
666,STARK'S ENGINEER,But there’s not trace of wreckage. And the energy signature stops here.,MALE
667,HOWARD STARK,Just keep looking.,MALE
668,DODGERS ANNOUNCER,"Curve ball, high and outside for ball one. So the Dodgers are tied, 4-4. And the crowd well knows that with one swing of his bat, this fellow’s capable of making it a brand-new game again. Just an absolutely gorgeous day here at Ebbets Field. The Phillies have managed to tie up at 4-4. But the Dodgers have three men on. Pearson beaned Reiser in Philadelphia last month. Wouldn’t the youngster like a hit here to return the favour? Pete leans in. Here’s the pitch. Swung on. A line to the right. And it gets past Rizzo. Three runs will score. Reiser heads to third. Durocher’s going to wave him in. Here comes the relay, but they won’t get him.",MALE
669,SHIELD AGENT,"Good morning.  Or should I say, afternoon?",MALE
670,STEVE ROGERS,Where am I?,MALE
671,SHIELD AGENT,You’re in a recovery room in New York city.,MALE
672,DODGERS ANNOUNCER,"The Dodgers take the lead, 8-4. Oh, Dodgers! Everyone is on their feet. What a game we have here today, folks. What a game indeed.",MALE
673,STEVE ROGERS,Where am I really?,MALE
674,SHIELD AGENT,I’m afraid I don’t understand.,MALE
675,STEVE ROGERS,"The game, it’s from May, nineteen forty one. I know, cause I was there.  Now, I’m gonna ask you again. Where am I?",MALE
676,SHIELD AGENT,Captain Rogers…,MALE
677,STEVE ROGERS,Who are you?,MALE
678,SHIELD AGENT,"Captain Rogers, wait!  All agents, code 13! I repeat. All agents, code 13!",MALE
679,NICK FURY,"At ease, soldier! Look, I’m sorry about that little show back there, but… we thought it best to break it to you slowly.",MALE
680,STEVE ROGERS,Break what?,MALE
681,NICK FURY,"You’ve been asleep, Cap. For almost seventy years.  You gonna be okay?",MALE
682,STEVE ROGERS,Yeah. Yeah. I just…I had a date.,MALE
683,NICK FURY,Trouble sleeping?,MALE
684,STEVE ROGERS,"You’re here with a mission, sir?",MALE
685,NICK FURY,I am.,MALE
686,STEVE ROGERS,Trying to get me back in the world?,MALE
687,NICK FURY,Trying to save it.,MALE
