,character,line,gender
724,RED SKULL,The price. Soul hold a special place among the Infinity Stones. You might say it has a certain wisdom.,MALE
725,THANOS,Tell me what it needs.,MALE
726,RED SKULL,To ensure that whoever possesses it... understands its power.... The stone demands a sacrifice.,MALE
727,THANOS,Of what?,MALE
728,RED SKULL,"In order to take the stone, you must lose that which you love. A soul, for a soul.",MALE
729,GAMORA,"All my life, I dreamed of a day... a moment when you would get what you deserved. And I was always so disappointed. But now... you kill and torture... and you call it mercy. The universe has judged you. You asked it for a prize, and it told you no. You failed. And do you wanna know why? Because you love nothing. No one.",MALE
730,GAMORA,Really? Tears?,MALE
731,RED SKULL,They're not for him.,MALE
732,GAMORA,No! This isn't love!,MALE
733,THANOS,"I ignored my destiny once. I cannot do that again. Even for you.  I'm sorry, little one.",MALE
734,GAMORA,No!,MALE
735,STEVE ROGERS,"Drop to 2600, heading 0-3-0.",MALE
736,SAM WILSON,"I hope you're right about this, Cap. Or we're gonna land a lot faster than you want to.",MALE
737,OKOYE,When you said we were going to open Wakanda to the rest of the world... this is not what I imagined.,FEMALE
738,T'CHALA,And what did you imagine?,MALE
739,OKOYE,The Olympics. Maybe even a Starbucks.,FEMALE
740,BRUCE BANNER,Should we bow?,MALE
741,JAMES RHODES,"Yeah, he's a king.",MALE
742,STEVE ROGERS,Seems like I'm always thanking you for something.,MALE
743,JAMES RHODES,What are you doing?,MALE
744,T'CHALA,"Uh, we don't do that here.  So how big of an assault can we expect?",MALE
745,BRUCE BANNER,"Uh, sir, I think you can expect quite a big assault.",MALE
746,NATASHA ROMANOFF,How we looking?,FEMALE
747,T'CHALA,"You will have my Kingsguard, the Border Tribe, the Dora Milaje, and...",MALE
748,BUCKY,"A semi-stable, 100-year-old man.",MALE
749,STEVE ROGERS,"How you been, Buck?",MALE
750,BUCKY,"Uh, not bad, for the end of the world.",MALE
751,SHURI,Whoa. The structure is polymorphic.,FEMALE
752,BRUCE BANNER,"Right, we had to attach each neuron non-sequentially.",MALE
753,SHURI,Why didn't you just reprogram the synapses to work collectively?,FEMALE
754,BRUCE BANNER,"Because, we didn't think of it.",MALE
755,SHURI,I'm sure you did your best.,FEMALE
756,WANDA MAXIMOFF,Can you do it?,FEMALE
757,SHURI,"Yes, but there are more than two trillion neurons here. One misalignment could cause a cascade of circuit failures.  It will take time, brother.",FEMALE
758,STEVE ROGERS,How long?,MALE
759,SHURI,As long as you can give me.,FEMALE
760,OKOYE,Something's entered the atmosphere.,FEMALE
761,SAM WILSON,"Hey, Cap, we got a situation here.",MALE
762,BUCKY,"God, I love this place.",MALE
763,JAMES RHODES,"Yeah, don't start celebrating yet, guys. We got more incoming outside the dome.",MALE
764,VISION,It's too late. We need to destroy the stone now.,MALE
765,NATASHA ROMANOFF,"Vision, get your ass back on the table.",FEMALE
766,T'CHALA,We will hold them off.,MALE
767,STEVE ROGERS,"Wanda, as soon as the stone's out of his head... you blow it to hell.",MALE
768,WANDA MAXIMOFF,I will.,FEMALE
769,T'CHALA,Evacuate the city. Engage all defense procedures.  And get this man a shield.,MALE
770,ROCKET,"I don't think you get the scientifics here. These rings are gigantic. You wanna get them moving, you're gonna need something a lot bigger to yank 'em loose.",MALE
771,THOR,Leave that to me.,MALE
772,ROCKET,"Leave that to you? Buddy, you're in space. All you got is a rope and a--",MALE
773,THOR,Fire the engines!,MALE
774,ROCKET,Nnnyah!,MALE
775,THOR,MORE... POWER... RABBIT!,MALE
776,EITRI,"Well done, boy.",MALE
777,THOR,That's Nivadellir!,MALE
778,EITRI,Damn it.,MALE
779,ROCKET,"""Damn it""? What's ""damn it""?",MALE
780,EITRI,The mechanism is crippled.,MALE
781,THOR,What?,MALE
782,EITRI,With the iris closed I can't heat the metal.,MALE
783,THOR,How long will it take to heat?,MALE
784,EITRI,"A few minutes, maybe more. Why?",MALE
785,THOR,I'm gonna hold it open.,MALE
786,EITRI,That's suicide.,MALE
787,THOR,So is facing Thanos without that ax.,MALE
788,NATASHA ROMANOFF,"How we looking, Bruce?",FEMALE
789,BRUCE BANNER,"Yeah, I think I'm getting the hang of it. Wow! It's like being the Hulk without actually--  I'm okay. I'm okay.",MALE
790,JAMES RHODES,I got two heat signatures breaking through the tree line.,MALE
791,JABARI WARRIORS,MIE EFFA! YA HU! MIE EFFA! YA HU! MIE EFFA! YA HU! MIE EFFA! YA HU! MIE EFFA! YA HU!,MALE
792,T'CHALA,Thank you for standing with us.,MALE
793,M'BAKU,"Of course, brother.",MALE
794,NATASHA ROMANOFF,Where's your other friend?,FEMALE
795,PROXIMA MIDNIGHT,You will pay for his life with yours. Thanos will have that stone.,FEMALE
796,STEVE ROGERS,That's not gonna happen.,MALE
797,T'CHALA,You are in Wakanda now. Thanos will have nothing but dust and blood.,MALE
798,PROXIMA MIDNIGHT,We... have blood to spare.,FEMALE
799,BUCKY,Did they surrender?,MALE
800,STEVE ROGERS,Not exactly.,MALE
801,BUCKY,What the hell.,MALE
802,NATASHA ROMANOFF,Looks like we pissed her off.,FEMALE
803,OKOYE,They're killing themselves.,FEMALE
804,SAM WILSON,You seen the teeth on those things?,MALE
805,JAMES RHODES,"Alright, back up, Sam. You're gonna get your wings singed.",MALE
806,BRUCE BANNER,"Cap, if these things circle the perimeter and get in behind us... there's nothing between them and Vision.",MALE
807,STEVE ROGERS,Them we better keep 'em in front of us.,MALE
808,OKOYE,How do we do that?,FEMALE
809,T'CHALA,"We open the barrier.  On my signal, open North-West Section Seventeen.",MALE
810,DOME CONTROL,"Requesting confirmation, my King. You said open the barrier?",MALE
811,T'CHALA,On my signal.,MALE
812,M'BAKU,This will be the end of Wakanda.,MALE
813,OKOYE,Then it will be the noblest ending in history.,FEMALE
814,T'CHALA,WAKANDA FOREVER!!!!  Now!,MALE
815,T'CHALA,"How much longer, Shuri?",MALE
816,SHURI,"We've barely begun, brother.",FEMALE
817,T'CHALA,You might want to pick up the pace.,MALE
818,THOR,"Allfathers, give me strength.",MALE
819,EITRI,"You understand, boy? You're about to take the full force of a star. It'll kill you.",MALE
820,THOR,Only if I die.,MALE
821,EITRI,"Yes. That's what... ""killing you"" means.",MALE
822,EITRI,"Hold it! Hold it, Thor!",MALE
823,ROCKET,"Thor! Say something. Come on. Thor, you okay?",MALE
824,ROCKET,I think he's dying!,MALE
825,EITRI,"He needs the ax! Where's the handle? Tree, help me find the handle!",MALE
826,BRUCE BANNER,There’s too many of them! GYAH! AAAAHHHHH!,MALE
827,BRUCE BANNER,AH-hahaha! You guys are so screwed now!,MALE
828,THOR,BRING ME THANOS!,MALE
829,STEPHEN STRANGE,"Oh, yeah, you're much more of a ""Thanos.""",MALE
830,THANOS,"I take it the Maw is dead. This day extracts a heavy toll. Still, he accomplished his mission.",MALE
831,STEPHEN STRANGE,You may regret that. He brought you face-to-face with the Master of the Mystic Arts.,MALE
832,THANOS,And where do you think he brought you?,MALE
833,STEPHEN STRANGE,Let me guess. Your home?,MALE
834,THANOS,"It was. And it was beautiful.  Titan was like most planets. Too many mouths, and not enough to go around. And when we faced extinction, I offered a solution.",MALE
835,STEPHEN STRANGE,Genocide.,MALE
836,THANOS,"But at random, dispassionate, fair to rich and poor alike. They called me a madman. And what I predicted came to pass.",MALE
837,STEPHEN STRANGE,Congratulations. You're a prophet.,MALE
838,THANOS,I'm a survivor.,MALE
839,STEPHEN STRANGE,Who wants to murder trillions.,MALE
840,THANOS,"With all six stones, I could simply snap my fingers, and they would all cease to exist. I call that... mercy.",MALE
841,STEPHEN STRANGE,And then what?,MALE
842,THANOS,I finally rest... and watch the sun rise on a grateful universe. The hardest choices require the strongest wills.,MALE
843,STEPHEN STRANGE,I think... you'll find... our will... equal to yours.,MALE
844,THANOS,Ours?,MALE
845,TONY STARK,"Piece of cake, Quill.",MALE
846,PETER QUILL,"Yeah, if your goal was to piss him off!",MALE
847,PETER QUILL,Boom!,MALE
848,STEPHEN STRANGE,Do not let him close his fist.,MALE
849,PETER PARKER,Magic!  More magic!  Magic with a kick!  Magic with a--,MALE
850,THANOS,Insect!,MALE
851,THANOS,"Well, well.",MALE
852,NEBULA,You should have killed me.,FEMALE
853,THANOS,It would've been a waste of parts!,MALE
854,NEBULA,Where's Gamora?!,FEMALE
855,TONY STARK,Is he under? Don't let up.,MALE
856,MANTIS,Be quick. He is very strong.,MALE
857,TONY STARK,"Parker, help! Get over here.  She can't hold him much longer. Let's go.",MALE
858,PETER QUILL,"I thought you'd be harder to catch. For the record, this was my plan. Not so strong now, huh? Where is Gamora?",MALE
859,THANOS,My Gamora...?,MALE
860,PETER QUILL,"No, bull-shit. Where is she?",MALE
861,MANTIS,He is in anguish.,MALE
862,PETER QUILL,Good.,MALE
863,MANTIS,He… he mourns.,MALE
864,DRAX,What does this monster have to mourn?,MALE
865,NEBULA,Gamora.,FEMALE
866,PETER QUILL,What?,MALE
867,NEBULA,He took her to Vormir. He came back with the Soul Stone... but she didn't.,FEMALE
868,TONY STARK,"Okay, Quill, you gotta cool it right now, you understand?",MALE
869,TONY STARK,"Don't, don't, don't engage, we've almost got this off!",MALE
870,PETER QUILL,Tell me she's lying.  Asshole! Tell me you didn't do it!,MALE
871,THANOS,I... had... to.,MALE
872,PETER QUILL,"No, you didn't…! No, you didn't…!  NO, YOU DIDN'T!",MALE
873,TONY STARK,Quill!,MALE
874,TONY STARK,"Hey, stop! Hey, stop! Stop! Hey, stop! Stop!",MALE
875,PETER PARKER,It's coming! It's coming! It's coming!  I got it! I got it.... !,MALE
876,PETER PARKER,"Oh, God.",MALE
877,ROCKET,"Come and get some, space dogs!  Come on, get some, get some! Come on, get some!  How much for the gun?",MALE
878,BUCKY,Not for sale.,MALE
879,ROCKET,"Okay, how much for the arm?  Oh, I'll get that arm.",MALE
880,STEVE ROGERS,New haircut?,MALE
881,THOR,Notice you've copied my beard.,MALE
882,THOR,"By the way, this is a friend of mine. Tree.",MALE
883,GROOT,I AM GROOT!,MALE
884,STEVE ROGERS,I am Steve Rogers.,MALE
885,T'CHALA,Fall back! Fall back now!,MALE
886,JAMES RHODES,"Focus that fire on the left flank, Sam.",MALE
887,SAM WILSON,I'm doing it.,MALE
888,OKOYE,Why was she up there all this time?,FEMALE
889,PROXIMA MIDNIGHT,She's on the field. Take it.,FEMALE
890,SAM WILSON,"Guys, we got a Vision situation here.",MALE
891,STEVE ROGERS,Somebody get to Vision!,MALE
892,BRUCE BANNER,I got him!,MALE
893,WANDA MAXIMOFF,On my way.,FEMALE
894,PROXIMA MIDNIGHT,He'll die alone. As will you.,FEMALE
895,NATASHA ROMANOFF,She's not alone.,FEMALE
896,PROXIMA MIDNIGHT,Euuyaaah!,FEMALE
897,BRUCE BANNER,"Oh no, oh no you don't. This isn't going to be like New York, pal. This suit's already kicked the crap out of the Hulk--",MALE
898,BRUCE BANNER,"Guys! Vision needs backup now!   Hulk. Hulk, I know you like making your entrance at the last second, well, this is it, man. This is the last, last second.  Ahhhhh! Hulk! Hulk! HULK!",MALE
899,HULK,NOOOO!!!,MALE
900,BRUCE BANNER,"Oh, screw you, ya big green asshole! I'll do it myself!  Come on!",MALE
901,BRUCE BANNER,"See you later, Alligator!  Hulk, we got a lot to figure out, pal.",MALE
902,CORVUS GLAIVE,"I thought you were formidable, machine. But you're dying, like any man.",MALE
903,STEVE ROGERS,Get outta here!  GO!,MALE
904,NATASHA ROMANOFF,That was really gross.,FEMALE
905,STEVE ROGERS,I thought I told you to go.,MALE
906,VISION,"We don't trade lives, Captain.",MALE
907,PETER PARKER,I got you! I got you!  I'm sorry I can't remember anybody's names!,MALE
908,THANOS,"You're full of tricks, wizard.",MALE
909,STEPHEN STRANGE,No!,MALE
910,THANOS,Yet you never once used your greatest weapon.  A fake.,MALE
911,TONY STARK,"You throw another moon at me, and I'm gonna to lose it.",MALE
912,THANOS,Stark.,MALE
913,TONY STARK,You know me?,MALE
914,THANOS,I do. You're not the only one cursed with knowledge.,MALE
915,TONY STARK,My only curse is you.,MALE
916,THANOS,Come on!,MALE
917,THANOS,All that for a drop of blood.,MALE
918,THANOS,"You have my respect, Stark. When I'm done, half of humanity will still be alive.  I hope they remember you.",MALE
919,STEPHEN STRANGE,Stop!  Spare his life... and I will give you the stone.,MALE
920,THANOS,No tricks.,MALE
921,TONY STARK,Don't...!,MALE
922,THANOS,One to go.,MALE
923,PETER QUILL,Where is he?!,MALE
924,PETER QUILL,Did we just lose?,MALE
925,TONY STARK,Why would you do that?,MALE
926,STEPHEN STRANGE,We're in the Endgame now.,MALE
927,M'BAKU,MAYEFA!,MALE
928,JABARI WARRIORS,YA HU HU!,MALE
929,WANDA MAXIMOFF,Are you okay?  What? What is it?,FEMALE
930,VISION,He's here.,MALE
931,STEVE ROGERS,"Everyone, on my position. We have incoming.",MALE
932,NATASHA ROMANOFF,What the hell?,FEMALE
933,BRUCE BANNER,Cap. That's him.,MALE
934,STEVE ROGERS,Eyes up. Stay sharp.,MALE
935,VISION,Wanda. It's time.,MALE
936,WANDA MAXIMOFF,No.,FEMALE
937,VISION,"They can't stop him, Wanda, but we can. Look at me. You have the power to destroy the stone.",MALE
938,WANDA MAXIMOFF,Don't.,FEMALE
939,VISION,"You must do it. Wanda, please. We. Are. Out of time.",MALE
940,WANDA MAXIMOFF,I can't.,FEMALE
941,VISION,"Yes, you can. You can. If he gets the stone, half the universe dies.",MALE
942,WANDA MAXIMOFF,It's not fair.,FEMALE
943,VISION,"It shouldn't be you, but it is. It's all right. You could never hurt me. I just... feel you.",MALE
944,VISION,It's all right. It's all right. I love you.,MALE
945,THANOS,"I understand, my child. Better than anyone.",MALE
946,WANDA MAXIMOFF,You could never.,FEMALE
947,THANOS,"Today, I lost more than you can know. But now is no time to mourn. Now... is no time at all.",MALE
948,WANDA MAXIMOFF,No!,FEMALE
949,THOR,I told you. You'd die for that!,MALE
950,THANOS,You should have... you...  You should have gone for the head!,MALE
951,THOR,NO!,MALE
952,THANOS,Daughter?,MALE
953,GAMORA,Did you do it?,MALE
954,THANOS,Yes.,MALE
955,GAMORA,What did it cost?,MALE
956,THANOS,Everything.,MALE
957,THOR,What'd you do?  WHAT'D YOU DO?!,MALE
958,STEVE ROGERS,Where'd he go? Thor... where'd he go?,MALE
959,BUCKY,Steve?,MALE
960,T'CHALA,"Up, General. Up! This is no place to die.",MALE
961,OKOYE,Kumkani?!,FEMALE
962,GROOT,I am Groot...,MALE
963,ROCKET,"No... no. No. No. No! Groot, no...",MALE
964,JAMES RHODES,"Sam?  Sam, where you at?!",MALE
965,MANTIS,Something's happening.,MALE
966,DRAX,Quill?,MALE
967,TONY STARK,"Steady, Quill.",MALE
968,PETER QUILL,"Aw, man.",MALE
969,STEPHEN STRANGE,"Tony, there was no other way.",MALE
970,PETER PARKER,Mr. Stark?  I don't feel so good...,MALE
971,TONY STARK,You're all right?,MALE
972,PETER PARKER,"I don't know what's -- I don't know what's happening. I don't--  I don't wanna go, I don't wanna go, Mr. Stark, please. Please, I don't wanna go. I don't wanna go...  I'm sorry.",MALE
973,NEBULA,He did it.,FEMALE
974,JAMES RHODES,What is this? What the hell is happening?,MALE
975,STEVE ROGERS,"Oh, God.",MALE
976,NICK FURY,Still no word from Stark?,MALE
977,MARIA HILL,"No, not yet. We're watching every satellite in both hemispheres, there's still nothing.",FEMALE
978,NICK FURY,What is it?,MALE
979,MARIA HILL,Multiple bogeys over Wakanda.,FEMALE
980,NICK FURY,Same energy signatures as New York?,MALE
981,MARIA HILL,Ten times bigger.,FEMALE
982,NICK FURY,Tell Klein. We'll meet him at- -,MALE
983,MARIA HILL,"Nick, Nick!",FEMALE
984,NICK FURY,They okay?,MALE
985,MARIA HILL,There's no one here.,FEMALE
986,NICK FURY,Call Control. Code Red.,MALE
987,MARIA HILL,Nick?,FEMALE
988,NICK FURY,Hill?,MALE
989,NICK FURY,"Oh, no. Motherf--",MALE
