,character,line,gender
0,ODIN,"Long before the birth of light there was darkness, and from that darkness, came the Dark Elves. Millennia ago, the most ruthless of their kind, Malekith, sought to transform our universe back into one of eternal night.",MALE
1,ODIN,"Such evil was possible through the power of the Aether, an ancient force of infinite destruction.",MALE
2,ODIN,"The noble armies of Asgard, led by my father, King Bor, waged a mighty war against these creatures.",MALE
3,KURSE,Malekith! Asgard's forces are upon us.,MALE
4,MALEKITH,Send the Kursed.,MALE
5,ODIN,"As the Nine Worlds converged above him, Malekith could at last unleash the Aether...",MALE
6,ODIN,"But Asgard ripped the weapon from his grasp. Without it, the Dark Elves fell. With the battle all but lost, Malekith sacrificed his own people in a desperate attempt to lay waste to Asgard's army.",MALE
7,MALEKITH,Their deaths will mean our survival. This war is far from over.,MALE
8,ODIN,"Malekith was vanquished, and the Aether was no more. Or so we were led to believe.",MALE
9,ASGARDIAN EINHERJAR,"Sire, the Aether. Shall we destroy it?",MALE
10,BOR,If only we could. But its power is too great. Bury it deep. Somewhere no one will ever find it.,MALE
11,FRIGGA,Loki.,MALE
12,LOKI,"Hello, mother. Have I made you proud?",MALE
13,FRIGGA,"Please, don't make this worse.",MALE
14,LOKI,Define worse.,MALE
15,ODIN,Enough! I will speak to the prisoner alone.,MALE
16,LOKI,I really don't see what all the fuss is about.,MALE
17,ODIN,"Do you not truly feel the gravity of your crimes? Wherever you go there is war, ruin and death.",MALE
18,LOKI,I went down to Midgard to rule the people of Earth as a benevolent god. Just like you.,MALE
19,ODIN,"We are not gods. We are born, we live, we die. Just as humans do.",MALE
20,LOKI,Give or take 5000 years.,MALE
21,ODIN,All this because Loki desires a throne.,MALE
22,LOKI,It is my birthright.,MALE
23,ODIN,Your birthright was to die as a child. Cast out onto a frozen rock. If I had not taken you in you would not be here now to hate me.,MALE
24,LOKI,"If I am for the axe, then for mercy's sake, just swing it. It's not that I don't love our little talks, it's just ... I don't love them.",MALE
25,ODIN,Frigga is the only reason you are still alive and you will never see her again. You will spend the rest of your days in the dungeons.,MALE
26,LOKI,And what of Thor? You'll make that witless oaf king while I rot in chains?,MALE
27,ODIN,"Thor must strife to undo the damage you have done. He will bring order to the nine realms and then, yes. He will be king.",MALE
28,SIF,I've got this completely under control!,FEMALE
29,THOR,Is that why everything is on fire?,MALE
30,SIF,You're welcome.  All yours.,FEMALE
31,THOR,Hello.  I accept your surrender.,MALE
32,THOR,Anyone else?,MALE
33,FANDRAL,Perhaps next time we should start with the big one.,MALE
34,GUARD,Keep moving. Come on! Keep moving. Go ahead of me. Don't you turn around!,MALE
35,HOGUN,Where do we go next?,MALE
36,THOR,"Hogun, the peace is nearly won across the Nine Realms. You should stay here. Be with your people, where your heart is. Asgard can wait.",MALE
37,HOGUN,You have my thanks.,MALE
38,THOR,"As you have mine. Heimdall, when you're ready.",MALE
39,ODIN,Is Vanaheim secure?,MALE
40,THOR,As are Nornheim and Ria. Though our work would have gone more quickly with you at the fore.,MALE
41,ODIN,You must think I'm a piece of bread that needs to be buttered so heavily.,MALE
42,THOR,That was not my intent.,MALE
43,ODIN,"For the first time since the Bifrost was destroyed, the Nine Realms are at peace. They're well reminded of our strength and you have earned their respect and my gratitude.",MALE
44,THOR,Thank you.,MALE
45,ODIN,Nothing out of order except your confused and distracted heart.,MALE
46,THOR,"This isn't about JANE, Father.",MALE
47,ODIN,"Human lives are fleeting, they are nothing. You'd be better served by what lies in front of you  I'm telling you this not as the all-father but as your father. You are ready. The time has come for you to take the throne. Embrace and celebrate what you've won. Join your warriors. Eat and drink, revel in their celebration. At least pretend to enjoy yourself.",MALE
48,SIF,There was a time you would celebrate for weeks.,FEMALE
49,THOR,I remember you celebrated the battle of Haragon so much that you nearly started a second.,MALE
50,SIF,"Well, the first was so much fun.",FEMALE
51,SIF,Take a drink with me. Surely the All-Father could have no further task for you tonight.,FEMALE
52,THOR,"No, this is one I set myself.",MALE
53,SIF,It has not gone unnoticed that you disappear each night. There are Nine Realms. Future king of Asgard must focus on more than one.,FEMALE
54,THOR,"I thank you for your sword and for your counsel, good Lady Sif.",MALE
55,RICHARD,Hi.,MALE
56,JANE,Hi.,FEMALE
57,RICHARD,So what's the story with you?,MALE
58,JANE,"Why does there have to be a story, there's no story.",FEMALE
59,RICHARD,"You've spent the first ten minutes of our date hiding behind a menu that has three choices on it. It's either chicken, vegetarian or fish, Jane. I think there's a story and I'm thinking the story involves a guy?",MALE
60,JANE,It's complicated.,FEMALE
61,RICHARD,Is he still around?,MALE
62,JANE,"No, he...went away.",FEMALE
63,RICHARD,"I've been there. The going away, it's hard. I'd been seeing a woman and uh...she took a job in New York, eventually the distance killed it. And...and the fact that she uh...she kept sleeping with other dudes.",MALE
64,JANE,No!,FEMALE
65,RICHARD,"Oh, so many.",MALE
66,RICHARD,Hi. Um...could we get some wine please?,MALE
67,DARCY LEWIS,"Sure, I'd love some.",FEMALE
68,JANE,"Richard, this is Darcy.  What are you doing here?",FEMALE
69,RICHARD,"Oh, hello.",MALE
70,DARCY LEWIS,"So, I show up to work at the lab-slash-your mom's house, fully expecting you to be moping around in your pajamas eating ice cream obsessing about you know who...",FEMALE
71,RICHARD,Ah.,MALE
72,DARCY LEWIS,"But you're not! You're wearing lady clothes, you even showered, didn't you? You smell good.",FEMALE
73,JANE,"Is there a point to all this, cause there really has to be a point to all this.",FEMALE
74,DARCY LEWIS,Right. You know that scientific equipment you don't look at anymore? You might wanna start looking at it now,FEMALE
75,DARCY LEWIS,This is the reason we came all the way out here.,FEMALE
76,JANE,It's malfunctioning.,FEMALE
77,DARCY LEWIS,That's what I said.,FEMALE
78,DARCY LEWIS,That's what I did! But you just hit a little more scientific.,FEMALE
79,JANE,I'm sure it's nothing.,FEMALE
80,RICHARD,Yeah.,MALE
81,DARCY LEWIS,"It didn't look like nothing. Kind of looks like the readings that Erik was rambling about.  Our friend Erik, kind of went banana-balls.",FEMALE
82,JANE,He's not interested. I'm not interested. Time for you to go now.,FEMALE
83,DARCY LEWIS,Okay.,FEMALE
84,RICHARD,Short but sweet.,MALE
85,JANE,She needs help.,FEMALE
86,RICHARD,I think I'm gonna have the sea bass.,MALE
87,JANE,"Sea bass. Yeah, sea bass is good.",FEMALE
88,JANE,"Sea bass, sea bass, sea bass, sea bass, sea bass, sea bass, sea bass...sea bass. Sea bass...",FEMALE
89,RICHARD,"Jane, maybe you should stop saying sea bass and go out to your friend.",MALE
90,JANE,This was so fun.,FEMALE
91,RICHARD,"You know, I'll just stay here and say sea bass alone.",MALE
92,JANE,And I hate you.,FEMALE
93,DARCY LEWIS,What?! I thought he was cute.,FEMALE
94,JANE,Just shut up and drive.,FEMALE
95,JANE,Who's he?,FEMALE
96,DARCY LEWIS,He's my intern.,FEMALE
97,JANE,You have an intern?,FEMALE
98,DARCY LEWIS,"Oh, yeah.",FEMALE
99,IAN BOOTHBY,"Hello, Dr. Foster. It's uh...it's a great honor to be working with you.",MALE
100,JANE,Right. I have to call Erik.,FEMALE
101,IAN BOOTHBY,"Oh, uh...take a right.",MALE
102,IAN BOOTHBY,Left!,MALE
103,DARCY LEWIS,I have totally mastered driving in London.,FEMALE
104,JANE,"Hi, Erik, it's me again. Where are you? I came here because you said you were onto something and then vanished.",FEMALE
105,STONEHENGE TV NEWS REPORTER,"I'm here at Stonehenge, for what has been an interesting unfolding of events today. The police reported the scene shortly after 11 a.m. this morning, after a seemingly harmless rambler approached the area then started to strip naked and effectively terrorize tourists there with scientific equipment while shouting that he was trying to save them. The man later identified as noted Astrophysicist Dr. Erik Selvig has been called in for questioning by police.",MALE
106,DARCY LEWIS,"Come on, this is exciting! Look, the intern is excited.",FEMALE
107,IAN BOOTHBY,Ian.,MALE
108,DARCY LEWIS,Do you want the phase meter?,FEMALE
109,JANE,No.,FEMALE
110,DARCY LEWIS,Bring the phase meter.,FEMALE
111,DARCY LEWIS,The toaster looking thing.,FEMALE
112,IAN BOOTHBY,I know what the phase meter is.,MALE
113,JANE,How do I change the ring tone on this thing?,FEMALE
114,DARCY LEWIS,An Astrophysicist with three degrees should be able to change her own ring tone.,FEMALE
115,JANE,Why are you calling me?,FEMALE
116,DARCY LEWIS,"I didn't want to shout.  Intern, the entrance is this way.",FEMALE
117,IAN BOOTHBY,Ian. My name's Ian.,MALE
118,DARCY LEWIS,I am not getting stabbed in the name of science.,FEMALE
119,DARCY LEWIS,"It's okay, we're Americans!",FEMALE
120,JANE,Is that supposed to make them like us?,FEMALE
121,MADDIE,Make it go away...,FEMALE
122,NAVID,Ssh!,MALE
123,JANE,"Oh, they're kids.",FEMALE
124,MADDIE,Are you the police?,FEMALE
125,JANE,"No, we're scientists. Well, I am.",FEMALE
126,DARCY LEWIS,Thanks.,FEMALE
127,NAVID,We just found it.,MALE
128,JANE,Can you show us?,FEMALE
129,DARCY LEWIS,That doesn't seem rigged.,FEMALE
130,DARCY LEWIS,Where did it go?,FEMALE
131,DARCY LEWIS,That's...that's incredible.,FEMALE
132,DARCY LEWIS,What happened?,FEMALE
133,MADDIE,"Sometimes they come back, sometimes they don't.",FEMALE
134,DARCY LEWIS,"I want to throw something. Jane, give me your shoe.",FEMALE
135,JANE,I haven't seen readings like this since...,FEMALE
136,DARCY LEWIS,New Mexico?,FEMALE
137,JANE,Don't touch anything!,FEMALE
138,DARCY LEWIS,Give me your shoe.,FEMALE
139,DARCY LEWIS,Where those the car keys?,FEMALE
140,JANE,Darcy!,FEMALE
141,MALEKITH,The Aether awakens us. The Convergence returns.,MALE
142,HEIMDALL,You're late.,MALE
143,THOR,Merriment can sometimes be a heavier burden than battle.,MALE
144,HEIMDALL,Then you're doing one of them incorrectly.,MALE
145,THOR,Perhaps. How fare the stars?,MALE
146,HEIMDALL,Still shining. From here I can see Nine Realms and ten trillion souls.,MALE
147,HEIMDALL,You recall what I told you of the Convergence?,MALE
148,THOR,"Yes, the alignment of the worlds. It approaches, doesn't it?",MALE
149,HEIMDALL,"The universe hasn't seen this marvel since before my watch began. Few can sense, even fewer can see it. A world that's infected can be dangerous. It is truly beautiful.",MALE
150,THOR,I see nothing.,MALE
151,HEIMDALL,Or perhaps that is not the beauty you seek.,MALE
152,THOR,How is she?,MALE
153,HEIMDALL,"She's quite clever, your mortal. She doesn't know it yet, but she studies the Convergence as well. Even...",MALE
154,THOR,What?,MALE
155,HEIMDALL,I can't see her.,MALE
156,DARCY LEWIS,Jane! Where the hell were you?,FEMALE
157,JANE,Tell me you didn't call the police!,FEMALE
158,DARCY LEWIS,What was I supposed to do?,FEMALE
159,JANE,Not call the police!,FEMALE
160,DARCY LEWIS,I was freaking out.,FEMALE
161,JANE,"You call the cops they tell the feds, the next thing you know we have SHIELD crawling all over area fifty-one-ing the place.",FEMALE
162,DARCY LEWIS,Jane!,FEMALE
163,JANE,"We had a stable gratification anomaly, we had unheeded access. Our only competition was ten years old!",FEMALE
164,DARCY LEWIS,"Jane, you were gone for five hours!",FEMALE
165,JANE,What?,FEMALE
166,DARCY LEWIS,That's weird.  Typical.,FEMALE
167,THOR,Jane.,MALE
168,JANE,"Sorry. I just needed to make sure you were real, it's been a very strange day.",FEMALE
169,THOR,"Well, I am. Jane...",MALE
170,JANE,Where were you?!,FEMALE
171,THOR,Where were you? Heimdall could not see you.,MALE
172,JANE,I was right here where you left me. I was waiting and then I was crying and then I went out looking for you. You said you were coming back,FEMALE
173,THOR,"I know, I know, but the Bifrost was destroyed. The Nine Realms erupted into chaos, wars were raging, marauding hordes were pillaging. I had to put an end to the slaughter.",MALE
174,JANE,"As excuses go, that's not terrible. But I saw you on TV, you were...you were in New York!",FEMALE
175,THOR,"Jane, I fought to protect you from the dangers of my world, but I was wrong, I was a fool.  I believe that fate brought us together. Jane, I don't know where you were or what happened, but I do know this.",MALE
176,JANE,What?,FEMALE
177,THOR,I know...,MALE
178,JANE,You do?,FEMALE
179,THOR,Do what?,MALE
180,JANE,Hey! Is that you?,FEMALE
181,JANE,Uh...we're kind of in the middle of something.,FEMALE
182,DARCY LEWIS,Um...I'm pretty sure we are getting arrested.,FEMALE
183,JANE,Hold that thought.,FEMALE
184,DARCY LEWIS,"Look at you, still all muscly and everything. How's space?",FEMALE
185,THOR,Space is fine.,MALE
186,JANE,Excuse me?,FEMALE
187,POLICE OFFICER #1,Are you Jane Foster?,MALE
188,JANE,Yes.,FEMALE
189,POLICE OFFICER #1,Do you know this man?,MALE
190,JANE,He's my intern. My intern's intern.,FEMALE
191,POLICE OFFICER #1,"This is private property and you're trespassing, the lot of you. You'll have to come with me.",MALE
192,THOR,Jane! Jane?  You alright?,MALE
193,JANE,What just happened?,FEMALE
194,POLICE OFFICER #2,"Place your hands on your head, step back!",MALE
195,THOR,The woman is unwell.,MALE
196,POLICE OFFICER #2,She's dangerous.,MALE
197,THOR,So am I.,MALE
198,POLICE OFFICER #2,Requesting armed response officers to the scene.,MALE
199,THOR,Hold on to me.,MALE
200,JANE,What are you doing?,FEMALE
201,DARCY LEWIS,Holy shit!,FEMALE
202,JANE,We have to do that again.  Hi.,FEMALE
203,HEIMDALL,Welcome to Asgard.,MALE
204,MALEKITH,"Look at my legacy, Algrim. I barely remember the time before light.",MALE
205,KURSE,Our survival will be your legacy.,MALE
206,MALEKITH,The Asgardians will suffer as we have suffered. I will reclaim the Aether. I will restore our world and I'll put an end to this poisonous world.,MALE
207,JANE,What's that?,FEMALE
208,EIR,Be still.,FEMALE
209,THOR,"This is not of Earth, what is it?",MALE
210,ASGARDIAN NURSE,"We do not know, but she will not survive the amount of energy surging within her.",FEMALE
211,JANE,"That's a quantum field generator, isn't it?",FEMALE
212,EIR,It's a Soul Forge.,FEMALE
213,JANE,Does a Soul Forge transfer molecular energy from one place to another?,FEMALE
214,EIR,Yes.,FEMALE
215,JANE,It's a quantum field generator.,FEMALE
216,ODIN,My words are mere noises to you that you ignore them completely?,MALE
217,THOR,She's ill.,MALE
218,ODIN,She is mortal. Illness is their defining trait.,MALE
219,THOR,I brought here because we can help her.,MALE
220,ODIN,She does not belong here in Asgard anymore than a goat belongs at a banquet table.,MALE
221,JANE,Did he just...?  Who do you think you are?,FEMALE
222,ODIN,I'm Odin. King of Asgard. Protector of the Nine Realms.,MALE
223,JANE,"Oh. Well, I'm...",FEMALE
224,ODIN,"I know very well who you are, Jane Foster.",MALE
225,JANE,You told your Dad about me?,FEMALE
226,THOR,"Something is within her, father, something I have not seen before.",MALE
227,ODIN,"Her world has its healers, their called doctors, let them deal with it. Guards, take her back to Midgard.",MALE
228,THOR,"Don't touch her.  Jane, are you alright?",MALE
229,ODIN,That's impossible.,MALE
230,EIR,"The infection, it's defending her.",FEMALE
231,THOR,"No, it's defending itself.",MALE
232,ODIN,"Come with me. There are relics that predate the universe itself. What lies within her appears to be one of them. The Nine Realms are not eternal. They had a dawn as they will have a dusk.  But before that dawn the dark forces, the Dark Elves, reigned absolute and unchallenged.",MALE
233,THOR,"""Born of eternal night, the Dark Elves comes to steal away your light."" They were these stories mother told us as children.",MALE
234,ODIN,"Their leader, Malekith made a weapon out of that darkness, it was called the Aether. While the other relics often appeared as stones, the Aether is fluid and ever changing. It changes matter into dark matter and seeks out to host bodies, drawing strength from their life force. Malekith sought to use the Aether's power to return the universe to one of darkness. But after eternities of blood shed, my father Bor, finally triumphed, ushering in the peace that lasted thousands of years.",MALE
235,JANE,What happened?,FEMALE
236,ODIN,He killed them all.,MALE
237,THOR,Are you certain? The Aether was said to have been destroyed with them and yet here it is.,MALE
238,ODIN,The Dark Elves are dead.,MALE
239,JANE,Does your book happen to mention how to get it out of me?,FEMALE
240,ODIN,"No, it does not.",MALE
241,MALEKITH,The Realms will be aligned soon.,MALE
242,MALEKITH,You'll be the last of the Kursed.,MALE
243,KURSE,Let my life be sacrificed. The same as our people.,MALE
244,MALEKITH,"You will become darkness, doomed to this existence until it consumes you.  And then no power of our enemies will stop me.",MALE
245,KURSE,I'll destroy their defenses and resurrect the universe.,MALE
246,LOKI,Odin continues to bring me new friends. How thoughtful.,MALE
247,FRIGGA,"The books I sent, do they not interest you?",MALE
248,LOKI,"Is that how I'm to while away eternity, reading?",MALE
249,FRIGGA,"I've done everything in my power to make you comfortable, Loki.",MALE
250,LOKI,Have you? Does Odin share your concern? Does Thor? It must be so inconvenient them asking after me day and night.,MALE
251,FRIGGA,You know full well it was your actions that brought you here.,MALE
252,LOKI,"My actions. I was merely giving truth to the lie that I had been fed my entire life, that I was born to be a king.",MALE
253,FRIGGA,A king? A true king admits his faults. What of the lives you took on Earth?,MALE
254,LOKI,A mere handful compared to the number that Odin has taken himself.,MALE
255,FRIGGA,Your father...,MALE
256,LOKI,He's not my father!,MALE
257,FRIGGA,Then am I not your mother?,MALE
258,LOKI,You're not.,MALE
259,FRIGGA,Always so perceptive about everyone but yourself.,MALE
260,JANE,"When you came for me, you knew I was in trouble.",FEMALE
261,THOR,"Well Heimdall had lost sight of you, you were no longer on Earth.",MALE
262,JANE,"Well, how's that possible?",FEMALE
263,THOR,"I believe you were in between worlds. The Nine Realms travel within Yggdrasil, orbiting Midgard in much the way your planet orbits the sun. Every five thousand years the worlds align perfectly, we call this the Convergence.  During this time the boarders between worlds become blurred. It's possible you found one of these points. We are lucky that it remained open. Once the worlds pass out of alignment, the connection is lost.",MALE
264,JANE,I liked the way you explained that. What's gonna happen to me?,FEMALE
265,THOR,"I'll find a way to save you, Jane.",MALE
266,JANE,Your father said there was...,FEMALE
267,THOR,My father doesn't know everything.,MALE
268,FRIGGA,Don't let him hear you say that.,MALE
269,THOR,"JANE, please meet Frigga, the Queen of Asgard, my mother.",MALE
270,JANE,Hi.,FEMALE
271,LOKI,You might want to take the stairs to the left.,MALE
272,FRIGGA,The prisons.,MALE
273,THOR,Loki.,MALE
274,FRIGGA,"Go, I will look after her.",MALE
275,FANDRAL,It's as if they resent being imprisoned.,MALE
276,VOLSTAGG,There's no pleasing some creatures.,MALE
277,THOR,"Return to your cells and further harm will come to you. You have my word.  Very well, you don't have my word.",MALE
278,ODIN,"Send a squadron to the weapons vault, defend it at all costs. Seal the dungeon.",MALE
279,FRIGGA,Odin.,MALE
280,ODIN,"Frigga.  Go!  It's a skirmish, nothing to fear.",MALE
281,FRIGGA,You've never been a very good liar.,MALE
282,ODIN,"Take her to you chambers, I'll come for you when it's safe.",MALE
283,FRIGGA,You take care.,MALE
284,ODIN,"Despite all I have survived, my queen still worries over me.",MALE
285,FRIGGA,"It's only because I worry over you that you have survived.  Listen to me now, I need you to do everything I ask and no questions.",MALE
286,JANE,"Yes, ma'am.",FEMALE
287,ODIN,Frigga.,MALE
288,FRIGGA,"Stand down, creature. You may still survive this.",MALE
289,MALEKITH,"I have survived worse, woman.",MALE
290,FRIGGA,Who are you?,MALE
291,MALEKITH,"I am Malekith, and I would have what it is mine.  You have taken something, child. Give it back.  Witch! Where is the Aether?",MALE
292,FRIGGA,I'll never tell.,MALE
293,MALEKITH,I believe you.,MALE
294,SELVIG,"The universe rotates on a five thousand year cycle, and once its cycled all the worlds align.  Imagine...imagine that this is our world, and...and...  Oh, thank you. And this is another world. Normally they're separate, but during the alignment everything is connected. All Nine Realms, all Nine Realms are passing through each other and gravity, light, and even matter, is crunching from one world to the other.  But if this happens to us now, the result would be cataclysmic.  My gravimetric spikes can stabilize the focal point of the Convergence.  This time the alignment, and all the other worlds, would just pass up by. It's beautiful. It's simple. Any questions?",FEMALE
295,PATIENT,Yeah. Can I have my shoe back?,MALE
296,KURSE,"I need your strength to reclaim the Aether. And when you wake up, you will kill them all.",MALE
297,ASGARDIAN EINHERJAR,Jane Foster. You need to come with us.,MALE
298,FANDRAL,"We are still unable to restore the palace shields. Our artillery cannot detect them, even Heimdall cannot see them. My King, we are all but defenseless.",MALE
299,THOR,She's your prisoner now?  Leave us.,MALE
300,ODIN,I do not wish to fight with you.,MALE
301,THOR,"Nor I with you, but I intend to pursue Malekith.",MALE
302,ODIN,"We possess the Aether, Malekith will come to us.",MALE
303,THOR,"Yes, and you will destroy us.",MALE
304,ODIN,You overestimate the power of these creatures.,MALE
305,THOR,"No, I value our peoples lives. I'll take Jane to the Dark World and draw the enemy away from Asgard. When Malekith pulls the Aether from Jane it will be exposed vulnerable, and I will destroy it and him.",MALE
306,ODIN,"If you fail, you risk this weapon falling into the hands of our enemies.",MALE
307,THOR,The risk is far greater if we do nothing. His ship could be over our heads right now and we'd never even know it.,MALE
308,ODIN,"If and when he comes, his men will fall by ten thousand Asgardian blades.",MALE
309,THOR,And how of our men shall fall on theirs?,MALE
310,ODIN,"As many as are needed!  We will fight! Until the last Asgardian breath, the last drop of Asgardian blood.",MALE
311,THOR,And how are you different from Malekith?,MALE
312,ODIN,"The difference, my son, is that I will win.",MALE
313,DARCY LEWIS,Jane isn't called me back. Erik isn't calling me back. Stupid SHIELD isn't calling me back!,FEMALE
314,IAN BOOTHBY,What's SHIELD?,MALE
315,DARCY LEWIS,"It's a secret.  Uh...hey, Erik. It's Darcy again. Uh...Thor came back, he took Jane to Asgard and um...I'm not sure what I'm supposed to do.",FEMALE
316,NEWS REPORTER,"Something else went missing this week when Astrophysicist, SELVIG, notable for his involvement in the Alien invasion in New York streaked nude across Stonehenge.",MALE
317,IAN BOOTHBY,"Darcy, you really need to look at this. Your friend Erik, what was his last name again?",MALE
318,NEWS REPORTER,...disrobed and began shouting at visitors at the historic site. He was later taken into police custody for psychiatric evaluation. The police are still refusing to confirm...,MALE
319,THOR,You're not in Odin's war council?,MALE
320,HEIMDALL,The Bifrost is closed by your father's orders. No one is to come or to go.  We face an enemy that is invisible even to me. Of what use is a guardian such as that?,MALE
321,THOR,"Malekith will return, you know this. I'll need your help.",MALE
322,HEIMDALL,"I cannot overrule my King's wishes, not even for you.",MALE
323,THOR,"I'm not asking you to. The Realms need their All-Father strong and unchallenged, whether he is or not. But he is blinded, Heimdall, by hatred and by grief.",MALE
324,HEIMDALL,As are we all.,MALE
325,THOR,Well I see clearly enough.,MALE
326,HEIMDALL,The risks are too great.,MALE
327,THOR,"Everything that we do from here on is a risk, there is no other way.",MALE
328,HEIMDALL,What do you require of me?,MALE
329,THOR,"What I'm about to ask of you is treason of the highest order. Success will bring us exile and failure shall mean our death. Malekith knew the Aether was here, he can sense its power. If we do nothing he will come for it again, but this time lay waste to all of Asgard.  We must move Jane off world.",MALE
330,SIF,The Bifrost has been shut down and the Tesseract locked away in a vault.,FEMALE
331,HEIMDALL,"There are other paths off Asgard, ways known only to a few.",MALE
332,THOR,"One, actually.",MALE
333,VOLSTAGG,No.,MALE
334,LOKI,"Thor, after all this time and now you come to visit me. Why? Have you come to gloat? To mock?",MALE
335,THOR,"Loki, enough. No more illusions.",MALE
336,LOKI,"Now you see me, brother.  Did she suffer?",MALE
337,THOR,I did not come here to share our grief. Instead I offer you the chance of a far richer sacrament.,MALE
338,LOKI,Go on.,MALE
339,THOR,"I know you seek vengeance as much as I do. You help me escape Asgard and I will grant it to you, vengeance. And afterward, this cell.",MALE
340,LOKI,You must be truly desperate to come to me for help. What makes you think you can trust me?,MALE
341,THOR,"I don't. Mother did. You should know that when we fought each other in the past, I did so with a glimmer of hope that my brother was still in there somewhere. That hope no longer exists to protect you. You betray me and I will kill you.",MALE
