character,line,gender,admiration,amusement,anger,annoyance,approval,caring,confusion,curiosity,desire,disappointment,disapproval,disgust,embarrassment,excitement,fear,gratitude,grief,joy,love,nervousness,optimism,pride,realization,relief,remorse,sadness,surprise,neutral
SON,Baba?,MALE,0.9987362027168274,0.0,0.0,0.0,0.0,0.0,0.0,0.0,0.0,0.0,0.0,0.0,0.0,0.0,0.0,0.0,0.0,0.0,0.0,0.0,0.0,0.0,0.0,0.0,0.0,0.0,0.0,0.0
FATHER,"Yes, my son?",MALE,0.32105886936187744,0.0,0.0,0.0,0.0,0.0,0.0,0.0,0.8125936388969421,0.0,0.0,0.0,0.0,0.0,0.0,0.0,0.0,0.0,0.0,0.0,0.0,0.0,0.0,0.0,0.0,0.0,0.0,0.0
SON,Tell me a story.,MALE,0.8024330735206604,0.0,0.0,0.0,0.0,0.0,0.0,0.0,0.582115888595581,0.0,0.0,0.0,0.0,0.0,0.0,0.0,0.0,0.0,0.0,0.0,0.0,0.0,0.0,0.0,0.0,0.0,0.0,0.0
FATHER,Which one?,MALE,0.0,0.0,0.0,0.0,0.0,0.0,0.0,0.0,0.9291441440582275,0.0,0.0,0.0,0.0,0.0,0.0,0.0,0.0,0.0,0.0,0.0,0.0,0.0,0.0,0.0,0.0,0.0,0.0,0.0
SON,The story of home.,MALE,0.9987227320671082,0.0,0.0,0.0,0.0,0.0,0.0,0.0,0.0,0.0,0.0,0.0,0.0,0.0,0.0,0.0,0.0,0.0,0.0,0.0,0.0,0.0,0.0,0.0,0.0,0.0,0.0,0.0
FATHER,"Millions of years ago, a meteorite made of vibranium, the strongest substance in the universe struck the continent of Africa affecting the plant life around it.",MALE,0.5747731328010559,0.0,0.0,0.0,0.0,0.0,0.0,0.0,0.0,0.0,0.3039858937263489,0.0,0.0,0.0,0.0,0.0,0.0,0.0,0.0,0.0,0.0,0.0,0.0,0.0,0.0,0.0,0.0,0.0
FATHER,"And when the time of man came, five tribes settled on it and called it Wakanda. The tribes lived in constant war with each other until a warrior shaman received a vision from the Panther goddess Bast who led him to the Heart Shaped Herb, a plant that granted him super human strength, speed, and instincts.",MALE,0.9954981803894043,0.0,0.0,0.0,0.0,0.0,0.0,0.0,0.0,0.0,0.0,0.0,0.0,0.0,0.0,0.0,0.0,0.0,0.0,0.0,0.0,0.0,0.0,0.0,0.0,0.0,0.0,0.0
FATHER,"The warrior became King and the first Black Panther, the protector of Wakanda.",MALE,0.9956401586532593,0.0,0.0,0.0,0.0,0.0,0.0,0.0,0.0,0.0,0.0,0.0,0.0,0.0,0.0,0.0,0.0,0.0,0.0,0.0,0.0,0.0,0.0,0.0,0.0,0.0,0.0,0.0
FATHER,"Four tribes agreed to live under the King's rule, but the Jabari tribe isolated themselves in the mountains.",MALE,0.9955831170082092,0.0,0.0,0.0,0.0,0.0,0.0,0.0,0.0,0.0,0.0,0.0,0.0,0.0,0.0,0.0,0.0,0.0,0.0,0.0,0.0,0.0,0.0,0.0,0.0,0.0,0.0,0.0
FATHER,"The Wakandans used vibranium to develop technology more advanced than any other nation, but as Wakanda thrived the world around it descended further into chaos.",MALE,0.9966062307357788,0.0,0.0,0.0,0.0,0.0,0.0,0.0,0.0,0.0,0.0,0.0,0.0,0.0,0.0,0.0,0.0,0.0,0.0,0.0,0.0,0.0,0.0,0.0,0.0,0.0,0.0,0.0
FATHER,"To keep vibranium safe, the Wakandans vowed to hide in plain sight, keeping the truth of their power from the outside world.",MALE,0.9979616403579712,0.0,0.0,0.0,0.0,0.0,0.0,0.0,0.0,0.0,0.0,0.0,0.0,0.0,0.0,0.0,0.0,0.0,0.0,0.0,0.0,0.0,0.0,0.0,0.0,0.0,0.0,0.0
SON,And we still hide Baba?,MALE,0.5118073225021362,0.0,0.0,0.0,0.0,0.0,0.0,0.93167644739151,0.0,0.0,0.0,0.0,0.0,0.0,0.0,0.0,0.0,0.0,0.0,0.0,0.0,0.0,0.0,0.0,0.0,0.0,0.0,0.0
FATHER,Yes.,MALE,0.0,0.0,0.0,0.0,0.0,0.9710626006126404,0.0,0.0,0.0,0.0,0.0,0.0,0.0,0.0,0.0,0.0,0.0,0.0,0.0,0.0,0.0,0.0,0.0,0.0,0.0,0.0,0.0,0.0
SON,Why?,MALE,0.985918402671814,0.0,0.0,0.0,0.0,0.0,0.0,0.0,0.0,0.0,0.0,0.0,0.0,0.0,0.0,0.0,0.0,0.0,0.0,0.0,0.0,0.0,0.0,0.0,0.0,0.0,0.0,0.0
N'JOBU,"Hey look, if we get in and out quick won't be any worries. You in the van come in through from the west, come around the corner, land right here. Me and the twins pulling up right here, we leavin' this car behind, ok? We coming...",MALE,0.9915594458580017,0.0,0.0,0.0,0.0,0.0,0.0,0.0,0.0,0.0,0.0,0.0,0.0,0.0,0.0,0.0,0.0,0.0,0.0,0.0,0.0,0.0,0.0,0.0,0.0,0.0,0.0,0.0
N'JOBU,Hide the straps.,MALE,0.998820960521698,0.0,0.0,0.0,0.0,0.0,0.0,0.0,0.0,0.0,0.0,0.0,0.0,0.0,0.0,0.0,0.0,0.0,0.0,0.0,0.0,0.0,0.0,0.0,0.0,0.0,0.0,0.0
JAMES,Is it the Feds?,MALE,0.0,0.0,0.0,0.0,0.0,0.0,0.0,0.4454169273376465,0.7830561995506287,0.0,0.0,0.0,0.0,0.0,0.0,0.0,0.0,0.0,0.0,0.0,0.0,0.0,0.0,0.0,0.0,0.0,0.0,0.0
N'JOBU,No.,MALE,0.9917975664138794,0.0,0.0,0.0,0.0,0.0,0.0,0.0,0.0,0.0,0.0,0.0,0.0,0.0,0.0,0.0,0.0,0.0,0.0,0.0,0.0,0.0,0.0,0.0,0.0,0.0,0.0,0.0
JAMES,It's two Grace Jones looking chicks... they're holding spears...,MALE,0.9988724589347839,0.0,0.0,0.0,0.0,0.0,0.0,0.0,0.0,0.0,0.0,0.0,0.0,0.0,0.0,0.0,0.0,0.0,0.0,0.0,0.0,0.0,0.0,0.0,0.0,0.0,0.0,0.0
N'JOBU,Open it.,MALE,0.9976212382316589,0.0,0.0,0.0,0.0,0.0,0.0,0.0,0.0,0.0,0.0,0.0,0.0,0.0,0.0,0.0,0.0,0.0,0.0,0.0,0.0,0.0,0.0,0.0,0.0,0.0,0.0,0.0
JAMES,You serious?,MALE,0.0,0.0,0.0,0.0,0.0,0.0,0.0,0.8803139925003052,0.9170034527778625,0.0,0.0,0.0,0.0,0.0,0.0,0.0,0.0,0.0,0.0,0.0,0.0,0.0,0.0,0.0,0.0,0.0,0.0,0.0
N'JOBU,They won't knock again.,MALE,0.9981574416160583,0.0,0.0,0.0,0.0,0.0,0.0,0.0,0.0,0.0,0.0,0.0,0.0,0.0,0.0,0.0,0.0,0.0,0.0,0.0,0.0,0.0,0.0,0.0,0.0,0.0,0.0,0.0
DORA MILAJE,Who are you?,FEMALE,0.3571455180644989,0.0,0.0,0.0,0.0,0.0,0.0,0.0,0.5552093982696533,0.0,0.0,0.0,0.0,0.0,0.0,0.0,0.0,0.0,0.0,0.0,0.0,0.0,0.0,0.0,0.0,0.0,0.0,0.0
N'JOBU,"Prince N'Jobu, son of Azzuri.",MALE,0.9988952279090881,0.0,0.0,0.0,0.0,0.0,0.0,0.0,0.0,0.0,0.0,0.0,0.0,0.0,0.0,0.0,0.0,0.0,0.0,0.0,0.0,0.0,0.0,0.0,0.0,0.0,0.0,0.0
DORA MILAJE,Prove to me you are one of us.,FEMALE,0.9441524147987366,0.0,0.0,0.0,0.0,0.0,0.0,0.0,0.0,0.0,0.0,0.0,0.0,0.0,0.0,0.0,0.0,0.0,0.0,0.0,0.0,0.0,0.0,0.0,0.0,0.0,0.0,0.0
N'JOBU,My King...,MALE,0.6865664720535278,0.0,0.0,0.0,0.0,0.0,0.0,0.0,0.0,0.0,0.0,0.0,0.0,0.0,0.0,0.0,0.0,0.0,0.0,0.0,0.0,0.0,0.0,0.0,0.0,0.0,0.0,0.0
T'CHALA,Leave us.,MALE,0.9983199238777161,0.0,0.0,0.0,0.0,0.0,0.0,0.0,0.0,0.0,0.0,0.0,0.0,0.0,0.0,0.0,0.0,0.0,0.0,0.0,0.0,0.0,0.0,0.0,0.0,0.0,0.0,0.0
N'JOBU,"This is James. I trust him with my life. He stays, with your permission, King T'Chaka.",MALE,0.5783792734146118,0.0,0.0,0.0,0.0,0.9347513318061829,0.0,0.0,0.0,0.0,0.0,0.0,0.0,0.0,0.0,0.0,0.0,0.0,0.0,0.0,0.0,0.0,0.0,0.0,0.0,0.0,0.0,0.0
T'CHALA,As you wish. At ease…,MALE,0.0,0.0,0.0,0.0,0.0,0.0,0.0,0.0,0.0,0.843876302242279,0.0,0.0,0.0,0.0,0.0,0.0,0.0,0.0,0.0,0.0,0.0,0.0,0.0,0.0,0.0,0.0,0.0,0.0
T'CHALA,Come baby brother.  Let me see how you're holding up.,MALE,0.916846752166748,0.0,0.0,0.0,0.0,0.0,0.0,0.0,0.7704858779907227,0.0,0.0,0.0,0.0,0.0,0.0,0.0,0.0,0.0,0.0,0.0,0.0,0.0,0.0,0.0,0.0,0.0,0.0,0.0
T'CHALA,You look strong.,MALE,0.0,0.9968286156654358,0.0,0.0,0.0,0.0,0.0,0.0,0.0,0.0,0.0,0.0,0.0,0.0,0.0,0.0,0.0,0.0,0.0,0.0,0.0,0.0,0.0,0.0,0.0,0.0,0.0,0.0
N'JOBU,Glory to Bast. I am in good health. How is home?,MALE,0.35795578360557556,0.0,0.0,0.0,0.0,0.0,0.0,0.0,0.0,0.0,0.0,0.0,0.0,0.0,0.0,0.0,0.0,0.0,0.0,0.0,0.0,0.0,0.0,0.0,0.0,0.0,0.0,0.0
T'CHALA,"Not so good, baby brother. There has been an attack.",MALE,0.0,0.0,0.0,0.0,0.0,0.0,0.0,0.0,0.0,0.0,0.0,0.906769871711731,0.0,0.0,0.0,0.0,0.0,0.0,0.0,0.0,0.0,0.0,0.0,0.0,0.0,0.0,0.0,0.0
T'CHALA,"This man, Ulysses Klaue, stole a quarter ton of vibraniurn from us and triggered a bomb at the border to escape. Many lives were lost. He knew where we hid the vibranium, and how to strike.",MALE,0.997998058795929,0.0,0.0,0.0,0.0,0.0,0.0,0.0,0.0,0.0,0.0,0.0,0.0,0.0,0.0,0.0,0.0,0.0,0.0,0.0,0.0,0.0,0.0,0.0,0.0,0.0,0.0,0.0
T'CHALA,He had someone on the inside.,MALE,0.9986431002616882,0.0,0.0,0.0,0.0,0.0,0.0,0.0,0.0,0.0,0.0,0.0,0.0,0.0,0.0,0.0,0.0,0.0,0.0,0.0,0.0,0.0,0.0,0.0,0.0,0.0,0.0,0.0
N'JOBU,Why are you here?,MALE,0.0,0.0,0.0,0.0,0.0,0.0,0.0,0.0,0.9384776949882507,0.0,0.0,0.0,0.0,0.0,0.0,0.0,0.0,0.0,0.0,0.0,0.0,0.0,0.0,0.0,0.0,0.0,0.0,0.0
T'CHALA,Because I want you look me in the eyes and tell me why you betrayed Wakanda.,MALE,0.0,0.0,0.0,0.8806731104850769,0.0,0.0,0.0,0.0,0.0,0.0,0.0,0.0,0.0,0.0,0.0,0.0,0.0,0.0,0.0,0.0,0.0,0.0,0.0,0.0,0.0,0.0,0.0,0.0
N'JOBU,I did no such thing.,MALE,0.9846494793891907,0.0,0.0,0.0,0.0,0.0,0.0,0.0,0.0,0.0,0.0,0.0,0.0,0.0,0.0,0.0,0.0,0.0,0.0,0.0,0.0,0.0,0.0,0.0,0.0,0.0,0.0,0.0
T'CHALA,Tell him who you are.,MALE,0.9980946183204651,0.0,0.0,0.0,0.0,0.0,0.0,0.0,0.0,0.0,0.0,0.0,0.0,0.0,0.0,0.0,0.0,0.0,0.0,0.0,0.0,0.0,0.0,0.0,0.0,0.0,0.0,0.0
JAMES,"Zuri, Son of Badu.",MALE,0.9969606995582581,0.0,0.0,0.0,0.0,0.0,0.0,0.0,0.0,0.0,0.0,0.0,0.0,0.0,0.0,0.0,0.0,0.0,0.0,0.0,0.0,0.0,0.0,0.0,0.0,0.0,0.0,0.0
N'JOBU,What?,MALE,0.3640415370464325,0.0,0.0,0.0,0.0,0.0,0.0,0.0,0.6699512004852295,0.0,0.0,0.0,0.0,0.0,0.0,0.0,0.0,0.0,0.0,0.0,0.0,0.0,0.0,0.0,0.0,0.0,0.0,0.0
N'JOBU,"James, James you lied to me? I invite you into my home and you were Wakandan this whole time?",MALE,0.0,0.0,0.0,0.0,0.0,0.0,0.0,0.0,0.9405770897865295,0.0,0.0,0.0,0.0,0.0,0.0,0.0,0.0,0.0,0.0,0.0,0.0,0.0,0.0,0.0,0.0,0.0,0.0,0.0
JAMES,You betrayed Wakanda!,MALE,0.0,0.0,0.0,0.9530945420265198,0.0,0.0,0.0,0.0,0.0,0.0,0.0,0.0,0.0,0.0,0.0,0.0,0.0,0.0,0.0,0.0,0.0,0.0,0.0,0.0,0.0,0.0,0.0,0.0
N'JOBU,How could you lie to me like -,MALE,0.0,0.0,0.0,0.0,0.0,0.0,0.0,0.0,0.0,0.0,0.0,0.0,0.0,0.0,0.0,0.0,0.0,0.0,0.0,0.0,0.0,0.0,0.0,0.0,0.0,0.0,0.0,0.0
T'CHALA,Stand down. Did you think that you were the only spy we sent here?,MALE,0.9923766255378723,0.0,0.0,0.0,0.0,0.0,0.0,0.0,0.0,0.0,0.0,0.0,0.0,0.0,0.0,0.0,0.0,0.0,0.0,0.0,0.0,0.0,0.0,0.0,0.0,0.0,0.0,0.0
T'CHALA,"Prince N'Jobu, you will return home at once, where you will face the council and inform them of your crimes.",MALE,0.9481650590896606,0.0,0.0,0.0,0.0,0.0,0.33832836151123047,0.0,0.0,0.0,0.0,0.0,0.0,0.0,0.0,0.0,0.0,0.0,0.0,0.0,0.0,0.0,0.0,0.0,0.0,0.0,0.0,0.0
BBC ANCHOR,"The tiny nation of Wakanda is mourning the death of its monarch, King T'Chaka. The beloved ruler was one of many confirmed dead after a terrorist attack at the United Nations a week ago. The Suspect has since been apprehended.",FEMALE,0.6104463934898376,0.0,0.0,0.0,0.0,0.0,0.0,0.0,0.0,0.0,0.0,0.0,0.0,0.0,0.0,0.0,0.0,0.0,0.0,0.0,0.0,0.0,0.0,0.0,0.0,0.0,0.0,0.0
BBC ANCHOR,"Though it remains one of the poorest countries in the world, fortified by mountain ranges and an impenetrable rain forest, Wakanda does not engage in international trade or accept aid. The succession of the throne is expected to fall to the oldest of the King's two children, Prince T'Challa.",FEMALE,0.911128580570221,0.0,0.0,0.0,0.0,0.0,0.0,0.0,0.0,0.0,0.0,0.0,0.0,0.0,0.0,0.0,0.0,0.0,0.0,0.0,0.0,0.0,0.0,0.783684253692627,0.0,0.0,0.0,0.0
OKOYE,"My Prince, coming up on them now.",FEMALE,0.9820484519004822,0.0,0.0,0.0,0.0,0.0,0.0,0.0,0.0,0.0,0.0,0.0,0.0,0.0,0.0,0.0,0.0,0.0,0.0,0.0,0.0,0.0,0.0,0.0,0.0,0.0,0.0,0.0
T'CHALA,"No need, Okoye. I can handle this alone.",MALE,0.0,0.0,0.0,0.0,0.35502827167510986,0.9278267621994019,0.0,0.0,0.0,0.0,0.0,0.0,0.0,0.0,0.0,0.0,0.0,0.0,0.0,0.0,0.0,0.0,0.0,0.0,0.0,0.0,0.0,0.0
T'CHALA,I will get Nakia out as quickly as possible.,MALE,0.9862175583839417,0.0,0.0,0.0,0.0,0.0,0.0,0.0,0.0,0.0,0.0,0.0,0.0,0.0,0.0,0.0,0.0,0.0,0.0,0.0,0.0,0.0,0.0,0.0,0.0,0.0,0.0,0.0
OKOYE,Just don't freeze when you see her.,FEMALE,0.9801023602485657,0.0,0.0,0.0,0.0,0.0,0.0,0.0,0.0,0.0,0.0,0.0,0.0,0.0,0.0,0.0,0.0,0.0,0.0,0.0,0.0,0.0,0.0,0.0,0.0,0.0,0.0,0.0
T'CHALA,What are you talking about? I never freeze.,MALE,0.991907000541687,0.0,0.0,0.0,0.0,0.0,0.0,0.0,0.0,0.0,0.0,0.0,0.0,0.0,0.0,0.0,0.0,0.0,0.0,0.0,0.0,0.0,0.0,0.0,0.0,0.0,0.0,0.0
MILITANT LEADER,Defense position!,MALE,0.9962903261184692,0.0,0.0,0.0,0.0,0.0,0.0,0.0,0.0,0.0,0.0,0.0,0.0,0.0,0.0,0.0,0.0,0.0,0.0,0.0,0.0,0.0,0.0,0.0,0.0,0.0,0.0,0.0
CARGO TRUCK MILITANT,No games.,MALE,0.9979700446128845,0.0,0.0,0.0,0.0,0.0,0.0,0.0,0.0,0.0,0.0,0.0,0.0,0.0,0.0,0.0,0.0,0.0,0.0,0.0,0.0,0.0,0.0,0.0,0.0,0.0,0.0,0.0
MILITANT LEADER,What do you see?,MALE,0.6951268911361694,0.0,0.0,0.0,0.0,0.0,0.0,0.0,0.7671926617622375,0.0,0.0,0.0,0.0,0.0,0.0,0.0,0.0,0.0,0.0,0.0,0.0,0.0,0.0,0.0,0.0,0.0,0.0,0.0
MILITANT LEADER,Come in! Come in!,MALE,0.997941792011261,0.0,0.0,0.0,0.0,0.0,0.0,0.0,0.0,0.0,0.0,0.0,0.0,0.0,0.0,0.0,0.0,0.0,0.0,0.0,0.0,0.0,0.0,0.0,0.0,0.0,0.0,0.0
NAKIA,This one is just a boy... he got kidnapped as well.,FEMALE,0.933387041091919,0.0,0.0,0.0,0.0,0.0,0.0,0.0,0.0,0.0,0.0,0.0,0.0,0.0,0.0,0.0,0.0,0.0,0.0,0.0,0.0,0.0,0.0,0.0,0.0,0.0,0.0,0.0
T'CHALA,Nakia... I... I wanted to...,MALE,0.0,0.0,0.0,0.0,0.0,0.0,0.0,0.0,0.0,0.9542160630226135,0.0,0.0,0.0,0.0,0.0,0.0,0.0,0.0,0.0,0.0,0.0,0.0,0.0,0.0,0.0,0.0,0.0,0.0
NIGERIAN MILITANT,Hey!!!,MALE,0.9946039319038391,0.0,0.0,0.0,0.0,0.0,0.0,0.0,0.0,0.0,0.0,0.0,0.0,0.0,0.0,0.0,0.0,0.0,0.0,0.0,0.0,0.0,0.0,0.0,0.0,0.0,0.0,0.0
NIGERIAN MILITANT,"I have her! Don't move, I will shoot! I will shoot her right now!",MALE,0.902730405330658,0.0,0.0,0.0,0.0,0.0,0.0,0.0,0.0,0.0,0.0,0.0,0.0,0.0,0.0,0.0,0.0,0.0,0.0,0.0,0.0,0.0,0.0,0.0,0.0,0.0,0.0,0.0
OKOYE,You froze.,FEMALE,0.34015849232673645,0.0,0.0,0.0,0.0,0.0,0.0,0.0,0.0,0.0,0.0,0.0,0.0,0.0,0.0,0.45265090465545654,0.0,0.0,0.0,0.0,0.0,0.0,0.0,0.0,0.0,0.0,0.0,0.0
NAKIA,"Why are you here? Eesh, you ruined my mission!",FEMALE,0.0,0.0,0.0,0.0,0.0,0.0,0.0,0.0,0.0,0.0,0.838079035282135,0.0,0.0,0.0,0.0,0.0,0.0,0.0,0.0,0.0,0.0,0.0,0.0,0.0,0.0,0.0,0.0,0.0
T'CHALA,"My father is dead, Nakia.",MALE,0.8028194308280945,0.0,0.0,0.0,0.0,0.0,0.0,0.0,0.0,0.0,0.0,0.0,0.0,0.0,0.0,0.0,0.0,0.0,0.0,0.0,0.0,0.0,0.0,0.0,0.0,0.0,0.3753938376903534,0.0
T'CHALA,"I will be crowned King tomorrow, and I wish for you to be there.",MALE,0.0,0.0,0.0,0.0,0.0,0.0,0.0,0.0,0.0,0.9742164015769958,0.0,0.0,0.0,0.0,0.0,0.0,0.0,0.0,0.0,0.0,0.0,0.3901274502277374,0.0,0.0,0.0,0.0,0.0,0.0
NAKIA,"Carry yourselves home now, and take the boy. Get him to his people.",FEMALE,0.9111498594284058,0.0,0.0,0.0,0.0,0.0,0.6181438565254211,0.0,0.0,0.0,0.0,0.0,0.0,0.0,0.0,0.0,0.0,0.0,0.0,0.0,0.0,0.0,0.0,0.0,0.0,0.0,0.0,0.0
NIGERIAN WOMAN,Thank you.,FEMALE,0.0,0.0,0.0,0.0,0.0,0.0,0.0,0.0,0.0,0.0,0.0,0.0,0.0,0.0,0.0,0.0,0.9966220855712891,0.0,0.0,0.0,0.0,0.0,0.0,0.0,0.0,0.0,0.0,0.0
OKOYE,You will speak nothing of this day.,FEMALE,0.9785622954368591,0.0,0.0,0.0,0.0,0.0,0.0,0.0,0.0,0.0,0.0,0.0,0.0,0.0,0.0,0.0,0.0,0.0,0.0,0.0,0.0,0.0,0.0,0.0,0.0,0.0,0.0,0.0
OKOYE,Sister Nakia... My Prince. We are home.,FEMALE,0.9896036386489868,0.0,0.0,0.0,0.0,0.0,0.0,0.0,0.0,0.0,0.0,0.0,0.0,0.0,0.0,0.0,0.0,0.0,0.0,0.0,0.0,0.0,0.0,0.0,0.0,0.0,0.0,0.0
T'CHALA,This never gets old.,MALE,0.9980584979057312,0.0,0.0,0.0,0.0,0.0,0.0,0.0,0.0,0.0,0.0,0.0,0.0,0.0,0.0,0.0,0.0,0.0,0.0,0.0,0.0,0.0,0.0,0.0,0.0,0.0,0.0,0.0
NAKIA,Queen Mother... Princess. My comfort for your loss.,FEMALE,0.0,0.0,0.0,0.0,0.0,0.0,0.9555698037147522,0.0,0.0,0.0,0.0,0.0,0.0,0.0,0.0,0.0,0.0,0.0,0.0,0.0,0.0,0.0,0.0,0.0,0.0,0.0,0.0,0.0
RAMONDA,"Thank you, Nakia. It is so good to have you back with us.",FEMALE,0.0,0.0,0.0,0.0,0.0,0.0,0.0,0.0,0.0,0.0,0.0,0.0,0.0,0.0,0.0,0.0,0.998698353767395,0.0,0.4942508935928345,0.0,0.0,0.0,0.0,0.0,0.0,0.0,0.0,0.0
OKOYE,Take her to the River Province to prepare her for the ceremony.,FEMALE,0.9982028007507324,0.0,0.0,0.0,0.0,0.0,0.0,0.0,0.0,0.0,0.0,0.0,0.0,0.0,0.0,0.0,0.0,0.0,0.0,0.0,0.0,0.0,0.0,0.0,0.0,0.0,0.0,0.0
AYO,"Yes, general.",MALE,0.5164932608604431,0.0,0.0,0.0,0.0,0.9524761438369751,0.0,0.0,0.0,0.0,0.0,0.0,0.0,0.0,0.0,0.0,0.0,0.0,0.0,0.0,0.0,0.0,0.0,0.0,0.0,0.0,0.0,0.0
SHURI,Did he freeze?,FEMALE,0.5907487273216248,0.0,0.0,0.0,0.0,0.0,0.0,0.5169938206672668,0.4391458034515381,0.0,0.0,0.0,0.0,0.0,0.0,0.0,0.0,0.0,0.0,0.0,0.0,0.0,0.0,0.0,0.0,0.0,0.0,0.0
OKOYE,Like an antelope in headlights.,FEMALE,0.9983281493186951,0.0,0.0,0.0,0.0,0.0,0.0,0.0,0.0,0.0,0.0,0.0,0.0,0.0,0.0,0.0,0.0,0.0,0.0,0.0,0.0,0.0,0.0,0.0,0.0,0.0,0.0,0.0
T'CHALA,Are you finished?,MALE,0.3288438618183136,0.0,0.0,0.0,0.0,0.0,0.0,0.30959728360176086,0.38397055864334106,0.0,0.0,0.0,0.0,0.0,0.0,0.0,0.0,0.0,0.0,0.0,0.0,0.0,0.0,0.0,0.0,0.0,0.0,0.0
T'CHALA,So surprised my little sister came to see me off before our big day.,MALE,0.0,0.0,0.0,0.0,0.0,0.0,0.0,0.0,0.0,0.0,0.0,0.0,0.0,0.0,0.0,0.0,0.0,0.0,0.0,0.0,0.0,0.0,0.0,0.0,0.0,0.0,0.0,0.9928923845291138
SHURI,"You wish. I'm here for the EMP beads, I've developed an update.",FEMALE,0.0,0.0,0.0,0.0,0.0,0.0,0.0,0.0,0.0,0.973785936832428,0.0,0.0,0.0,0.0,0.0,0.0,0.0,0.0,0.0,0.0,0.0,0.0,0.0,0.0,0.0,0.0,0.0,0.0
T'CHALA,"Update? No, it worked perfectly.",MALE,0.0,0.9537403583526611,0.0,0.0,0.0,0.0,0.0,0.0,0.0,0.0,0.0,0.0,0.0,0.0,0.0,0.0,0.0,0.0,0.0,0.0,0.0,0.0,0.0,0.0,0.0,0.0,0.0,0.0
SHURI,"How many times to I have to teach you, just because something works, doesn't mean that it cannot be improved.",FEMALE,0.9970173835754395,0.0,0.0,0.0,0.0,0.0,0.0,0.0,0.0,0.0,0.0,0.0,0.0,0.0,0.0,0.0,0.0,0.0,0.0,0.0,0.0,0.0,0.0,0.0,0.0,0.0,0.0,0.0
T'CHALA,"You are teaching me, what do you know?",MALE,0.0,0.0,0.0,0.0,0.0,0.0,0.0,0.0,0.9922858476638794,0.0,0.0,0.0,0.0,0.0,0.0,0.0,0.0,0.0,0.0,0.0,0.0,0.0,0.0,0.0,0.0,0.0,0.0,0.0
T'CHALA,I cannot wait to see what kind of update you make to your ceremonial outfit.,MALE,0.0,0.0,0.0,0.0,0.0,0.0,0.0,0.0,0.9272094964981079,0.0,0.0,0.0,0.0,0.0,0.6375166773796082,0.0,0.0,0.0,0.0,0.0,0.0,0.0,0.0,0.0,0.0,0.0,0.0,0.0
RAMONDA,Shuri!,FEMALE,0.996292233467102,0.0,0.0,0.0,0.0,0.0,0.0,0.0,0.0,0.0,0.0,0.0,0.0,0.0,0.0,0.0,0.0,0.0,0.0,0.0,0.0,0.0,0.0,0.0,0.0,0.0,0.0,0.0
SHURI,Sorry mother.,FEMALE,0.0,0.0,0.0,0.0,0.0,0.0,0.0,0.0,0.0,0.0,0.0,0.0,0.0,0.0,0.0,0.0,0.0,0.0,0.0,0.0,0.0,0.0,0.0,0.0,0.0,0.7502120137214661,0.416427880525589,0.0
T'CHALA,"How are you feeling today, mama?",MALE,0.6921504735946655,0.0,0.0,0.0,0.0,0.0,0.0,0.0,0.8458616733551025,0.0,0.0,0.0,0.0,0.0,0.0,0.0,0.0,0.0,0.0,0.0,0.0,0.0,0.0,0.0,0.0,0.0,0.0,0.0
RAMONDA,"Proud... your father and I would talk about this day all the time. He is with us, and it is your time to be King.",FEMALE,0.0,0.0,0.0,0.0,0.0,0.0,0.0,0.0,0.0,0.0,0.0,0.0,0.0,0.0,0.0,0.0,0.0,0.0,0.0,0.0,0.0,0.0,0.8999056220054626,0.0,0.0,0.0,0.0,0.0
MUSEUM DIRECTOR,Good morning! How can I help you?,FEMALE,0.0,0.0,0.0,0.0,0.0,0.0,0.0,0.0,0.8345335721969604,0.0,0.0,0.0,0.0,0.0,0.0,0.0,0.0,0.0,0.0,0.0,0.0,0.0,0.0,0.0,0.0,0.0,0.0,0.0
KILLMONGER,I was just checking out these artifacts. They tell me you're the expert.,MALE,0.0,0.7539516687393188,0.0,0.0,0.0,0.0,0.0,0.0,0.0,0.0,0.0,0.0,0.0,0.0,0.0,0.0,0.0,0.0,0.0,0.0,0.0,0.0,0.0,0.0,0.0,0.0,0.0,0.0
MUSEUM DIRECTOR,You could say that.,FEMALE,0.99745112657547,0.0,0.0,0.0,0.0,0.0,0.0,0.0,0.0,0.0,0.0,0.0,0.0,0.0,0.0,0.0,0.0,0.0,0.0,0.0,0.0,0.0,0.0,0.0,0.0,0.0,0.0,0.0
KILLMONGER,They're beautiful.,MALE,0.0,0.9911671280860901,0.0,0.0,0.0,0.0,0.0,0.0,0.0,0.0,0.0,0.0,0.0,0.0,0.0,0.0,0.0,0.0,0.0,0.0,0.0,0.0,0.0,0.0,0.0,0.0,0.0,0.0
KILLMONGER,Where's this one from?,MALE,0.0,0.0,0.0,0.0,0.0,0.0,0.0,0.5726867914199829,0.5900489687919617,0.0,0.0,0.0,0.0,0.0,0.0,0.0,0.0,0.0,0.0,0.0,0.0,0.0,0.0,0.0,0.0,0.0,0.0,0.0
MUSEUM DIRECTOR,"From the Bobo Ashanti Tribe, present day Ghana. 19th Century.",FEMALE,0.9988247752189636,0.0,0.0,0.0,0.0,0.0,0.0,0.0,0.0,0.0,0.0,0.0,0.0,0.0,0.0,0.0,0.0,0.0,0.0,0.0,0.0,0.0,0.0,0.0,0.0,0.0,0.0,0.0
KILLMONGER,For real? What about this one?,MALE,0.0,0.0,0.0,0.0,0.0,0.0,0.0,0.0,0.9837526082992554,0.0,0.0,0.0,0.0,0.0,0.0,0.0,0.0,0.0,0.0,0.0,0.0,0.0,0.0,0.0,0.0,0.0,0.0,0.0
MUSEUM DIRECTOR,That one's from the Edo people of Benin. 16th Century.,FEMALE,0.9954882264137268,0.0,0.0,0.0,0.0,0.0,0.0,0.0,0.0,0.0,0.0,0.0,0.0,0.0,0.0,0.0,0.0,0.0,0.0,0.0,0.0,0.0,0.0,0.0,0.0,0.0,0.0,0.0
KILLMONGER,"Now, tell me about this one.",MALE,0.7701156735420227,0.0,0.0,0.0,0.0,0.0,0.0,0.0,0.8415735363960266,0.0,0.0,0.0,0.0,0.0,0.0,0.0,0.0,0.0,0.0,0.0,0.0,0.0,0.0,0.0,0.0,0.0,0.0,0.0
MUSEUM DIRECTOR,Also from Benin. 7th Century. Fula tribe I believe.,FEMALE,0.8832684755325317,0.0,0.0,0.0,0.0,0.9228082299232483,0.0,0.0,0.0,0.0,0.0,0.0,0.0,0.0,0.0,0.0,0.0,0.0,0.0,0.0,0.0,0.0,0.0,0.0,0.0,0.0,0.0,0.0
KILLMONGER,Nah.,MALE,0.9942449927330017,0.0,0.0,0.0,0.0,0.0,0.0,0.0,0.0,0.0,0.0,0.0,0.0,0.0,0.0,0.0,0.0,0.0,0.0,0.0,0.0,0.0,0.0,0.0,0.0,0.0,0.0,0.0
MUSEUM DIRECTOR,I beg your pardon?,FEMALE,0.9957306981086731,0.0,0.0,0.0,0.0,0.0,0.0,0.0,0.0,0.0,0.0,0.0,0.0,0.0,0.0,0.0,0.0,0.0,0.0,0.0,0.0,0.0,0.0,0.0,0.0,0.0,0.0,0.0
KILLMONGER,"It was taken by British soldiers in Benin but it's from Wakanda and it's made out of vibranium. Don't trip, I'mma take it off your hands for you.",MALE,0.995640754699707,0.0,0.0,0.0,0.0,0.0,0.3292272388935089,0.0,0.0,0.0,0.0,0.0,0.0,0.0,0.0,0.0,0.0,0.0,0.0,0.0,0.0,0.0,0.0,0.0,0.0,0.0,0.0,0.0
MUSEUM DIRECTOR,These items aren't for sale.,FEMALE,0.9511802792549133,0.0,0.0,0.0,0.0,0.0,0.0,0.0,0.0,0.0,0.0,0.6402395963668823,0.0,0.0,0.0,0.0,0.0,0.0,0.0,0.0,0.0,0.0,0.0,0.0,0.0,0.0,0.0,0.0
KILLMONGER,How do you think your ancestors got these? You think they paid a fair price? Or did they take it like they took everything else.,MALE,0.0,0.0,0.0,0.0,0.0,0.0,0.0,0.0,0.9877199530601501,0.0,0.0,0.0,0.0,0.0,0.0,0.0,0.0,0.0,0.0,0.0,0.0,0.0,0.0,0.0,0.0,0.0,0.0,0.0
MUSEUM DIRECTOR,"Sir, I'm going to have to ask you to leave.",FEMALE,0.6115226149559021,0.0,0.0,0.0,0.0,0.0,0.0,0.0,0.0,0.0,0.0,0.0,0.0,0.0,0.0,0.0,0.0,0.0,0.0,0.0,0.0,0.0,0.0,0.0,0.0,0.0,0.0,0.0
KILLMONGER,"You got all this security watching me ever since I walked in. But, you ain't checking for what you put in your body.",MALE,0.919924259185791,0.0,0.0,0.0,0.4784712791442871,0.0,0.0,0.0,0.0,0.0,0.0,0.0,0.0,0.0,0.0,0.0,0.0,0.0,0.0,0.0,0.0,0.0,0.0,0.0,0.0,0.0,0.0,0.0
SECURITY GUARD,"Alright, mate. Let's have it. Come on, mate.",MALE,0.7178815603256226,0.0,0.0,0.0,0.0,0.7061248421669006,0.0,0.0,0.0,0.0,0.0,0.0,0.0,0.0,0.0,0.0,0.0,0.0,0.0,0.0,0.0,0.0,0.0,0.0,0.0,0.0,0.0,0.0
KILLMONGER,I think she might not be feelin' too good.,MALE,0.0,0.0,0.0,0.0,0.0,0.0,0.0,0.559116542339325,0.0,0.0,0.0,0.0,0.0,0.0,0.0,0.0,0.0,0.0,0.0,0.0,0.0,0.0,0.0,0.0,0.0,0.0,0.0,0.0
KILLMONGER,"Hey! Hey somebody get some help! Come here! Call a doctor, please! Hey please, somebody come help!",MALE,0.0,0.0,0.0,0.0,0.0,0.0,0.9915273785591125,0.0,0.0,0.0,0.0,0.0,0.0,0.0,0.0,0.0,0.0,0.0,0.0,0.0,0.0,0.0,0.0,0.0,0.0,0.0,0.0,0.0
SECURITY GUARD,Medical Emergency right away in the West African Exhibit please. Right away!,MALE,0.9969720840454102,0.0,0.0,0.0,0.0,0.0,0.0,0.0,0.0,0.0,0.0,0.0,0.0,0.0,0.0,0.0,0.0,0.0,0.0,0.0,0.0,0.0,0.0,0.0,0.0,0.0,0.0,0.0
LINDA,I'm gonna take a break.,FEMALE,0.0,0.0,0.0,0.0,0.320503830909729,0.0,0.0,0.0,0.0,0.0,0.0,0.0,0.0,0.0,0.0,0.0,0.0,0.0,0.0,0.0,0.0,0.0,0.0,0.0,0.0,0.0,0.0,0.0
KLAUE,Let's give the lady some space please.,MALE,0.5065613389015198,0.0,0.0,0.0,0.0,0.0,0.0,0.0,0.0,0.0,0.0,0.0,0.0,0.0,0.0,0.0,0.0,0.0,0.0,0.0,0.0,0.0,0.0,0.0,0.0,0.0,0.0,0.0
LIMBANI,"Step back please, gents, step back please.",MALE,0.9985966086387634,0.0,0.0,0.0,0.0,0.0,0.0,0.0,0.0,0.0,0.0,0.0,0.0,0.0,0.0,0.0,0.0,0.0,0.0,0.0,0.0,0.0,0.0,0.0,0.0,0.0,0.0,0.0
KLAUE,"Hey come here. Come here! It's ok. You can go, but just don't tell anyone, alright? ",MALE,0.3730567693710327,0.0,0.0,0.0,0.0,0.3961000144481659,0.899652361869812,0.0,0.0,0.0,0.0,0.0,0.0,0.0,0.0,0.0,0.0,0.0,0.0,0.0,0.0,0.0,0.0,0.0,0.0,0.0,0.0,0.0
KILLMONGER,"Bro, why you 'aint just shoot him right here?",MALE,0.9728386998176575,0.0,0.0,0.0,0.0,0.0,0.0,0.0,0.0,0.0,0.0,0.0,0.0,0.0,0.0,0.0,0.0,0.0,0.0,0.0,0.0,0.0,0.0,0.0,0.0,0.0,0.0,0.0
KLAUE,Because it's better to leave the crime scene more spread out... makes us look like amateurs.,MALE,0.41323867440223694,0.0,0.0,0.0,0.0,0.0,0.0,0.0,0.0,0.0,0.0,0.0,0.0,0.0,0.0,0.0,0.0,0.0,0.0,0.0,0.0,0.0,0.0,0.0,0.0,0.0,0.0,0.0
KLAUE,Now... let's see if you know what you're talking about...,MALE,0.9226725697517395,0.0,0.0,0.0,0.0,0.0,0.0,0.0,0.6618317365646362,0.0,0.0,0.0,0.0,0.0,0.0,0.0,0.0,0.0,0.0,0.0,0.0,0.0,0.0,0.0,0.0,0.0,0.0,0.0
KLAUE,That's just a taste.,MALE,0.9985546469688416,0.0,0.0,0.0,0.0,0.0,0.0,0.0,0.0,0.0,0.0,0.0,0.0,0.0,0.0,0.0,0.0,0.0,0.0,0.0,0.0,0.0,0.0,0.0,0.0,0.0,0.0,0.0
KLAUE,"Whoo… You're gonna be rich, boy.",MALE,0.0,0.0,0.0,0.0,0.0,0.0,0.0,0.0,0.0,0.0,0.0,0.0,0.0,0.0,0.49609726667404175,0.0,0.0,0.0,0.0,0.0,0.0,0.0,0.0,0.0,0.0,0.0,0.0,0.45198357105255127
KILLMONGER,You better sell that quick.,MALE,0.9591442942619324,0.0,0.0,0.0,0.0,0.0,0.0,0.0,0.0,0.0,0.0,0.0,0.0,0.0,0.0,0.0,0.0,0.0,0.0,0.0,0.0,0.0,0.0,0.0,0.0,0.0,0.0,0.0
KLAUE,Oh it's already sold.,MALE,0.9952635765075684,0.0,0.0,0.0,0.0,0.0,0.0,0.0,0.0,0.0,0.0,0.0,0.0,0.0,0.0,0.0,0.0,0.0,0.0,0.0,0.0,0.0,0.0,0.0,0.0,0.0,0.0,0.0
KILLMONGER,"Whatever you try, the Wakandans'll probably show up.",MALE,0.0,0.0,0.0,0.0,0.0,0.0,0.0,0.0,0.0,0.0,0.0,0.0,0.0,0.0,0.0,0.0,0.0,0.0,0.0,0.0,0.0,0.9520396590232849,0.0,0.0,0.0,0.0,0.0,0.0
KLAUE,That'll make my day. I can kill two birds with one stone.,MALE,0.0,0.0,0.0,0.0,0.0,0.0,0.0,0.0,0.0,0.0,0.0,0.0,0.0,0.0,0.0,0.0,0.0,0.0,0.9461846351623535,0.0,0.0,0.0,0.0,0.0,0.0,0.0,0.0,0.0
KLAUE,"You're not telling me that's vibranium too, eh?",MALE,0.0,0.0,0.0,0.0,0.0,0.0,0.0,0.8224653601646423,0.8727103471755981,0.0,0.0,0.0,0.0,0.0,0.0,0.0,0.0,0.0,0.0,0.0,0.0,0.0,0.0,0.0,0.0,0.0,0.0,0.0
KILLMONGER,"Nah, I'm just feeling it.",MALE,0.46849358081817627,0.0,0.0,0.0,0.0,0.0,0.0,0.0,0.0,0.0,0.0,0.5631887316703796,0.0,0.0,0.0,0.0,0.0,0.0,0.0,0.0,0.0,0.0,0.0,0.0,0.0,0.0,0.0,0.0
"ELDERS, WARRIORS, DORA",Ngu T'Challa Lo.,NEUTRAL,0.9955435395240784,0.0,0.0,0.0,0.0,0.0,0.0,0.0,0.0,0.0,0.0,0.0,0.0,0.0,0.0,0.0,0.0,0.0,0.0,0.0,0.0,0.0,0.0,0.0,0.0,0.0,0.0,0.0
CROWD,Ngu T'Challa Lo.,NEUTRAL,0.9955435395240784,0.0,0.0,0.0,0.0,0.0,0.0,0.0,0.0,0.0,0.0,0.0,0.0,0.0,0.0,0.0,0.0,0.0,0.0,0.0,0.0,0.0,0.0,0.0,0.0,0.0,0.0,0.0
ZURI,"I, Zuri, Son of Badu, give to you, Prince T'Challa, the Black Panther!",MALE,0.9976243376731873,0.0,0.0,0.0,0.0,0.0,0.0,0.0,0.0,0.0,0.0,0.0,0.0,0.0,0.0,0.0,0.0,0.0,0.0,0.0,0.0,0.0,0.0,0.0,0.0,0.0,0.0,0.0
ZURI,The Prince will now have the strength of the Black Panther stripped away.,MALE,0.9974718689918518,0.0,0.0,0.0,0.0,0.0,0.0,0.0,0.0,0.0,0.0,0.0,0.0,0.0,0.0,0.0,0.0,0.0,0.0,0.0,0.0,0.0,0.0,0.0,0.0,0.0,0.0,0.0
ZURI,Damaku...,MALE,0.9974908828735352,0.0,0.0,0.0,0.0,0.0,0.0,0.0,0.0,0.0,0.0,0.0,0.0,0.0,0.0,0.0,0.0,0.0,0.0,0.0,0.0,0.0,0.0,0.0,0.0,0.0,0.0,0.0
CROWD,Damaku...,NEUTRAL,0.9974908828735352,0.0,0.0,0.0,0.0,0.0,0.0,0.0,0.0,0.0,0.0,0.0,0.0,0.0,0.0,0.0,0.0,0.0,0.0,0.0,0.0,0.0,0.0,0.0,0.0,0.0,0.0,0.0
