character,line,gender,admiration,amusement,anger,annoyance,approval,caring,confusion,curiosity,desire,disappointment,disapproval,disgust,embarrassment,excitement,fear,gratitude,grief,joy,love,nervousness,optimism,pride,realization,relief,remorse,sadness,surprise,neutral
T'CHALA,"And you believe the word of an arms dealer, strapped to a chair.",MALE,0.9985639452934265,0.0,0.0,0.0,0.0,0.0,0.0,0.0,0.0,0.0,0.0,0.0,0.0,0.0,0.0,0.0,0.0,0.0,0.0,0.0,0.0,0.0,0.0,0.0,0.0,0.0,0.0,0.0
NAKIA,Where is that?,FEMALE,0.0,0.0,0.0,0.0,0.0,0.0,0.0,0.0,0.9265809655189514,0.0,0.0,0.0,0.0,0.0,0.0,0.0,0.0,0.0,0.0,0.0,0.0,0.0,0.0,0.0,0.0,0.0,0.0,0.0
CIA AGENT,Back there.,FEMALE,0.9977692365646362,0.0,0.0,0.0,0.0,0.0,0.0,0.0,0.0,0.0,0.0,0.0,0.0,0.0,0.0,0.0,0.0,0.0,0.0,0.0,0.0,0.0,0.0,0.0,0.0,0.0,0.0,0.0
ROSS,How much more are you hiding?,MALE,0.0,0.0,0.0,0.0,0.0,0.0,0.0,0.33542606234550476,0.8697848916053772,0.0,0.0,0.0,0.0,0.0,0.0,0.0,0.0,0.0,0.0,0.0,0.0,0.0,0.0,0.0,0.0,0.0,0.0,0.0
NAKIA,Something's happening out back.,FEMALE,0.9987249970436096,0.0,0.0,0.0,0.0,0.0,0.0,0.0,0.0,0.0,0.0,0.0,0.0,0.0,0.0,0.0,0.0,0.0,0.0,0.0,0.0,0.0,0.0,0.0,0.0,0.0,0.0,0.0
KLAUE,I see you took your time didn't you!,MALE,0.9249919652938843,0.0,0.0,0.0,0.0,0.0,0.0,0.0,0.0,0.0,0.0,0.0,0.0,0.0,0.0,0.0,0.0,0.0,0.0,0.0,0.0,0.0,0.0,0.0,0.0,0.0,0.0,0.0
OKOYE,My King!,FEMALE,0.8439951539039612,0.0,0.0,0.0,0.0,0.0,0.0,0.0,0.0,0.0,0.0,0.0,0.0,0.0,0.0,0.0,0.0,0.0,0.0,0.0,0.0,0.0,0.0,0.0,0.0,0.0,0.0,0.0
OKOYE,My King... Nakia.,FEMALE,0.9979574680328369,0.0,0.0,0.0,0.0,0.0,0.0,0.0,0.0,0.0,0.0,0.0,0.0,0.0,0.0,0.0,0.0,0.0,0.0,0.0,0.0,0.0,0.0,0.0,0.0,0.0,0.0,0.0
NAKIA,He just jumped in front of me.,FEMALE,0.9972477555274963,0.0,0.0,0.0,0.0,0.0,0.0,0.0,0.0,0.0,0.0,0.0,0.0,0.0,0.0,0.0,0.0,0.0,0.0,0.0,0.0,0.0,0.0,0.0,0.0,0.0,0.0,0.0
NAKIA,"I don't think he'll make it here, it hit his spine.",FEMALE,0.9926674962043762,0.0,0.0,0.0,0.0,0.0,0.0,0.0,0.0,0.0,0.0,0.0,0.0,0.0,0.0,0.0,0.0,0.0,0.0,0.0,0.0,0.0,0.0,0.0,0.0,0.0,0.0,0.0
T'CHALA,Give me a Kimoyo bead.,MALE,0.9988735318183899,0.0,0.0,0.0,0.0,0.0,0.0,0.0,0.0,0.0,0.0,0.0,0.0,0.0,0.0,0.0,0.0,0.0,0.0,0.0,0.0,0.0,0.0,0.0,0.0,0.0,0.0,0.0
T'CHALA,This will stabilize him for now.,MALE,0.9962806105613708,0.0,0.0,0.0,0.0,0.0,0.0,0.0,0.0,0.0,0.0,0.0,0.0,0.0,0.0,0.0,0.0,0.0,0.0,0.0,0.0,0.0,0.0,0.0,0.0,0.0,0.0,0.0
T'CHALA,Give him to us. We can save him.,MALE,0.0,0.0,0.0,0.0,0.0,0.0,0.9736059308052063,0.0,0.0,0.0,0.0,0.0,0.0,0.0,0.0,0.0,0.0,0.0,0.0,0.0,0.0,0.0,0.0,0.0,0.0,0.0,0.0,0.0
OKOYE,Our missions was to bring back Klaue. We failed. This man is a foreign intelligence operative. How do we justify bringing him into our borders?,FEMALE,0.0,0.0,0.0,0.0,0.0,0.0,0.0,0.0,0.8976550698280334,0.0,0.0,0.0,0.0,0.0,0.0,0.0,0.0,0.0,0.0,0.0,0.0,0.0,0.0,0.0,0.0,0.0,0.0,0.0
NAKIA,He took a bullet for me.,FEMALE,0.9972514510154724,0.0,0.0,0.0,0.0,0.0,0.0,0.0,0.0,0.0,0.0,0.0,0.0,0.0,0.0,0.0,0.0,0.0,0.0,0.0,0.0,0.0,0.0,0.0,0.0,0.0,0.0,0.0
OKOYE,That was his choice.,FEMALE,0.9986580610275269,0.0,0.0,0.0,0.0,0.0,0.0,0.0,0.0,0.0,0.0,0.0,0.0,0.0,0.0,0.0,0.0,0.0,0.0,0.0,0.0,0.0,0.0,0.0,0.0,0.0,0.0,0.0
NAKIA,So now we are just supposed to let him die?,FEMALE,0.0,0.0,0.0,0.0,0.0,0.0,0.0,0.0,0.802924633026123,0.0,0.0,0.0,0.0,0.0,0.0,0.0,0.0,0.0,0.0,0.0,0.0,0.0,0.0,0.0,0.0,0.0,0.0,0.0
OKOYE,"Let us consider that we heal him. It is his duty to report back to his country. And as King, it is your duty to protect ours.",FEMALE,0.6495043635368347,0.0,0.0,0.0,0.0,0.0,0.9411259889602661,0.0,0.0,0.0,0.0,0.0,0.0,0.0,0.0,0.0,0.0,0.0,0.0,0.0,0.0,0.0,0.0,0.0,0.0,0.0,0.0,0.0
T'CHALA,"I am well aware of my duties, General. I cannot just let him die knowing we can save him.",MALE,0.0,0.0,0.0,0.0,0.0,0.0,0.0,0.0,0.0,0.0,0.0,0.0,0.0,0.0,0.0,0.0,0.0,0.0,0.0,0.0,0.0,0.0,0.0,0.9662637114524841,0.0,0.0,0.0,0.0
OKOYE,Where exactly are we taking him?,FEMALE,0.0,0.0,0.0,0.0,0.0,0.0,0.0,0.8573654294013977,0.6138995289802551,0.0,0.0,0.0,0.0,0.0,0.0,0.0,0.0,0.0,0.0,0.0,0.0,0.0,0.0,0.0,0.0,0.0,0.0,0.0
SHURI,"Great, another broken white boy for us to fix. This is going to be fun.",FEMALE,0.0,0.9004180431365967,0.7093018889427185,0.0,0.0,0.0,0.0,0.0,0.0,0.0,0.0,0.0,0.0,0.0,0.0,0.0,0.0,0.0,0.0,0.0,0.0,0.0,0.0,0.0,0.0,0.0,0.0,0.0
SHURI,He will live.,FEMALE,0.3919411599636078,0.0,0.0,0.0,0.0,0.966749906539917,0.0,0.0,0.0,0.0,0.0,0.0,0.0,0.0,0.0,0.0,0.0,0.0,0.0,0.0,0.0,0.0,0.0,0.0,0.0,0.0,0.0,0.0
SHURI,W'Kabi is here.,FEMALE,0.9982022047042847,0.0,0.0,0.0,0.0,0.0,0.0,0.0,0.0,0.0,0.0,0.0,0.0,0.0,0.0,0.0,0.0,0.0,0.0,0.0,0.0,0.0,0.0,0.0,0.0,0.0,0.0,0.0
W'KABI,"What's going on, brother? Where is Klaue?",MALE,0.0,0.0,0.0,0.0,0.0,0.0,0.0,0.0,0.9806674718856812,0.0,0.0,0.0,0.0,0.0,0.0,0.0,0.0,0.0,0.0,0.0,0.0,0.0,0.0,0.0,0.0,0.0,0.0,0.0
T'CHALA,He's not here.,MALE,0.9967297315597534,0.0,0.0,0.0,0.0,0.0,0.0,0.0,0.0,0.0,0.0,0.0,0.0,0.0,0.0,0.0,0.0,0.0,0.0,0.0,0.0,0.0,0.0,0.0,0.0,0.0,0.0,0.0
T'CHALA,He slipped through our hands.,MALE,0.9150382876396179,0.0,0.0,0.0,0.0,0.0,0.0,0.0,0.0,0.0,0.0,0.0,0.0,0.0,0.0,0.0,0.0,0.0,0.0,0.0,0.0,0.0,0.0,0.0,0.0,0.0,0.4808312952518463,0.0
W'KABI,Slipped? For 30 years your father was in power and did nothing. With you I thought it would be different. But it's more of the same.,MALE,0.6724090576171875,0.0,0.0,0.0,0.0,0.0,0.0,0.0,0.0,0.0,0.0,0.0,0.0,0.0,0.0,0.0,0.0,0.0,0.0,0.0,0.0,0.0,0.0,0.8865467309951782,0.0,0.0,0.0,0.0
LIMBANI,"Let's get going, boss.",MALE,0.9971033930778503,0.0,0.0,0.0,0.0,0.0,0.0,0.0,0.0,0.0,0.0,0.0,0.0,0.0,0.0,0.0,0.0,0.0,0.0,0.0,0.0,0.0,0.0,0.0,0.0,0.0,0.0,0.0
KILLMONGER,You always sell to the CIA?,MALE,0.6291646361351013,0.0,0.0,0.0,0.0,0.0,0.0,0.6340411305427551,0.387575626373291,0.0,0.0,0.0,0.0,0.0,0.0,0.0,0.0,0.0,0.0,0.0,0.0,0.0,0.0,0.0,0.0,0.0,0.0,0.0
KLAUE,"I sell to the highest bidder. Don' t you worry when I get back to Jo- burg and lay low for a bit, I ' ll make sure both you guys get paid.",MALE,0.7670875191688538,0.0,0.0,0.0,0.0,0.0,0.0,0.0,0.0,0.0,0.0,0.0,0.0,0.0,0.0,0.0,0.0,0.0,0.0,0.0,0.0,0.0,0.0,0.0,0.0,0.0,0.0,0.0
KILLMONGER,"Oh I ain't worried about the money, bro. I know you're good for it.",MALE,0.0,0.3782901167869568,0.0,0.0,0.0,0.9109036922454834,0.5720766186714172,0.0,0.0,0.0,0.0,0.0,0.0,0.0,0.0,0.0,0.0,0.0,0.0,0.0,0.0,0.0,0.0,0.0,0.0,0.0,0.0,0.0
KILLMONGER,"On our way back, just drop us off in Wakanda.",MALE,0.9979662895202637,0.0,0.0,0.0,0.0,0.0,0.0,0.0,0.0,0.0,0.0,0.0,0.0,0.0,0.0,0.0,0.0,0.0,0.0,0.0,0.0,0.0,0.0,0.0,0.0,0.0,0.0,0.0
KLAUE,"You don't wanna go there, boy.",MALE,0.961765468120575,0.0,0.0,0.0,0.0,0.0,0.0,0.0,0.0,0.0,0.0,0.38544395565986633,0.0,0.0,0.0,0.0,0.0,0.0,0.0,0.0,0.0,0.0,0.0,0.0,0.0,0.0,0.0,0.0
KILLMONGER,Yea I do.,MALE,0.8517828583717346,0.0,0.0,0.0,0.0,0.9469669461250305,0.0,0.0,0.0,0.0,0.0,0.0,0.0,0.0,0.0,0.0,0.0,0.0,0.0,0.0,0.0,0.0,0.0,0.0,0.0,0.0,0.0,0.0
KLAUE,"Drop it, or your little Bonnie and Clyde routine ends today. Put your gun down now!",MALE,0.9610727429389954,0.0,0.0,0.0,0.0,0.0,0.0,0.0,0.0,0.0,0.0,0.0,0.0,0.0,0.0,0.0,0.0,0.0,0.0,0.0,0.0,0.0,0.0,0.0,0.0,0.0,0.0,0.0
LINDA,"I'm sorry. I'm sorry, Erik.",FEMALE,0.0,0.0,0.0,0.0,0.0,0.0,0.0,0.0,0.0,0.0,0.0,0.0,0.0,0.0,0.0,0.0,0.0,0.0,0.0,0.0,0.0,0.0,0.0,0.0,0.0,0.7008848786354065,0.5446754693984985,0.0
KILLMONGER,It's gonna be ok.,MALE,0.0,0.0,0.0,0.0,0.0,0.0,0.9068557620048523,0.0,0.0,0.0,0.0,0.0,0.0,0.0,0.0,0.0,0.0,0.0,0.0,0.0,0.0,0.8579463958740234,0.0,0.0,0.0,0.0,0.0,0.0
KLAUE,... Y-You really wanna go to Wakanda? They're savages.,MALE,0.9952138662338257,0.0,0.0,0.0,0.0,0.0,0.0,0.0,0.0,0.0,0.0,0.0,0.0,0.0,0.0,0.0,0.0,0.0,0.0,0.0,0.0,0.0,0.0,0.0,0.0,0.0,0.0,0.0
KLAUE,This is what they do to people like us.,MALE,0.9987022876739502,0.0,0.0,0.0,0.0,0.0,0.0,0.0,0.0,0.0,0.0,0.0,0.0,0.0,0.0,0.0,0.0,0.0,0.0,0.0,0.0,0.0,0.0,0.0,0.0,0.0,0.0,0.0
KILLMONGER,I ain't worried about no brand. Check these out.,MALE,0.0,0.0,0.0,0.0,0.0,0.7514338493347168,0.0,0.0,0.0,0.0,0.0,0.0,0.0,0.0,0.0,0.0,0.0,0.0,0.0,0.0,0.0,0.0,0.0,0.6180776357650757,0.0,0.0,0.0,0.0
KILLMONGER,Each one is for a kill.,MALE,0.996866762638092,0.0,0.0,0.0,0.0,0.0,0.0,0.0,0.0,0.0,0.0,0.0,0.0,0.0,0.0,0.0,0.0,0.0,0.0,0.0,0.0,0.0,0.0,0.0,0.0,0.0,0.0,0.0
KLAUE,"You can scar yourself as much as you like. To them, you'll just be an outsider. You're crazy to think that you could walk in there.",MALE,0.0,0.0,0.0,0.0,0.0,0.0,0.0,0.0,0.0,0.0,0.0,0.0,0.0,0.0,0.0,0.0,0.0,0.0,0.0,0.0,0.0,0.0,0.0,0.0,0.0,0.0,0.0,0.0
KLAUE,And to think I saw you as some crazy American.,MALE,0.0,0.0,0.0,0.0,0.0,0.0,0.0,0.0,0.0,0.0,0.0,0.0,0.0,0.0,0.0,0.0,0.0,0.0,0.0,0.0,0.0,0.0,0.0,0.0,0.0,0.0,0.0,0.0
T'CHALA,Leave us.,MALE,0.9983199238777161,0.0,0.0,0.0,0.0,0.0,0.0,0.0,0.0,0.0,0.0,0.0,0.0,0.0,0.0,0.0,0.0,0.0,0.0,0.0,0.0,0.0,0.0,0.0,0.0,0.0,0.0,0.0
ZURI,So your mission did not go as planned.,MALE,0.0,0.0,0.0,0.0,0.0,0.0,0.0,0.0,0.0,0.0,0.9426844716072083,0.0,0.0,0.0,0.0,0.0,0.0,0.0,0.0,0.0,0.0,0.0,0.0,0.0,0.0,0.0,0.0,0.0
T'CHALA,What happened to my Uncle N'Jobu? My father told me he disappeared... there was a man today wearing a ring identical to this one.,MALE,0.0,0.0,0.0,0.0,0.0,0.0,0.0,0.0,0.9775053858757019,0.0,0.0,0.0,0.0,0.0,0.0,0.0,0.0,0.0,0.0,0.0,0.0,0.0,0.0,0.0,0.0,0.0,0.0,0.0
ZURI,That is not possible.,MALE,0.0,0.0,0.0,0.0,0.0,0.0,0.0,0.0,0.0,0.0,0.0,0.9933727979660034,0.0,0.0,0.0,0.0,0.0,0.0,0.0,0.0,0.0,0.0,0.0,0.0,0.0,0.0,0.0,0.0
T'CHALA,He helped Klaue escape from us and he was wearing this ring. My grandfather ' s ring. Do not tell me what is possible tell me the truth.,MALE,0.9372442960739136,0.0,0.0,0.0,0.0,0.0,0.0,0.0,0.0,0.0,0.0,0.0,0.0,0.0,0.0,0.0,0.0,0.0,0.0,0.0,0.0,0.0,0.0,0.0,0.0,0.0,0.0,0.0
ZURI,"Some truths are too much to bear, T'Challa.",MALE,0.0,0.0,0.0,0.0,0.0,0.0,0.0,0.0,0.0,0.0,0.4166070520877838,0.0,0.0,0.0,0.0,0.0,0.0,0.0,0.0,0.0,0.0,0.0,0.0,0.4427681863307953,0.0,0.0,0.0,0.0
T'CHALA,That is not your choice to make. What happened to him?,MALE,0.0,0.0,0.0,0.0,0.0,0.0,0.0,0.0,0.8865203857421875,0.0,0.0,0.7923323512077332,0.0,0.0,0.0,0.0,0.0,0.0,0.0,0.0,0.0,0.0,0.0,0.0,0.0,0.0,0.0,0.0
ZURI,I promised the King to say nothing.,MALE,0.46496641635894775,0.0,0.0,0.0,0.0,0.0,0.0,0.0,0.0,0.0,0.0,0.0,0.0,0.0,0.0,0.0,0.0,0.0,0.0,0.0,0.0,0.0,0.0,0.0,0.0,0.0,0.0,0.0
T'CHALA,I am your King now!,MALE,0.9843679070472717,0.0,0.0,0.0,0.0,0.0,0.0,0.0,0.0,0.0,0.0,0.0,0.0,0.0,0.0,0.0,0.0,0.0,0.0,0.0,0.0,0.0,0.0,0.0,0.0,0.0,0.0,0.0
ZURI,Your uncle took a War Dog assignment in America. Your father placed me there to observe unbeknownst to him. Your uncle fell in love with an American woman. They had a child. The hardships he saw there radicalized your uncle.,MALE,0.654682993888855,0.0,0.0,0.0,0.0,0.0,0.0,0.0,0.0,0.0,0.0,0.0,0.0,0.0,0.0,0.0,0.0,0.0,0.0,0.6005459427833557,0.0,0.0,0.0,0.0,0.0,0.0,0.0,0.0
N'JOBU,"I observed for as long as I could! Their leaders have been assassinated, communities flooded with drugs and weapons, they are overly policed and incarcerated. All over the planet our people suffer because they don't have the tools to fight back. With vibranium weapons they could overthrow every country and Wakanda could rule them all, the right way...",MALE,0.4397854208946228,0.0,0.0,0.0,0.0,0.0,0.0,0.0,0.0,0.0,0.0,0.0,0.0,0.0,0.0,0.0,0.0,0.0,0.0,0.0,0.0,0.0,0.0,0.0,0.0,0.0,0.7481162548065186,0.0
ZURI,"He knew your father would not support this, so your uncle betrayed us.",MALE,0.0,0.0,0.0,0.5652859807014465,0.835852324962616,0.0,0.0,0.0,0.0,0.0,0.0,0.0,0.0,0.0,0.0,0.0,0.0,0.0,0.0,0.0,0.0,0.0,0.0,0.0,0.0,0.0,0.0,0.0
T'CHALA,No...,MALE,0.9948943853378296,0.0,0.0,0.0,0.0,0.0,0.0,0.0,0.0,0.0,0.0,0.0,0.0,0.0,0.0,0.0,0.0,0.0,0.0,0.0,0.0,0.0,0.0,0.0,0.0,0.0,0.0,0.0
ZURI,He helped Klaue steal the vibranium.,MALE,0.9928467869758606,0.0,0.0,0.0,0.0,0.0,0.0,0.0,0.0,0.0,0.0,0.0,0.0,0.0,0.0,0.0,0.0,0.0,0.0,0.0,0.0,0.0,0.0,0.0,0.0,0.0,0.0,0.0
T'CHALA,No no no no no no...,MALE,0.979967474937439,0.0,0.0,0.0,0.0,0.0,0.0,0.0,0.0,0.0,0.0,0.0,0.0,0.0,0.0,0.0,0.0,0.0,0.0,0.0,0.0,0.0,0.0,0.0,0.0,0.0,0.0,0.0
T'CHALA,"You will return home at once, where you will face the council and inform them of your crimes.",MALE,0.9662359952926636,0.0,0.0,0.0,0.0,0.0,0.0,0.0,0.0,0.0,0.0,0.0,0.0,0.0,0.0,0.0,0.0,0.0,0.0,0.0,0.0,0.0,0.0,0.0,0.0,0.0,0.0,0.0
ZURI,He drew his weapon on me.,MALE,0.9988768696784973,0.0,0.0,0.0,0.0,0.0,0.0,0.0,0.0,0.0,0.0,0.0,0.0,0.0,0.0,0.0,0.0,0.0,0.0,0.0,0.0,0.0,0.0,0.0,0.0,0.0,0.0,0.0
ZURI,Your father killed his own brother...,MALE,0.6777456998825073,0.0,0.0,0.8933377861976624,0.0,0.0,0.0,0.0,0.0,0.0,0.0,0.0,0.0,0.0,0.0,0.0,0.0,0.0,0.0,0.0,0.0,0.0,0.0,0.0,0.0,0.0,0.0,0.0
ZURI,To save my life.,MALE,0.0,0.0,0.0,0.0,0.0,0.0,0.9471812844276428,0.0,0.0,0.0,0.0,0.0,0.0,0.0,0.0,0.0,0.0,0.0,0.0,0.0,0.0,0.0,0.0,0.0,0.0,0.0,0.0,0.0
T'CHALA,Speak nothing of this.,MALE,0.969832181930542,0.0,0.0,0.0,0.0,0.0,0.0,0.0,0.0,0.0,0.0,0.39772748947143555,0.0,0.0,0.0,0.0,0.0,0.0,0.0,0.0,0.0,0.0,0.0,0.0,0.0,0.0,0.0,0.0
T'CHALA,And the child...,MALE,0.9978408813476562,0.0,0.0,0.0,0.0,0.0,0.0,0.0,0.0,0.0,0.0,0.0,0.0,0.0,0.0,0.0,0.0,0.0,0.0,0.0,0.0,0.0,0.0,0.0,0.0,0.0,0.0,0.0
ZURI,We left him.,MALE,0.998810887336731,0.0,0.0,0.0,0.0,0.0,0.0,0.0,0.0,0.0,0.0,0.0,0.0,0.0,0.0,0.0,0.0,0.0,0.0,0.0,0.0,0.0,0.0,0.0,0.0,0.0,0.0,0.0
ZURI,We had to maintain the lie.,MALE,0.9993343949317932,0.0,0.0,0.0,0.0,0.0,0.0,0.0,0.0,0.0,0.0,0.0,0.0,0.0,0.0,0.0,0.0,0.0,0.0,0.0,0.0,0.0,0.0,0.0,0.0,0.0,0.0,0.0
W'KABI,What is this?,MALE,0.8701616525650024,0.0,0.0,0.0,0.0,0.0,0.0,0.0,0.35946124792099,0.0,0.0,0.0,0.0,0.0,0.0,0.0,0.0,0.0,0.0,0.0,0.0,0.0,0.0,0.0,0.0,0.0,0.0,0.0
KILLMONGER,Just a 'lil gift.,MALE,0.9951531887054443,0.0,0.0,0.0,0.0,0.0,0.0,0.0,0.0,0.0,0.0,0.0,0.0,0.0,0.0,0.0,0.0,0.0,0.0,0.0,0.0,0.0,0.0,0.0,0.0,0.0,0.0,0.0
W'KABI,Who are you?,MALE,0.3571455180644989,0.0,0.0,0.0,0.0,0.0,0.0,0.0,0.5552093982696533,0.0,0.0,0.0,0.0,0.0,0.0,0.0,0.0,0.0,0.0,0.0,0.0,0.0,0.0,0.0,0.0,0.0,0.0,0.0
ROSS,"Alright, where am I?",MALE,0.9942179918289185,0.0,0.0,0.0,0.0,0.0,0.0,0.0,0.0,0.0,0.0,0.0,0.0,0.0,0.0,0.0,0.0,0.0,0.0,0.0,0.0,0.0,0.0,0.0,0.0,0.0,0.0,0.0
SHURI,"Don't scare me like that, colonizer.",FEMALE,0.0,0.0,0.0,0.0,0.0,0.0,0.0,0.0,0.0,0.0,0.0,0.0,0.0,0.0,0.0,0.9332093000411987,0.0,0.0,0.0,0.0,0.0,0.0,0.0,0.0,0.0,0.0,0.0,0.0
ROSS,Colon-who? My name is Everett.,MALE,0.9840444326400757,0.0,0.0,0.0,0.0,0.0,0.0,0.0,0.0,0.0,0.0,0.0,0.0,0.0,0.0,0.0,0.0,0.0,0.0,0.0,0.0,0.0,0.0,0.0,0.0,0.0,0.0,0.0
SHURI,"Yes, I know. Everett Ross former airforce pilot and now, CIA.",FEMALE,0.3931220471858978,0.0,0.0,0.0,0.0,0.9616473913192749,0.0,0.0,0.0,0.0,0.0,0.0,0.0,0.0,0.0,0.0,0.0,0.0,0.0,0.0,0.0,0.0,0.0,0.0,0.0,0.0,0.0,0.0
ROSS,Right.,MALE,0.9955501556396484,0.0,0.0,0.0,0.0,0.0,0.0,0.0,0.0,0.0,0.0,0.0,0.0,0.0,0.0,0.0,0.0,0.0,0.0,0.0,0.0,0.0,0.0,0.0,0.0,0.0,0.0,0.0
ROSS,"Ok, is this Wakanda?",MALE,0.0,0.0,0.0,0.0,0.0,0.0,0.0,0.3219893276691437,0.8406504392623901,0.0,0.0,0.0,0.0,0.0,0.0,0.0,0.0,0.0,0.0,0.0,0.0,0.0,0.0,0.0,0.0,0.0,0.0,0.0
SHURI,"No, it's Kansas.",FEMALE,0.9953343272209167,0.0,0.0,0.0,0.0,0.0,0.0,0.0,0.0,0.0,0.0,0.0,0.0,0.0,0.0,0.0,0.0,0.0,0.0,0.0,0.0,0.0,0.0,0.0,0.0,0.0,0.0,0.0
ROSS,...How long ago was Korea?,MALE,0.0,0.0,0.0,0.0,0.0,0.0,0.0,0.0,0.9707568287849426,0.0,0.0,0.0,0.0,0.0,0.0,0.0,0.0,0.0,0.0,0.0,0.0,0.0,0.0,0.0,0.0,0.0,0.0,0.0
SHURI,Yesterday.,FEMALE,0.9979512095451355,0.0,0.0,0.0,0.0,0.0,0.0,0.0,0.0,0.0,0.0,0.0,0.0,0.0,0.0,0.0,0.0,0.0,0.0,0.0,0.0,0.0,0.0,0.0,0.0,0.0,0.0,0.0
ROSS,I don't think so. Bullet wounds don't just magically heal overnight.,MALE,0.0,0.0,0.0,0.0,0.0,0.0,0.0,0.0,0.0,0.0,0.0,0.9973058700561523,0.0,0.0,0.0,0.0,0.0,0.0,0.0,0.0,0.0,0.0,0.0,0.0,0.0,0.0,0.0,0.0
SHURI,"They do here. But not by magic, by technology.  Don't touch anything. My brother will return soon.",FEMALE,0.9860483407974243,0.0,0.0,0.0,0.0,0.0,0.0,0.0,0.0,0.0,0.0,0.0,0.0,0.0,0.0,0.0,0.0,0.0,0.0,0.0,0.0,0.0,0.0,0.0,0.0,0.0,0.0,0.0
ROSS,"These train things... that's magnetic levitation, right?",MALE,0.0,0.0,0.0,0.0,0.0,0.0,0.0,0.0,0.9946343898773193,0.0,0.0,0.0,0.0,0.0,0.0,0.0,0.0,0.0,0.0,0.0,0.0,0.0,0.0,0.0,0.0,0.0,0.0,0.0
SHURI,Obviously.,FEMALE,0.9949172735214233,0.0,0.0,0.0,0.0,0.0,0.0,0.0,0.0,0.0,0.0,0.0,0.0,0.0,0.0,0.0,0.0,0.0,0.0,0.0,0.0,0.0,0.0,0.0,0.0,0.0,0.0,0.0
ROSS,"Obviously... but I've never seen it this efficient. The light panels, what are they?",MALE,0.0,0.0,0.0,0.0,0.0,0.0,0.0,0.6430692672729492,0.8950892090797424,0.0,0.0,0.0,0.0,0.0,0.0,0.0,0.0,0.0,0.0,0.0,0.0,0.0,0.0,0.0,0.0,0.0,0.0,0.0
SHURI,Sonic stabilizers.,FEMALE,0.9987419247627258,0.0,0.0,0.0,0.0,0.0,0.0,0.0,0.0,0.0,0.0,0.0,0.0,0.0,0.0,0.0,0.0,0.0,0.0,0.0,0.0,0.0,0.0,0.0,0.0,0.0,0.0,0.0
ROSS,Sonic what?,MALE,0.9949724674224854,0.0,0.0,0.0,0.0,0.0,0.0,0.0,0.0,0.0,0.0,0.0,0.0,0.0,0.0,0.0,0.0,0.0,0.0,0.0,0.0,0.0,0.0,0.0,0.0,0.0,0.0,0.0
SHURI,"In it's raw form, vibranium is too dangerous to be transported at that speed, so I developed a way to temporarily deactivate it.",FEMALE,0.9814735054969788,0.0,0.0,0.0,0.0,0.0,0.0,0.0,0.0,0.0,0.0,0.0,0.0,0.0,0.0,0.0,0.0,0.0,0.0,0.0,0.0,0.0,0.0,0.0,0.0,0.0,0.0,0.0
ROSS,There's vibranium on those trains?,MALE,0.0,0.0,0.0,0.0,0.0,0.0,0.0,0.44452130794525146,0.986738920211792,0.0,0.0,0.0,0.0,0.0,0.0,0.0,0.0,0.0,0.0,0.0,0.0,0.0,0.0,0.0,0.0,0.0,0.0,0.0
SHURI,There is vibranium all around us. That's how I healed you.,FEMALE,0.5187837481498718,0.0,0.0,0.0,0.0,0.0,0.0,0.0,0.0,0.0,0.0,0.0,0.0,0.0,0.0,0.0,0.0,0.0,0.0,0.0,0.0,0.0,0.0,0.32141613960266113,0.0,0.0,0.0,0.0
OKOYE,Where is T'Challa? His Kimoyo beads have been switched off.,FEMALE,0.7232909202575684,0.0,0.0,0.0,0.0,0.0,0.0,0.9331175088882446,0.0,0.0,0.0,0.0,0.0,0.0,0.0,0.0,0.0,0.0,0.0,0.0,0.0,0.0,0.0,0.0,0.0,0.0,0.0,0.0
SHURI,"Well we are not joined at the hip, Okoye.",FEMALE,0.9986648559570312,0.0,0.0,0.0,0.0,0.0,0.0,0.0,0.0,0.0,0.0,0.0,0.0,0.0,0.0,0.0,0.0,0.0,0.0,0.0,0.0,0.0,0.0,0.0,0.0,0.0,0.0,0.0
OKOYE,A man showed up at the border who claims to have killed Klaue.,FEMALE,0.9982202649116516,0.0,0.0,0.0,0.0,0.0,0.0,0.0,0.0,0.0,0.0,0.0,0.0,0.0,0.0,0.0,0.0,0.0,0.0,0.0,0.0,0.0,0.0,0.0,0.0,0.0,0.0,0.0
SHURI,What?,FEMALE,0.3640415370464325,0.0,0.0,0.0,0.0,0.0,0.0,0.0,0.6699512004852295,0.0,0.0,0.0,0.0,0.0,0.0,0.0,0.0,0.0,0.0,0.0,0.0,0.0,0.0,0.0,0.0,0.0,0.0,0.0
OKOYE,W'Kabi is transporting him as we speak to the palace. We need to find your brother.,FEMALE,0.9902447462081909,0.0,0.0,0.0,0.0,0.0,0.0,0.0,0.0,0.0,0.0,0.0,0.0,0.0,0.0,0.0,0.0,0.0,0.0,0.0,0.0,0.0,0.0,0.0,0.0,0.0,0.0,0.0
SHURI,An outsider?,FEMALE,0.9982298016548157,0.0,0.0,0.0,0.0,0.0,0.0,0.0,0.0,0.0,0.0,0.0,0.0,0.0,0.0,0.0,0.0,0.0,0.0,0.0,0.0,0.0,0.0,0.0,0.0,0.0,0.0,0.0
OKOYE,"No, a Wakandan.",FEMALE,0.9760776162147522,0.0,0.0,0.0,0.0,0.0,0.0,0.0,0.0,0.0,0.0,0.573939323425293,0.0,0.0,0.0,0.0,0.0,0.0,0.0,0.0,0.0,0.0,0.0,0.0,0.0,0.0,0.0,0.0
ROSS,He's not a Wakandan. He's one of ours.,MALE,0.0,0.0,0.0,0.0,0.0,0.0,0.0,0.0,0.0,0.0,0.0,0.9907588958740234,0.0,0.0,0.0,0.0,0.0,0.0,0.0,0.0,0.0,0.0,0.0,0.0,0.0,0.0,0.0,0.0
T'CHALA,He killed his own brother... and left a child behind with nothing. What kind of King ... what kind of man does that?,MALE,0.0,0.0,0.0,0.0,0.0,0.0,0.0,0.0,0.8016679883003235,0.0,0.0,0.0,0.0,0.0,0.0,0.0,0.0,0.0,0.0,0.0,0.0,0.0,0.0,0.0,0.0,0.0,0.0,0.0
NAKIA,No man is perfect. Not even your father.,FEMALE,0.0,0.0,0.0,0.0,0.5898966193199158,0.0,0.0,0.0,0.0,0.0,0.0,0.8266516327857971,0.0,0.0,0.0,0.0,0.0,0.0,0.0,0.0,0.0,0.0,0.0,0.0,0.0,0.0,0.0,0.0
T'CHALA,"He didn't even give him a proper burial... My Uncle N'Jobu betrayed us, but my father may have created something even worse.",MALE,0.0,0.0,0.0,0.851267397403717,0.4020477831363678,0.0,0.0,0.0,0.0,0.0,0.0,0.0,0.8654835820198059,0.0,0.0,0.0,0.0,0.0,0.0,0.0,0.0,0.0,0.0,0.0,0.0,0.0,0.0,0.0
NAKIA,Hey. Look at me. You can't let your father's mistakes define who you are. You get to decide what kind of King you are going to be.,FEMALE,0.0,0.0,0.0,0.0,0.0,0.0,0.0,0.0,0.6987248063087463,0.0,0.0,0.0,0.0,0.0,0.0,0.0,0.0,0.0,0.0,0.0,0.0,0.0,0.0,0.0,0.0,0.0,0.0,0.0
SHURI,"Brother, you need to get here now.",FEMALE,0.9985297918319702,0.0,0.0,0.0,0.0,0.0,0.0,0.0,0.0,0.0,0.0,0.0,0.0,0.0,0.0,0.0,0.0,0.0,0.0,0.0,0.0,0.0,0.0,0.0,0.0,0.0,0.0,0.0
ROSS,Eric Stevens. Graduated Annapolis age 19. MIT for grad school. Joined the SEALs and went to Afghanistan where he racked up confirmed kills like it was a video game. They started calling him Killmonger. He joined a JSOC ghost unit.,MALE,0.9901482462882996,0.0,0.0,0.0,0.0,0.0,0.0,0.0,0.0,0.0,0.0,0.0,0.0,0.0,0.0,0.0,0.0,0.0,0.0,0.0,0.0,0.0,0.0,0.0,0.0,0.0,0.0,0.0
ROSS,Now these guys are serious. They will drop off the grid so they can commit assassinations and take down governments.,MALE,0.7865056395530701,0.0,0.0,0.6894594430923462,0.0,0.0,0.0,0.0,0.0,0.0,0.0,0.0,0.0,0.0,0.0,0.0,0.0,0.0,0.0,0.0,0.0,0.0,0.0,0.0,0.0,0.0,0.0,0.0
T'CHALA,Did he reveal anything about his identity?,MALE,0.0,0.0,0.0,0.0,0.0,0.0,0.0,0.8665035367012024,0.8953440189361572,0.0,0.0,0.0,0.0,0.0,0.0,0.0,0.0,0.0,0.0,0.0,0.0,0.0,0.0,0.0,0.0,0.0,0.0,0.0
SHURI,He has a War Dog tattoo but we have no record of him.,FEMALE,0.994870662689209,0.0,0.0,0.0,0.0,0.0,0.0,0.0,0.0,0.0,0.0,0.0,0.0,0.0,0.0,0.0,0.0,0.0,0.0,0.0,0.0,0.0,0.0,0.0,0.0,0.0,0.0,0.0
RIVER TRIBE ELDER,Is this man Wakandan or not?,MALE,0.3587598204612732,0.0,0.0,0.0,0.0,0.0,0.0,0.7720792889595032,0.3752846121788025,0.0,0.0,0.0,0.0,0.0,0.0,0.0,0.0,0.0,0.0,0.0,0.0,0.0,0.0,0.0,0.0,0.0,0.0,0.0
MINING TRIBE ELDER,Tell us what is going on.,FEMALE,0.0,0.0,0.0,0.0,0.0,0.0,0.0,0.0,0.9892048835754395,0.0,0.0,0.0,0.0,0.0,0.0,0.0,0.0,0.0,0.0,0.0,0.0,0.0,0.0,0.0,0.0,0.0,0.0,0.0
T'CHALA,Speak.,MALE,0.9978176355361938,0.0,0.0,0.0,0.0,0.0,0.0,0.0,0.0,0.0,0.0,0.0,0.0,0.0,0.0,0.0,0.0,0.0,0.0,0.0,0.0,0.0,0.0,0.0,0.0,0.0,0.0,0.0
W'KABI,Speak.,MALE,0.9978176355361938,0.0,0.0,0.0,0.0,0.0,0.0,0.0,0.0,0.0,0.0,0.0,0.0,0.0,0.0,0.0,0.0,0.0,0.0,0.0,0.0,0.0,0.0,0.0,0.0,0.0,0.0,0.0
KILLMONGER,I'm standing in your house. Serving justice to a man who stole your vibranium and murdered your people. Justice your King couldn't deliver.,MALE,0.0,0.0,0.0,0.9883748292922974,0.0,0.0,0.0,0.0,0.0,0.0,0.0,0.0,0.0,0.0,0.0,0.0,0.0,0.0,0.0,0.0,0.0,0.0,0.0,0.0,0.0,0.0,0.0,0.0
T'CHALA,"I don't care that you brought Klaue, the only reason I don't kill you where you stand is because I know who you are... now what do you want?",MALE,0.0,0.0,0.0,0.5396246314048767,0.0,0.0,0.0,0.0,0.0,0.0,0.0,0.0,0.0,0.0,0.0,0.0,0.0,0.0,0.0,0.0,0.0,0.0,0.0,0.0,0.0,0.0,0.0,0.0
KILLMONGER,I want the throne.,MALE,0.0,0.0,0.0,0.0,0.0,0.0,0.0,0.0,0.0,0.9769976139068604,0.0,0.0,0.0,0.0,0.0,0.0,0.0,0.0,0.0,0.0,0.0,0.0,0.0,0.0,0.0,0.0,0.0,0.0
MINING TRIBE ELDER,My goodness.,FEMALE,0.0,0.0,0.0,0.0,0.0,0.0,0.0,0.0,0.0,0.0,0.0,0.0,0.0,0.0,0.0,0.0,0.0,0.0,0.0,0.0,0.0,0.0,0.0,0.0,0.0,0.0,0.0,0.0
KILLMONGER,"Y'all sittin' up here comfortable. Must feel good. There's about billion people all over the world that looks like us but their lives are a lot harder, Wakanda has the tools to liberate them all.",MALE,0.0,0.9744154214859009,0.0,0.0,0.0,0.0,0.0,0.0,0.0,0.0,0.0,0.0,0.0,0.0,0.0,0.0,0.0,0.0,0.0,0.0,0.0,0.0,0.0,0.0,0.0,0.0,0.0,0.0
T'CHALA,And what tools are those?,MALE,0.0,0.0,0.0,0.0,0.0,0.0,0.0,0.0,0.9876904487609863,0.0,0.0,0.0,0.0,0.0,0.0,0.0,0.0,0.0,0.0,0.0,0.0,0.0,0.0,0.0,0.0,0.0,0.0,0.0
KILLMONGER,Vibranium. Your weapons.,MALE,0.9976207613945007,0.0,0.0,0.0,0.0,0.0,0.0,0.0,0.0,0.0,0.0,0.0,0.0,0.0,0.0,0.0,0.0,0.0,0.0,0.0,0.0,0.0,0.0,0.0,0.0,0.0,0.0,0.0
T'CHALA,Our weapons will not be used to wage war on the world. It is not our way to be judge jury and executioner for people who are not our own.,MALE,0.0,0.0,0.0,0.0,0.0,0.0,0.0,0.0,0.0,0.0,0.0,0.9919718503952026,0.0,0.0,0.0,0.0,0.0,0.0,0.0,0.0,0.0,0.0,0.0,0.0,0.0,0.0,0.0,0.0
KILLMONGER,"Not your own? But didn't life start here, on this continent? So ain't all people your people?",MALE,0.0,0.0,0.0,0.0,0.0,0.0,0.0,0.7659489512443542,0.936888575553894,0.0,0.0,0.0,0.0,0.0,0.0,0.0,0.0,0.0,0.0,0.0,0.0,0.0,0.0,0.0,0.0,0.0,0.0,0.0
T'CHALA,I am not King of all people. I am King of Wakanda. And it is my responsibility to make sure our people are safe and that vibranium does not fall into the hands of a person like you.,MALE,0.0,0.0,0.0,0.0,0.0,0.0,0.7248054146766663,0.0,0.0,0.0,0.0,0.0,0.0,0.0,0.0,0.0,0.0,0.0,0.0,0.0,0.0,0.0,0.0,0.3966125547885895,0.0,0.0,0.0,0.0
RAMONDA,"Son, we have entertained this charlatan for too long. Reject his request.",FEMALE,0.7224720120429993,0.0,0.0,0.0,0.0,0.6553202867507935,0.0,0.0,0.0,0.0,0.0,0.0,0.0,0.0,0.0,0.0,0.0,0.0,0.0,0.0,0.0,0.0,0.0,0.0,0.0,0.0,0.0,0.0
KILLMONGER,"Oh, I ain't requesting nothing! Ask who I am?",MALE,0.9970371723175049,0.0,0.0,0.0,0.0,0.0,0.0,0.0,0.0,0.0,0.0,0.0,0.0,0.0,0.0,0.0,0.0,0.0,0.0,0.0,0.0,0.0,0.0,0.0,0.0,0.0,0.0,0.0
SHURI,You are Eric Stevens. An American black operative. A mercenary nicknamed Killmonger. That's who you are.,FEMALE,0.9966062307357788,0.0,0.0,0.0,0.0,0.0,0.0,0.0,0.0,0.0,0.0,0.0,0.0,0.0,0.0,0.0,0.0,0.0,0.0,0.0,0.0,0.0,0.0,0.0,0.0,0.0,0.0,0.0
KILLMONGER,"That's not my name, Princess. Ask me, King?",MALE,0.9652281999588013,0.0,0.0,0.0,0.0,0.0,0.0,0.0,0.0,0.0,0.0,0.0,0.0,0.0,0.0,0.0,0.0,0.0,0.0,0.0,0.0,0.0,0.0,0.0,0.0,0.0,0.0,0.0
T'CHALA,No.,MALE,0.9917975664138794,0.0,0.0,0.0,0.0,0.0,0.0,0.0,0.0,0.0,0.0,0.0,0.0,0.0,0.0,0.0,0.0,0.0,0.0,0.0,0.0,0.0,0.0,0.0,0.0,0.0,0.0,0.0
KILLMONGER,Ask me.,MALE,0.9977096319198608,0.0,0.0,0.0,0.0,0.0,0.0,0.0,0.0,0.0,0.0,0.0,0.0,0.0,0.0,0.0,0.0,0.0,0.0,0.0,0.0,0.0,0.0,0.0,0.0,0.0,0.0,0.0
T'CHALA,Take him away.,MALE,0.9950716495513916,0.0,0.0,0.0,0.0,0.0,0.0,0.0,0.0,0.0,0.0,0.0,0.0,0.0,0.0,0.0,0.0,0.0,0.0,0.0,0.0,0.0,0.0,0.0,0.0,0.0,0.0,0.0
RIVER TRIBE ELDER,Who are you?,MALE,0.3571455180644989,0.0,0.0,0.0,0.0,0.0,0.0,0.0,0.5552093982696533,0.0,0.0,0.0,0.0,0.0,0.0,0.0,0.0,0.0,0.0,0.0,0.0,0.0,0.0,0.0,0.0,0.0,0.0,0.0
KILLMONGER,"I am N'Jadaka, son of Prince N'Jobu.",MALE,0.9985917210578918,0.0,0.0,0.0,0.0,0.0,0.0,0.0,0.0,0.0,0.0,0.0,0.0,0.0,0.0,0.0,0.0,0.0,0.0,0.0,0.0,0.0,0.0,0.0,0.0,0.0,0.0,0.0
MINING TRIBE ELDER,The son of N'Jobu?,FEMALE,0.9927821159362793,0.0,0.0,0.0,0.0,0.0,0.0,0.0,0.0,0.0,0.0,0.0,0.0,0.0,0.0,0.0,0.0,0.0,0.0,0.0,0.0,0.0,0.0,0.0,0.0,0.0,0.0,0.0
