character,line,gender,admiration,amusement,anger,annoyance,approval,caring,confusion,curiosity,desire,disappointment,disapproval,disgust,embarrassment,excitement,fear,gratitude,grief,joy,love,nervousness,optimism,pride,realization,relief,remorse,sadness,surprise,neutral
KILLMONGER,I found my daddy with Panther claws in his chest. You ain't the son of a King you're the son of a murderer!,MALE,0.6253280639648438,0.0,0.0,0.8408847451210022,0.0,0.0,0.0,0.0,0.0,0.0,0.0,0.0,0.0,0.0,0.0,0.0,0.0,0.0,0.0,0.0,0.0,0.0,0.0,0.0,0.0,0.0,0.0,0.0
RAMONDA,You're lying!  Lies.,FEMALE,0.951103687286377,0.0,0.0,0.5994062423706055,0.0,0.0,0.0,0.0,0.0,0.0,0.0,0.0,0.0,0.0,0.0,0.0,0.0,0.0,0.0,0.0,0.0,0.0,0.0,0.0,0.0,0.0,0.0,0.0
W'KABI,I'm afraid not Queen Mother.,MALE,0.0,0.0,0.0,0.0,0.0,0.0,0.0,0.0,0.0,0.0,0.0,0.0,0.0,0.0,0.0,0.9895142316818237,0.0,0.0,0.0,0.0,0.0,0.0,0.0,0.0,0.0,0.0,0.0,0.0
MINING TRIBE ELDER,The descendant of N'Jobu.,FEMALE,0.9989720582962036,0.0,0.0,0.0,0.0,0.0,0.0,0.0,0.0,0.0,0.0,0.0,0.0,0.0,0.0,0.0,0.0,0.0,0.0,0.0,0.0,0.0,0.0,0.0,0.0,0.0,0.0,0.0
KILLMONGER,Hey Auntie.,MALE,0.9678597450256348,0.0,0.0,0.0,0.0,0.0,0.0,0.0,0.0,0.0,0.0,0.0,0.0,0.0,0.0,0.0,0.0,0.0,0.0,0.0,0.0,0.0,0.0,0.0,0.0,0.0,0.0,0.0
KILLMONGER,I'm exercising my blood right to challenge for the mantles of King and Black Panther. ,MALE,0.9963939785957336,0.0,0.0,0.0,0.0,0.0,0.0,0.0,0.0,0.0,0.0,0.0,0.0,0.0,0.0,0.0,0.0,0.0,0.0,0.0,0.0,0.0,0.0,0.0,0.0,0.0,0.0,0.0
RAMONDA,Do not do this T'Challa.,FEMALE,0.0,0.0,0.0,0.0,0.0,0.0,0.0,0.0,0.0,0.0,0.0,0.9780405759811401,0.0,0.0,0.0,0.0,0.0,0.0,0.0,0.0,0.0,0.0,0.0,0.0,0.0,0.0,0.0,0.0
BORDER TRIBE ELDER,As the son of N'Jobu he is within his rights.,MALE,0.5963960289955139,0.0,0.0,0.0,0.0,0.9591753482818604,0.0,0.0,0.0,0.0,0.0,0.0,0.0,0.0,0.0,0.0,0.0,0.0,0.0,0.0,0.0,0.0,0.0,0.0,0.0,0.0,0.0,0.0
RAMONDA,He has no rights here.,FEMALE,0.8931524753570557,0.0,0.0,0.0,0.0,0.3238735795021057,0.0,0.0,0.0,0.0,0.0,0.0,0.0,0.0,0.0,0.0,0.0,0.0,0.0,0.0,0.0,0.0,0.0,0.0,0.0,0.0,0.0,0.0
RIVER TRIBE ELDER,The challenge would take weeks to prepare.,MALE,0.9853115081787109,0.0,0.0,0.0,0.0,0.0,0.0,0.0,0.0,0.0,0.0,0.0,0.0,0.0,0.0,0.0,0.0,0.0,0.0,0.0,0.0,0.0,0.0,0.0,0.0,0.0,0.0,0.0
KILLMONGER,Weeks? I don't need weeks. The whole country ain't gotta be there I just need him... and somebody to get me out of these chains.,MALE,0.43242841958999634,0.0,0.0,0.0,0.0,0.0,0.0,0.0,0.0,0.0,0.0,0.0,0.0,0.0,0.0,0.0,0.0,0.0,0.0,0.0,0.0,0.0,0.0,0.0,0.0,0.0,0.0,0.0
RAMONDA,"T'Challa, what do you know of this?",FEMALE,0.0,0.0,0.0,0.0,0.0,0.0,0.0,0.0,0.9809775948524475,0.0,0.0,0.0,0.0,0.0,0.0,0.0,0.0,0.0,0.0,0.0,0.0,0.0,0.0,0.0,0.0,0.0,0.0,0.0
T'CHALA,I accept your challenge.,MALE,0.0,0.0,0.0,0.0,0.0,0.9936339855194092,0.0,0.0,0.0,0.0,0.0,0.0,0.0,0.0,0.0,0.0,0.0,0.0,0.0,0.0,0.0,0.0,0.0,0.0,0.0,0.0,0.0,0.0
SHURI,He will never beat T' Challa. He should have just come to the first challenge and gotten it over with.,FEMALE,0.97207111120224,0.0,0.0,0.0,0.0,0.0,0.0,0.0,0.0,0.0,0.0,0.0,0.0,0.0,0.0,0.0,0.0,0.0,0.0,0.0,0.0,0.0,0.0,0.0,0.0,0.0,0.0,0.0
ZURI,The King will now have the strength of the Black Panther stripped away.,MALE,0.9974457025527954,0.0,0.0,0.0,0.0,0.0,0.0,0.0,0.0,0.0,0.0,0.0,0.0,0.0,0.0,0.0,0.0,0.0,0.0,0.0,0.0,0.0,0.0,0.0,0.0,0.0,0.0,0.0
OKOYE,Where is Agent Ross?,FEMALE,0.5984164476394653,0.0,0.0,0.0,0.0,0.0,0.0,0.8065268397331238,0.0,0.0,0.0,0.0,0.0,0.0,0.0,0.0,0.0,0.0,0.0,0.0,0.0,0.0,0.0,0.0,0.0,0.0,0.0,0.0
NAKIA,I locked him in the office. He's not going anywhere.,FEMALE,0.0,0.0,0.0,0.8884927034378052,0.0,0.0,0.0,0.0,0.0,0.0,0.0,0.0,0.0,0.0,0.0,0.0,0.0,0.0,0.0,0.0,0.0,0.0,0.0,0.0,0.0,0.0,0.0,0.0
T'CHALA,"This is your last chance, throw down your weapons and we can handle this another way.",MALE,0.9733940958976746,0.0,0.0,0.0,0.0,0.0,0.483652263879776,0.0,0.0,0.0,0.0,0.0,0.0,0.0,0.0,0.0,0.0,0.0,0.0,0.0,0.0,0.0,0.0,0.0,0.0,0.0,0.0,0.0
KILLMONGER,"I lived my entire life waiting for this moment. I trained, I lied, I killed, just to get here.",MALE,0.9517308473587036,0.0,0.0,0.0,0.0,0.0,0.0,0.0,0.0,0.0,0.0,0.0,0.0,0.0,0.0,0.0,0.0,0.0,0.0,0.0,0.0,0.0,0.0,0.0,0.0,0.0,0.0,0.0
KILLMONGER,"I killed in America, Afghanistan, Iraq. I took life from my own brothers and sisters right here on the continent. And all this death, just so I can kill you.",MALE,0.0,0.0,0.0,0.9025171399116516,0.0,0.0,0.0,0.0,0.0,0.0,0.0,0.0,0.0,0.0,0.0,0.0,0.0,0.0,0.0,0.0,0.0,0.0,0.0,0.0,0.0,0.0,0.0,0.0
ZURI,Let the challenge begin.,MALE,0.9786979556083679,0.0,0.0,0.0,0.0,0.0,0.0,0.0,0.0,0.0,0.0,0.0,0.0,0.0,0.0,0.0,0.0,0.0,0.0,0.0,0.0,0.0,0.0,0.0,0.0,0.0,0.0,0.0
T'CHALA,Yield!,MALE,0.998348593711853,0.0,0.0,0.0,0.0,0.0,0.0,0.0,0.0,0.0,0.0,0.0,0.0,0.0,0.0,0.0,0.0,0.0,0.0,0.0,0.0,0.0,0.0,0.0,0.0,0.0,0.0,0.0
SHURI,Snap out of it T'Challa!,FEMALE,0.997902512550354,0.0,0.0,0.0,0.0,0.0,0.0,0.0,0.0,0.0,0.0,0.0,0.0,0.0,0.0,0.0,0.0,0.0,0.0,0.0,0.0,0.0,0.0,0.0,0.0,0.0,0.0,0.0
NAKIA,Get up.,FEMALE,0.9895879030227661,0.0,0.0,0.0,0.0,0.0,0.0,0.0,0.0,0.0,0.0,0.0,0.0,0.0,0.0,0.0,0.0,0.0,0.0,0.0,0.0,0.0,0.0,0.0,0.0,0.0,0.0,0.0
KILLMONGER,This is for my father.,MALE,0.9973964691162109,0.0,0.0,0.0,0.0,0.0,0.0,0.0,0.0,0.0,0.0,0.0,0.0,0.0,0.0,0.0,0.0,0.0,0.0,0.0,0.0,0.0,0.0,0.0,0.0,0.0,0.0,0.0
T'CHALA,"Zuri, no.",MALE,0.9983173608779907,0.0,0.0,0.0,0.0,0.0,0.0,0.0,0.0,0.0,0.0,0.0,0.0,0.0,0.0,0.0,0.0,0.0,0.0,0.0,0.0,0.0,0.0,0.0,0.0,0.0,0.0,0.0
OKOYE,Zuri.,FEMALE,0.9974662065505981,0.0,0.0,0.0,0.0,0.0,0.0,0.0,0.0,0.0,0.0,0.0,0.0,0.0,0.0,0.0,0.0,0.0,0.0,0.0,0.0,0.0,0.0,0.0,0.0,0.0,0.0,0.0
RAMONDA,Zuri don't!,FEMALE,0.49599799513816833,0.0,0.0,0.0,0.0,0.0,0.0,0.0,0.0,0.0,0.0,0.9512016177177429,0.0,0.0,0.0,0.0,0.0,0.0,0.0,0.0,0.0,0.0,0.0,0.0,0.0,0.0,0.0,0.0
ZURI,I am the cause of your father's death. Not him. Take me.,MALE,0.478336364030838,0.0,0.0,0.5752632021903992,0.0,0.0,0.0,0.0,0.0,0.0,0.0,0.0,0.0,0.0,0.0,0.0,0.0,0.0,0.0,0.0,0.0,0.0,0.0,0.0,0.0,0.0,0.0,0.0
KILLMONGER,"I'll take you both, Uncle James...",MALE,0.9982067346572876,0.0,0.0,0.0,0.0,0.0,0.0,0.0,0.0,0.0,0.0,0.0,0.0,0.0,0.0,0.0,0.0,0.0,0.0,0.0,0.0,0.0,0.0,0.0,0.0,0.0,0.0,0.0
T'CHALA,Nol Zuri no! Zuri!! Noo!,MALE,0.9407059550285339,0.0,0.0,0.0,0.0,0.0,0.0,0.0,0.0,0.0,0.0,0.0,0.0,0.0,0.0,0.0,0.0,0.0,0.0,0.0,0.0,0.0,0.0,0.0,0.0,0.0,0.0,0.0
KILLMONGER,Is this your King? Huh?,MALE,0.0,0.0,0.0,0.0,0.0,0.0,0.0,0.5666018724441528,0.9888296723365784,0.0,0.0,0.0,0.0,0.0,0.0,0.0,0.0,0.0,0.0,0.0,0.0,0.0,0.0,0.0,0.0,0.0,0.0,0.0
KILLMONGER,"Is this your King? The Black Panther, who's supposed to lead you into the future.",MALE,0.0,0.0,0.0,0.0,0.0,0.0,0.0,0.0,0.9940404295921326,0.0,0.0,0.0,0.0,0.0,0.0,0.0,0.0,0.0,0.0,0.0,0.0,0.0,0.0,0.0,0.0,0.0,0.0,0.0
SHURI,Come on brother!,FEMALE,0.9973728656768799,0.0,0.0,0.0,0.0,0.0,0.0,0.0,0.0,0.0,0.0,0.0,0.0,0.0,0.0,0.0,0.0,0.0,0.0,0.0,0.0,0.0,0.0,0.0,0.0,0.0,0.0,0.0
AYO,Is there nothing that can be done?,MALE,0.7819270491600037,0.0,0.0,0.0,0.0,0.0,0.0,0.0,0.0,0.0,0.0,0.0,0.0,0.0,0.0,0.0,0.0,0.0,0.0,0.0,0.0,0.0,0.0,0.0,0.0,0.0,0.0,0.0
KILLMONGER,Him? He's supposed to protect you.,MALE,0.971304714679718,0.0,0.0,0.0,0.0,0.0,0.0,0.0,0.0,0.0,0.0,0.0,0.0,0.0,0.0,0.0,0.0,0.0,0.0,0.0,0.0,0.0,0.0,0.0,0.0,0.0,0.0,0.0
RAMONDA,No.,FEMALE,0.9917975664138794,0.0,0.0,0.0,0.0,0.0,0.0,0.0,0.0,0.0,0.0,0.0,0.0,0.0,0.0,0.0,0.0,0.0,0.0,0.0,0.0,0.0,0.0,0.0,0.0,0.0,0.0,0.0
NAKIA,No!,FEMALE,0.7102730870246887,0.0,0.0,0.0,0.0,0.0,0.0,0.0,0.0,0.0,0.0,0.9371747374534607,0.0,0.0,0.0,0.0,0.0,0.0,0.0,0.0,0.0,0.0,0.0,0.0,0.0,0.0,0.0,0.0
KILLMONGER,Nah. I'm your King.,MALE,0.351493775844574,0.0,0.0,0.0,0.0,0.0,0.0,0.0,0.0,0.0,0.0,0.0,0.0,0.0,0.0,0.0,0.0,0.0,0.0,0.0,0.0,0.0,0.0,0.0,0.0,0.0,0.0,0.0
NAKIA,"We have to go now! Queen mother, let's go!",FEMALE,0.9976704716682434,0.0,0.0,0.0,0.0,0.0,0.0,0.0,0.0,0.0,0.0,0.0,0.0,0.0,0.0,0.0,0.0,0.0,0.0,0.0,0.0,0.0,0.0,0.0,0.0,0.0,0.0,0.0
OKOYE,The Queen Mother and Shuri... they are safe?,FEMALE,0.9800467491149902,0.0,0.0,0.0,0.0,0.0,0.0,0.0,0.0,0.0,0.0,0.0,0.0,0.0,0.0,0.0,0.0,0.0,0.0,0.0,0.0,0.0,0.0,0.0,0.0,0.0,0.0,0.0
NAKIA,Yes.,FEMALE,0.0,0.0,0.0,0.0,0.0,0.9710626006126404,0.0,0.0,0.0,0.0,0.0,0.0,0.0,0.0,0.0,0.0,0.0,0.0,0.0,0.0,0.0,0.0,0.0,0.0,0.0,0.0,0.0,0.0
OKOYE,Thank you.,FEMALE,0.0,0.0,0.0,0.0,0.0,0.0,0.0,0.0,0.0,0.0,0.0,0.0,0.0,0.0,0.0,0.0,0.9966220855712891,0.0,0.0,0.0,0.0,0.0,0.0,0.0,0.0,0.0,0.0,0.0
NAKIA,We should get to them immediately.,FEMALE,0.9595006108283997,0.0,0.0,0.0,0.0,0.8024701476097107,0.0,0.0,0.0,0.0,0.0,0.0,0.0,0.0,0.0,0.0,0.0,0.0,0.0,0.0,0.0,0.0,0.0,0.0,0.0,0.0,0.0,0.0
OKOYE,I cannot...,FEMALE,0.5961688160896301,0.0,0.0,0.0,0.0,0.0,0.0,0.0,0.0,0.0,0.0,0.9525447487831116,0.0,0.0,0.0,0.0,0.0,0.0,0.0,0.0,0.0,0.0,0.0,0.0,0.0,0.0,0.0,0.0
NAKIA,What...,FEMALE,0.9941593408584595,0.0,0.0,0.0,0.0,0.0,0.0,0.0,0.0,0.0,0.0,0.0,0.0,0.0,0.0,0.0,0.0,0.0,0.0,0.0,0.0,0.0,0.0,0.0,0.0,0.0,0.0,0.0
OKOYE,Though my heart is with you.,FEMALE,0.3755449950695038,0.0,0.0,0.0,0.0,0.0,0.8413810133934021,0.0,0.0,0.0,0.0,0.0,0.0,0.0,0.0,0.0,0.0,0.0,0.0,0.0,0.0,0.0,0.0,0.0,0.0,0.0,0.0,0.0
NAKIA,We cannot turn over our nation to a man who showed up here only hours ago.,FEMALE,0.9983749389648438,0.0,0.0,0.0,0.0,0.0,0.0,0.0,0.0,0.0,0.0,0.0,0.0,0.0,0.0,0.0,0.0,0.0,0.0,0.0,0.0,0.0,0.0,0.0,0.0,0.0,0.0,0.0
OKOYE,He is of royal blood.,FEMALE,0.9972821474075317,0.0,0.0,0.0,0.0,0.0,0.0,0.0,0.0,0.0,0.0,0.0,0.0,0.0,0.0,0.0,0.0,0.0,0.0,0.0,0.0,0.0,0.0,0.0,0.0,0.0,0.0,0.0
NAKIA,He killed T' Challa.,FEMALE,0.9634281992912292,0.0,0.0,0.0,0.0,0.0,0.0,0.0,0.0,0.0,0.0,0.0,0.0,0.0,0.0,0.0,0.0,0.0,0.0,0.0,0.0,0.0,0.0,0.0,0.0,0.0,0.0,0.0
OKOYE,In ritual combat.,FEMALE,0.9975870847702026,0.0,0.0,0.0,0.0,0.0,0.0,0.0,0.0,0.0,0.0,0.0,0.0,0.0,0.0,0.0,0.0,0.0,0.0,0.0,0.0,0.0,0.0,0.0,0.0,0.0,0.0,0.0
NAKIA,Does that really matter?,FEMALE,0.0,0.0,0.0,0.0,0.0,0.0,0.0,0.9334825277328491,0.38844621181488037,0.0,0.0,0.0,0.0,0.0,0.0,0.0,0.0,0.0,0.0,0.0,0.0,0.0,0.0,0.0,0.0,0.0,0.0,0.0
NAKIA,You are the greatest warrior Wakanda has. Help me overthrow him before he becomes too strong.,FEMALE,0.0,0.9487814903259277,0.0,0.0,0.0,0.0,0.0,0.0,0.0,0.0,0.0,0.0,0.0,0.0,0.0,0.0,0.0,0.0,0.0,0.0,0.0,0.0,0.0,0.0,0.0,0.0,0.0,0.0
OKOYE,"Overthrow?! Nakia, I am not a spy who can come and go as they so choose. I am loyal to the throne, no matter who sits upon it. What are you loyal to?",FEMALE,0.8122632503509521,0.0,0.0,0.0,0.0,0.0,0.0,0.0,0.7035185098648071,0.0,0.0,0.0,0.0,0.0,0.0,0.0,0.0,0.0,0.0,0.0,0.0,0.0,0.0,0.0,0.0,0.0,0.0,0.0
NAKIA,I loved him. I love my country too.,FEMALE,0.0,0.0,0.0,0.0,0.0,0.0,0.0,0.0,0.0,0.0,0.0,0.0,0.0,0.0,0.0,0.0,0.0,0.0,0.0,0.992928683757782,0.0,0.0,0.0,0.0,0.0,0.0,0.0,0.0
OKOYE,Then you serve your country.,FEMALE,0.9861578941345215,0.0,0.0,0.0,0.0,0.0,0.0,0.0,0.0,0.0,0.0,0.0,0.0,0.0,0.0,0.0,0.0,0.0,0.0,0.0,0.0,0.0,0.0,0.0,0.0,0.0,0.0,0.0
NAKIA,No. I save my country.,FEMALE,0.0,0.0,0.0,0.0,0.0,0.0,0.0,0.0,0.0,0.0,0.0,0.0,0.0,0.0,0.0,0.0,0.0,0.0,0.0,0.0,0.0,0.0,0.0,0.0,0.0,0.0,0.0,0.0
ROSS,What's wrong?,MALE,0.0,0.0,0.0,0.0,0.0,0.0,0.0,0.0,0.9549494981765747,0.0,0.0,0.0,0.0,0.0,0.0,0.0,0.0,0.0,0.0,0.0,0.0,0.0,0.0,0.0,0.0,0.0,0.0,0.0
NAKIA,"The King is dead. Come with me, unless you want to join him.",FEMALE,0.9988804459571838,0.0,0.0,0.0,0.0,0.0,0.0,0.0,0.0,0.0,0.0,0.0,0.0,0.0,0.0,0.0,0.0,0.0,0.0,0.0,0.0,0.0,0.0,0.0,0.0,0.0,0.0,0.0
SHURI,"First Baba, and now my brother. Mama, we didn't even get to bury him.",FEMALE,0.9985877275466919,0.0,0.0,0.0,0.0,0.0,0.0,0.0,0.0,0.0,0.0,0.0,0.0,0.0,0.0,0.0,0.0,0.0,0.0,0.0,0.0,0.0,0.0,0.0,0.0,0.0,0.0,0.0
NAKIA,It's me.,FEMALE,0.9982940554618835,0.0,0.0,0.0,0.0,0.0,0.0,0.0,0.0,0.0,0.0,0.0,0.0,0.0,0.0,0.0,0.0,0.0,0.0,0.0,0.0,0.0,0.0,0.0,0.0,0.0,0.0,0.0
RAMONDA,Nakia. Who is this man?,FEMALE,0.0,0.0,0.0,0.0,0.0,0.0,0.0,0.5103434324264526,0.0,0.0,0.0,0.0,0.0,0.0,0.0,0.0,0.0,0.0,0.0,0.0,0.0,0.0,0.0,0.0,0.0,0.0,0.0,0.0
NAKIA,He's a friend of T' Challa's he saved my life.,FEMALE,0.0,0.0,0.0,0.0,0.0,0.4180586636066437,0.600273609161377,0.0,0.0,0.0,0.0,0.0,0.0,0.0,0.0,0.0,0.0,0.0,0.0,0.0,0.0,0.0,0.0,0.0,0.0,0.0,0.0,0.0
RAMONDA,Where is Okoye?,FEMALE,0.6552301049232483,0.0,0.0,0.0,0.0,0.0,0.0,0.0,0.4332731366157532,0.0,0.0,0.0,0.0,0.0,0.0,0.0,0.0,0.0,0.0,0.0,0.0,0.0,0.0,0.0,0.0,0.0,0.0,0.0
NAKIA,Okoye is not corning. She and Dora Milaje will serve the new King.  Wait here.,FEMALE,0.9981042146682739,0.0,0.0,0.0,0.0,0.0,0.0,0.0,0.0,0.0,0.0,0.0,0.0,0.0,0.0,0.0,0.0,0.0,0.0,0.0,0.0,0.0,0.0,0.0,0.0,0.0,0.0,0.0
RAMONDA,What has happened to our Wakanda?,FEMALE,0.0,0.0,0.0,0.0,0.0,0.0,0.0,0.0,0.9771718382835388,0.0,0.0,0.0,0.0,0.0,0.0,0.0,0.0,0.0,0.0,0.0,0.0,0.0,0.0,0.0,0.0,0.0,0.0,0.0
SHAMAN,Allow the Heart Shaped Herb to give you the powers of the Black Panther and take you to the Ancestral Plane.,FEMALE,0.997728168964386,0.0,0.0,0.0,0.0,0.0,0.0,0.0,0.0,0.0,0.0,0.0,0.0,0.0,0.0,0.0,0.0,0.0,0.0,0.0,0.0,0.0,0.0,0.0,0.0,0.0,0.0,0.0
N'JOBU,What did I tell you about going into my things?  What did you find?,MALE,0.8835989832878113,0.0,0.0,0.0,0.0,0.0,0.0,0.0,0.5388967990875244,0.0,0.0,0.0,0.0,0.0,0.0,0.0,0.0,0.0,0.0,0.0,0.0,0.0,0.0,0.0,0.0,0.0,0.0,0.0
KILLMONGER,Your home.,MALE,0.9977092742919922,0.0,0.0,0.0,0.0,0.0,0.0,0.0,0.0,0.0,0.0,0.0,0.0,0.0,0.0,0.0,0.0,0.0,0.0,0.0,0.0,0.0,0.0,0.0,0.0,0.0,0.0,0.0
N'JOBU,I gave you a key hoping that you might see it someday.,MALE,0.0,0.0,0.0,0.0,0.0,0.0,0.0,0.0,0.0,0.0,0.0,0.0,0.0,0.0,0.0,0.0,0.0,0.0,0.0,0.0,0.0,0.962163507938385,0.0,0.0,0.0,0.0,0.0,0.0
N'JOBU,Yes. The sunsets there are the most beautiful in the world. But I fear you still may not be welcome.,MALE,0.0,0.9913918972015381,0.0,0.0,0.0,0.0,0.0,0.0,0.0,0.0,0.0,0.0,0.0,0.0,0.0,0.9094659090042114,0.0,0.0,0.0,0.0,0.0,0.0,0.0,0.0,0.0,0.0,0.0,0.0
KILLMONGER,Why?,MALE,0.985918402671814,0.0,0.0,0.0,0.0,0.0,0.0,0.0,0.0,0.0,0.0,0.0,0.0,0.0,0.0,0.0,0.0,0.0,0.0,0.0,0.0,0.0,0.0,0.0,0.0,0.0,0.0,0.0
N'JOBU,They will say you are lost.,MALE,0.9987290501594543,0.0,0.0,0.0,0.0,0.0,0.0,0.0,0.0,0.0,0.0,0.0,0.0,0.0,0.0,0.0,0.0,0.0,0.0,0.0,0.0,0.0,0.0,0.0,0.0,0.0,0.0,0.0
KILLMONGER,"But, I'm right here.",MALE,0.8990505933761597,0.0,0.0,0.0,0.0,0.8409168124198914,0.0,0.0,0.0,0.0,0.0,0.0,0.0,0.0,0.0,0.0,0.0,0.0,0.0,0.0,0.0,0.0,0.0,0.0,0.0,0.0,0.0,0.0
N'JOBU,No tears for me?,MALE,0.0,0.0,0.0,0.0,0.0,0.0,0.0,0.8201978802680969,0.4218434989452362,0.0,0.0,0.0,0.0,0.0,0.0,0.0,0.0,0.0,0.0,0.0,0.0,0.0,0.0,0.0,0.0,0.0,0.0,0.0
KILLMONGER,Everybody dies. It's just life around here.,MALE,0.9709111452102661,0.0,0.0,0.0,0.0,0.0,0.0,0.0,0.0,0.0,0.0,0.0,0.0,0.0,0.0,0.0,0.0,0.0,0.0,0.0,0.0,0.0,0.0,0.0,0.0,0.0,0.0,0.0
N'JOBU,Well look at what I have done. I should have taken you back long ago.,MALE,0.9892780780792236,0.0,0.0,0.0,0.0,0.0,0.0,0.0,0.0,0.0,0.0,0.0,0.0,0.0,0.0,0.0,0.0,0.0,0.0,0.0,0.0,0.0,0.0,0.0,0.0,0.0,0.0,0.0
N'JOBU,"Instead, we are both abandoned here.",MALE,0.0,0.0,0.0,0.0,0.0,0.0,0.0,0.0,0.0,0.0,0.8612349033355713,0.0,0.0,0.0,0.0,0.0,0.0,0.0,0.0,0.0,0.0,0.0,0.0,0.0,0.0,0.0,0.0,0.0
KILLMONGER,Well maybe your home is the one that's lost. That's why they can't find us.,MALE,0.43286558985710144,0.0,0.0,0.0,0.0,0.0,0.0,0.0,0.0,0.0,0.563840925693512,0.0,0.0,0.0,0.0,0.0,0.0,0.0,0.0,0.0,0.0,0.0,0.0,0.42893508076667786,0.0,0.0,0.0,0.0
SHAMAN,"Breathe, my King. Breathe!",FEMALE,0.0,0.0,0.0,0.0,0.0,0.0,0.0,0.0,0.0,0.0,0.0,0.0,0.0,0.0,0.0,0.0,0.0,0.0,0.0,0.3366624116897583,0.0,0.0,0.0,0.0,0.0,0.0,0.0,0.0
KILLMONGER,The Heart Shaped Herb did that?,MALE,0.0,0.0,0.0,0.0,0.0,0.0,0.0,0.6879268288612366,0.8030610084533691,0.0,0.0,0.0,0.0,0.0,0.0,0.0,0.0,0.0,0.0,0.0,0.0,0.0,0.0,0.0,0.0,0.0,0.0,0.0
KILLMONGER,This is all of it?,MALE,0.0,0.0,0.0,0.0,0.0,0.0,0.0,0.414739191532135,0.9201882481575012,0.0,0.0,0.0,0.0,0.0,0.0,0.0,0.0,0.0,0.0,0.0,0.0,0.0,0.0,0.0,0.0,0.0,0.0,0.0
SHAMAN,"Yes. So when it comes time for another King, we will be ready.",FEMALE,0.0,0.0,0.0,0.0,0.0,0.9821003079414368,0.0,0.0,0.0,0.0,0.0,0.0,0.0,0.0,0.3996169865131378,0.0,0.0,0.0,0.0,0.0,0.0,0.0,0.0,0.0,0.0,0.0,0.0,0.0
KILLMONGER,Another King... yea go ahead and burn all that.,MALE,0.9296045303344727,0.0,0.0,0.6874415278434753,0.0,0.0,0.0,0.0,0.0,0.0,0.0,0.0,0.0,0.0,0.0,0.0,0.0,0.0,0.0,0.0,0.0,0.0,0.0,0.0,0.0,0.0,0.0,0.0
SHAMAN,"My King, we cannot do that. It is our tradition --",FEMALE,0.6572433114051819,0.0,0.0,0.0,0.0,0.0,0.0,0.0,0.0,0.0,0.0,0.7457952499389648,0.0,0.0,0.0,0.0,0.0,0.0,0.0,0.0,0.0,0.0,0.0,0.0,0.0,0.0,0.0,0.0
KILLMONGER,"When I tell you to do something, I mean that shit. Burn it all!",MALE,0.0,0.0,0.0,0.9836243391036987,0.4797988831996918,0.0,0.0,0.0,0.0,0.0,0.0,0.0,0.0,0.0,0.0,0.0,0.0,0.0,0.0,0.0,0.0,0.0,0.0,0.0,0.0,0.0,0.0,0.0
KILLMONGER,"You know, where I'm from, when black folks started revolutions, they never had the firepower or resources to fight their oppressors. Where was Wakanda? Hmm? Yea all that ends today. We got spies embedded in every nation on Earth. Already in place.",MALE,0.0,0.0,0.0,0.0,0.0,0.470792293548584,0.0,0.7558109760284424,0.0,0.0,0.0,0.0,0.0,0.0,0.0,0.0,0.0,0.0,0.0,0.0,0.0,0.0,0.0,0.0,0.0,0.0,0.0,0.0
KILLMONGER,"I know how colonizers think. So we're gonna use their own strategy against them. We're gonna send vibranium weapons out to our War Dogs. They'll arm oppressed people all over the world, so they can finally rise up and kill those in power, and their children and anyone else who takes their side. It's time they know the truth about us. We're warriors. The world's gonna start over and this time we're on top.",MALE,0.8893739581108093,0.0,0.0,0.0,0.0,0.0,0.0,0.0,0.0,0.0,0.0,0.0,0.0,0.0,0.0,0.0,0.0,0.0,0.0,0.0,0.0,0.5241672992706299,0.0,0.0,0.0,0.0,0.0,0.0
KILLMONGER,The sun will never set on the Wakandan Empire.,MALE,0.9975962042808533,0.0,0.0,0.0,0.0,0.0,0.0,0.0,0.0,0.0,0.0,0.0,0.0,0.0,0.0,0.0,0.0,0.0,0.0,0.0,0.0,0.0,0.0,0.0,0.0,0.0,0.0,0.0
OKOYE,Wakanda has survived for so long by fighting when only absolutely necessary.,FEMALE,0.0,0.0,0.0,0.0,0.0,0.9864983558654785,0.0,0.0,0.0,0.0,0.0,0.0,0.0,0.0,0.0,0.0,0.0,0.0,0.0,0.0,0.0,0.0,0.0,0.0,0.0,0.0,0.0,0.0
W'KABI,"Wakanda has survived in the past this way, yes. But the world is changing, General. Elders, it is getting smaller. The outside world is catching up and soon it will be the conquerors, or the conquered. I'd rather be the former.",MALE,0.9905385971069336,0.0,0.0,0.0,0.0,0.0,0.0,0.0,0.0,0.0,0.0,0.0,0.0,0.0,0.0,0.0,0.0,0.0,0.0,0.0,0.0,0.0,0.0,0.0,0.0,0.0,0.0,0.0
KILLMONGER,You heard your orders. Let's get to it.,MALE,0.9928802847862244,0.0,0.0,0.0,0.0,0.0,0.0,0.0,0.0,0.0,0.0,0.0,0.0,0.0,0.0,0.0,0.0,0.0,0.0,0.0,0.0,0.0,0.0,0.0,0.0,0.0,0.0,0.0
ROSS,So where are we going again?,MALE,0.0,0.0,0.0,0.0,0.0,0.0,0.0,0.6874951124191284,0.5450931787490845,0.0,0.0,0.0,0.0,0.0,0.0,0.0,0.0,0.0,0.0,0.0,0.0,0.0,0.0,0.0,0.0,0.0,0.0,0.0
NAKIA,We're taking the Heart Shaped Herb to Jabariland.,FEMALE,0.9989443421363831,0.0,0.0,0.0,0.0,0.0,0.0,0.0,0.0,0.0,0.0,0.0,0.0,0.0,0.0,0.0,0.0,0.0,0.0,0.0,0.0,0.0,0.0,0.0,0.0,0.0,0.0,0.0
ROSS,"Heart Shaped Herb, what is that?",MALE,0.0,0.0,0.0,0.0,0.0,0.0,0.0,0.6300644874572754,0.9506860971450806,0.0,0.0,0.0,0.0,0.0,0.0,0.0,0.0,0.0,0.0,0.0,0.0,0.0,0.0,0.0,0.0,0.0,0.0,0.0
SHURI,It gives whoever takes it heightened abilities.,FEMALE,0.9326107501983643,0.0,0.0,0.0,0.0,0.4045381247997284,0.0,0.0,0.0,0.0,0.0,0.0,0.0,0.0,0.0,0.0,0.0,0.0,0.0,0.0,0.0,0.0,0.0,0.0,0.0,0.0,0.0,0.0
NAKIA,It's what made T'Challa so strong.,FEMALE,0.0,0.9519268870353699,0.0,0.0,0.0,0.0,0.0,0.0,0.0,0.0,0.0,0.0,0.0,0.0,0.0,0.0,0.0,0.0,0.0,0.0,0.0,0.0,0.0,0.0,0.0,0.0,0.0,0.0
RAMONDA,"Nakia. I don't like this. The Herb belongs to us. We may be creating a bigger monster with M'Baku.  Nakia, you should take it yourself.",FEMALE,0.0,0.0,0.0,0.0,0.0,0.0,0.0,0.0,0.0,0.0,0.0,0.9947330951690674,0.0,0.0,0.0,0.0,0.0,0.0,0.0,0.0,0.0,0.0,0.0,0.0,0.0,0.0,0.0,0.0
NAKIA,I'm a spy with no army. I wouldn't stand a chance.,FEMALE,0.6421251893043518,0.0,0.0,0.0,0.0,0.0,0.0,0.0,0.0,0.0,0.0,0.0,0.0,0.0,0.0,0.0,0.0,0.0,0.0,0.0,0.0,0.0,0.0,0.0,0.0,0.0,0.5884760618209839,0.0
RAMONDA,We'll go.,FEMALE,0.9983865022659302,0.0,0.0,0.0,0.0,0.0,0.0,0.0,0.0,0.0,0.0,0.0,0.0,0.0,0.0,0.0,0.0,0.0,0.0,0.0,0.0,0.0,0.0,0.0,0.0,0.0,0.0,0.0
NAKIA,Stay calm.,FEMALE,0.8754366040229797,0.0,0.0,0.0,0.0,0.0,0.6526983976364136,0.0,0.0,0.0,0.0,0.0,0.0,0.0,0.0,0.0,0.0,0.0,0.0,0.0,0.0,0.0,0.0,0.0,0.0,0.0,0.0,0.0
RAMONDA,My son was murdered in ritual combat.,FEMALE,0.0,0.0,0.0,0.0,0.0,0.0,0.0,0.0,0.0,0.0,0.0,0.0,0.0,0.0,0.0,0.0,0.0,0.0,0.0,0.0,0.0,0.0,0.0,0.0,0.0,0.0,0.8200827836990356,0.0
M'BAKU,Were the odds fair?,MALE,0.0,0.0,0.0,0.0,0.0,0.0,0.0,0.0,0.9573794007301331,0.0,0.0,0.0,0.0,0.0,0.0,0.0,0.0,0.0,0.0,0.0,0.0,0.0,0.0,0.0,0.0,0.0,0.0,0.0
NAKIA,"Yes, but...",FEMALE,0.992180347442627,0.0,0.0,0.0,0.0,0.0,0.0,0.0,0.0,0.0,0.0,0.0,0.0,0.0,0.0,0.0,0.0,0.0,0.0,0.0,0.0,0.0,0.0,0.0,0.0,0.0,0.0,0.0
M'BAKU,"So, it was less a murder than a defeat?",MALE,0.0,0.0,0.0,0.0,0.0,0.0,0.0,0.0,0.9835014939308167,0.0,0.0,0.0,0.0,0.0,0.0,0.0,0.0,0.0,0.0,0.0,0.0,0.0,0.0,0.0,0.0,0.0,0.0,0.0
SHURI,Do not rub our noses in it --,FEMALE,0.9977596998214722,0.0,0.0,0.0,0.0,0.0,0.0,0.0,0.0,0.0,0.0,0.0,0.0,0.0,0.0,0.0,0.0,0.0,0.0,0.0,0.0,0.0,0.0,0.0,0.0,0.0,0.0,0.0
M'BAKU,"Silence! I make the pronouncements here, girl.",MALE,0.9988309741020203,0.0,0.0,0.0,0.0,0.0,0.0,0.0,0.0,0.0,0.0,0.0,0.0,0.0,0.0,0.0,0.0,0.0,0.0,0.0,0.0,0.0,0.0,0.0,0.0,0.0,0.0,0.0
ROSS,"Look uh, your highness, the new King is a --",MALE,0.9960939288139343,0.0,0.0,0.0,0.0,0.0,0.0,0.0,0.0,0.0,0.0,0.0,0.0,0.0,0.0,0.0,0.0,0.0,0.0,0.0,0.0,0.0,0.0,0.0,0.0,0.0,0.0,0.0
M'BAKU,You cannot talk. One more word and I will feed you to my children.,MALE,0.8778012990951538,0.0,0.0,0.0,0.0,0.0,0.4772031009197235,0.0,0.0,0.0,0.0,0.0,0.0,0.0,0.0,0.0,0.0,0.0,0.0,0.0,0.0,0.0,0.0,0.0,0.0,0.0,0.0,0.0
M'BAKU,I'm kidding. We are vegetarians.,MALE,0.0,0.0,0.9935057163238525,0.0,0.0,0.0,0.0,0.0,0.0,0.0,0.0,0.0,0.0,0.0,0.0,0.0,0.0,0.0,0.0,0.0,0.0,0.0,0.0,0.0,0.0,0.0,0.0,0.0
NAKIA,Great Gorilla M'Baku. This is why we are here. To offer this to you. An outsider sits on our throne. Only you can help us stop him.,FEMALE,0.8961424827575684,0.0,0.0,0.0,0.0,0.0,0.0,0.0,0.0,0.0,0.0,0.0,0.0,0.0,0.0,0.0,0.0,0.0,0.0,0.0,0.0,0.0,0.0,0.0,0.0,0.0,0.0,0.0
M'BAKU,Come with me.,MALE,0.9986997842788696,0.0,0.0,0.0,0.0,0.0,0.0,0.0,0.0,0.0,0.0,0.0,0.0,0.0,0.0,0.0,0.0,0.0,0.0,0.0,0.0,0.0,0.0,0.0,0.0,0.0,0.0,0.0
NAKIA,Impossible.  Is he breathing?,FEMALE,0.0,0.0,0.0,0.0,0.0,0.0,0.0,0.9785101413726807,0.0,0.0,0.0,0.0,0.0,0.0,0.0,0.0,0.0,0.0,0.0,0.0,0.0,0.0,0.0,0.0,0.0,0.0,0.0,0.0
M'BAKU,"He is in a coma, barely clinging to life.",MALE,0.9671077132225037,0.0,0.0,0.0,0.0,0.0,0.0,0.0,0.0,0.0,0.0,0.0,0.0,0.0,0.0,0.0,0.0,0.0,0.0,0.0,0.0,0.0,0.0,0.0,0.0,0.0,0.0,0.0
M'BAKU,One of our fishermen found him at the edge of the river border. He brought him to me. ,MALE,0.9982917904853821,0.0,0.0,0.0,0.0,0.0,0.0,0.0,0.0,0.0,0.0,0.0,0.0,0.0,0.0,0.0,0.0,0.0,0.0,0.0,0.0,0.0,0.0,0.0,0.0,0.0,0.0,0.0
SHURI,Why do you have him in the snow?!,FEMALE,0.0,0.0,0.0,0.0,0.0,0.0,0.0,0.0,0.988063395023346,0.0,0.0,0.0,0.0,0.0,0.0,0.0,0.0,0.0,0.0,0.0,0.0,0.0,0.0,0.0,0.0,0.0,0.0,0.0
M'BAKU,It is the only thing keeping him from joining the ancestors.,MALE,0.9961084723472595,0.0,0.0,0.0,0.0,0.0,0.0,0.0,0.0,0.0,0.0,0.0,0.0,0.0,0.0,0.0,0.0,0.0,0.0,0.0,0.0,0.0,0.0,0.0,0.0,0.0,0.0,0.0
SHURI,We need to get him to my lab! I can heal him there.,FEMALE,0.0,0.0,0.0,0.0,0.0,0.0,0.9481258392333984,0.0,0.0,0.0,0.0,0.0,0.0,0.0,0.0,0.0,0.0,0.0,0.0,0.0,0.0,0.0,0.0,0.0,0.0,0.0,0.0,0.0
M'BAKU,Take him. He' ll be dead in seconds.,MALE,0.9962899684906006,0.0,0.0,0.0,0.0,0.0,0.0,0.0,0.0,0.0,0.0,0.0,0.0,0.0,0.0,0.0,0.0,0.0,0.0,0.0,0.0,0.0,0.0,0.0,0.0,0.0,0.0,0.0
RAMONDA,"Nakia, the Herb.",FEMALE,0.9986693859100342,0.0,0.0,0.0,0.0,0.0,0.0,0.0,0.0,0.0,0.0,0.0,0.0,0.0,0.0,0.0,0.0,0.0,0.0,0.0,0.0,0.0,0.0,0.0,0.0,0.0,0.0,0.0
RAMONDA,I call upon the ancestors. I call upon Bast. I am here with my son T'Challa. Heal him. We must bury him.,FEMALE,0.9969634413719177,0.0,0.0,0.0,0.0,0.0,0.0,0.0,0.0,0.0,0.0,0.0,0.0,0.0,0.0,0.0,0.0,0.0,0.0,0.0,0.0,0.0,0.0,0.0,0.0,0.0,0.0,0.0
RAMONDA,Praise the ancestors.,FEMALE,0.0,0.9036526083946228,0.0,0.0,0.0,0.0,0.0,0.0,0.0,0.0,0.0,0.0,0.0,0.0,0.0,0.0,0.0,0.0,0.0,0.0,0.0,0.0,0.3919409513473511,0.0,0.0,0.0,0.0,0.0
NAKIA,Praise the ancestors.,FEMALE,0.0,0.9036526083946228,0.0,0.0,0.0,0.0,0.0,0.0,0.0,0.0,0.0,0.0,0.0,0.0,0.0,0.0,0.0,0.0,0.0,0.0,0.0,0.0,0.3919409513473511,0.0,0.0,0.0,0.0,0.0
ROSS,Praise the ancestors.,MALE,0.0,0.9036526083946228,0.0,0.0,0.0,0.0,0.0,0.0,0.0,0.0,0.0,0.0,0.0,0.0,0.0,0.0,0.0,0.0,0.0,0.0,0.0,0.0,0.3919409513473511,0.0,0.0,0.0,0.0,0.0
SHURI,Praise the ancestors.,FEMALE,0.0,0.9036526083946228,0.0,0.0,0.0,0.0,0.0,0.0,0.0,0.0,0.0,0.0,0.0,0.0,0.0,0.0,0.0,0.0,0.0,0.0,0.0,0.0,0.3919409513473511,0.0,0.0,0.0,0.0,0.0
NAKIA,"Wake up, T'Challa. Wake up.",FEMALE,0.9981874823570251,0.0,0.0,0.0,0.0,0.0,0.0,0.0,0.0,0.0,0.0,0.0,0.0,0.0,0.0,0.0,0.0,0.0,0.0,0.0,0.0,0.0,0.0,0.0,0.0,0.0,0.0,0.0
T'CHALA,My son.,MALE,0.9982555508613586,0.0,0.0,0.0,0.0,0.0,0.0,0.0,0.0,0.0,0.0,0.0,0.0,0.0,0.0,0.0,0.0,0.0,0.0,0.0,0.0,0.0,0.0,0.0,0.0,0.0,0.0,0.0
T'CHALA,The time has come for you to come home and be reunited with me.,MALE,0.0,0.0,0.0,0.0,0.0,0.0,0.9919103980064392,0.0,0.0,0.0,0.0,0.0,0.0,0.0,0.0,0.0,0.0,0.0,0.0,0.0,0.0,0.0,0.0,0.0,0.0,0.0,0.0,0.0
T'CHALA,Why?,MALE,0.985918402671814,0.0,0.0,0.0,0.0,0.0,0.0,0.0,0.0,0.0,0.0,0.0,0.0,0.0,0.0,0.0,0.0,0.0,0.0,0.0,0.0,0.0,0.0,0.0,0.0,0.0,0.0,0.0
T'CHALA,Why didn't you bring the boy home?,MALE,0.0,0.0,0.0,0.0,0.0,0.0,0.0,0.0,0.9921184778213501,0.0,0.0,0.0,0.0,0.0,0.0,0.0,0.0,0.0,0.0,0.0,0.0,0.0,0.0,0.0,0.0,0.0,0.0,0.0
T'CHALA,"Why, Baba?",MALE,0.9923986792564392,0.0,0.0,0.0,0.0,0.0,0.0,0.0,0.0,0.0,0.0,0.0,0.0,0.0,0.0,0.0,0.0,0.0,0.0,0.0,0.0,0.0,0.0,0.0,0.0,0.0,0.0,0.0
T'CHALA,He... he was the truth I chose to omit.,MALE,0.0,0.0,0.0,0.0,0.0,0.0,0.0,0.0,0.0,0.0,0.0,0.0,0.0,0.0,0.0,0.0,0.0,0.0,0.0,0.0,0.0,0.0,0.0,0.9487782716751099,0.0,0.0,0.0,0.0
T'CHALA,You were wrong to abandon him.,MALE,0.3048882484436035,0.0,0.0,0.0,0.0,0.0,0.0,0.0,0.0,0.0,0.0,0.6464526057243347,0.0,0.0,0.0,0.0,0.0,0.0,0.0,0.0,0.0,0.0,0.0,0.0,0.0,0.0,0.0,0.0
