character,line,gender
FANDRAL,"Complicated fellow, isn't he? ",MALE
VOLSTAGG,Now what do we do?,MALE
SIF,Look!,FEMALE
PHIL COULSON,What the hell was that?,MALE
TECHIE,"I don't know, sir. We got massive energy readings out of nowhere, then they just disappeared. Fifteen miles due northwest. ",MALE
PHIL COULSON,Let's go take a look.,MALE
VOLSTAGG,He must have landed nearby. It's time to put our tracking skills to work. Spread out. Check the sand for indentations of his boot prints.,MALE
FANDRAL,The winds would have blown them away by now. We should look for signs of a campfire.,MALE
SIF,Or we could just start there.,FEMALE
FANDRAL,"It's worth a look, I suppose.",MALE
VOLSTAGG,"There you go, lad!",MALE
VOLSTAGG,"Is it just me, or does Earth look a little different to you? ",MALE
SIF,It has been a thousand years...,FEMALE
VOLSTAGG,"Things change so fast here. You leave for a millennium, and it's like the whole neighborhood's gone.",MALE
VOLSTAGG,Perhaps we should split up.,MALE
AGENT GARRETT,Is there a Renaissance Faire in town?,MALE
AGENT CALE,Call it in.,MALE
VOLSTAGG,Never cared for spies.,MALE
VOLSTAGG,Exquisite.,MALE
EINHERJAR GUARD,"My liege, the Warriors Three and the Lady Sif have gone missing.",MALE
HEIMDALL,"Tell me, Loki, how did you get the Jotuns into Asgard? ",MALE
LOKI,"You think the Bifrost is the only way in and out of the Realm? There are secret paths between worlds to which even you with all your gifts are blind. But I have need of them no longer, now that I am King. And I say, for your act of treason, you are relieved of your duties as Gatekeeper. And you are no longer a citizen of Asgard. ",MALE
HEIMDALL,Then I need no longer obey you.,MALE
LOKI,Ensure my brother does not return.,MALE
VOLSTAGG,Found you!,MALE
THOR,My friends!,MALE
SELVIG,I don't believe it...,FEMALE
DARCY,Who are they?,MALE
VOLSTAGG,"Lady Sif and the Warriors Three. Surely you've heard tales of Hogun the Grim, Fandral the Dashing, and I, Volstagg the Svelte?",MALE
VOLSTAGG,"Well, perhaps I've put on a little more muscle since I was here last. ",MALE
JANE,That would have been a thousand years ago? Northern Europe?,FEMALE
VOLSTAGG,Exactly! Those lovely herring people. They worshipped us!,MALE
THOR,"My friends, I've never been happier to see anyone. But you should not have come. ",MALE
FANDRAL,We're here to take you home.,MALE
THOR,You know I can't. My father is dead because of me. I must remain in exile.,MALE
SIF,Thor... your father still lives.,FEMALE
PHIL COULSON,Get somebody from Linguistics out here.,MALE
DARCY,Was somebody else coming?,MALE
SHIELD AGENT,Is that one of Stark's?,MALE
PHIL COULSON,I don't think so. But the guy doesn't tell me anything.,MALE
PHIL COULSON,Hello! You're using unregistered weapons technology. Please identify yourself.,MALE
PHIL COULSON,Incoming!,MALE
THOR,Leave this town now. Get yourself and your friends to safety.,MALE
JANE,What about you?,FEMALE
THOR,I must stay and fight.,MALE
THOR,"I'm still a warrior, and I will fight by your side. ",MALE
VOLSTAGG,You're but a mortal now. You'll get yourself killed!,MALE
FANDRAL,"Or one of us, trying to protect you. ",MALE
SIF,The best thing you can do is get the mortals to safety and leave the battle to us.,FEMALE
THOR,You're right.,MALE
THOR,Help me clear the streets. I'll let none of these people die this day.,MALE
LOKI,Father. Welcome to Asgard.,MALE
SIF,Keep him distracted.,FEMALE
FANDRAL,"What do you think? ""The Svartalfheim Twist?"" ""Kiss of the Hag?"" ""Face Full of Boot?""",MALE
VOLSTAGG,"""The Flying Mountain."" ",MALE
FANDRAL,"Not ""The Flying Mountain!"" It threw out my back for a year last time! ",MALE
VOLSTAGG,"Trust me, it'll work.",MALE
THOR,"My friends fight bravely, but they won't be able to hold it back much longer.",MALE
FANDRAL,Come on!,MALE
VOLSTAGG,For Asgaaaaard!!!,MALE
JANE,Erik!,FEMALE
SELVIG,Go! Leave me!,FEMALE
THOR,Come on... give me one!,MALE
JANE,What are you doing? What is that?,FEMALE
SELVIG,I'm really starting to like him.,FEMALE
THOR,"Go, while you can! ",MALE
SIF,But the others...,FEMALE
THOR,You can't help them now. Your job is to survive.,MALE
SIF,No! I will die a warrior's death. Stories will be told of this day--,FEMALE
THOR,Live and tell those stories yourself.,MALE
THOR,Get him out of here!,MALE
FANDRAL,No. We can still fight!,MALE
THOR,"But not win. Move Volstagg, or he'll die!",MALE
THOR,"Don't worry, my friends. I have a plan.",MALE
THOR,"Brother... for whatever I have done to wrong you, whatever I have done to lead you to do this, I am sorry. But these people have done nothing to you. They are innocents.",MALE
THOR,"Take my life, and know I will never return to Asgard.",MALE
SELVIG,"Jane, no!",FEMALE
JANE,Oh. My. God.,FEMALE
PHIL COULSON,Donald... I don't think you've been completely honest with me.,MALE
DARCY,"So, how can you speak our language? ",MALE
VOLSTAGG,"Your language? Ha! Silly girl, you're speaking ours.",MALE
THOR,Heimdall! Open the Bifrost!,MALE
THOR,He would open it if he could. I fear the worst.,MALE
VOLSTAGG,Then we're trapped here forever.,MALE
FANDRAL,Then I suppose we'd best start settling into our new lives.,MALE
FANDRAL,Are all earth maidens as fair as you?,MALE
DARCY,No.,MALE
THOR,Heimdall!,MALE
VOLSTAGG,"Primitive. Good enough for hunting small game, I suppose.",MALE
FANDRAL,"Sorry, my love. These things happen.",MALE
THOR,"Know this, son of Coul. You and I, we fight for the same cause -- the protection of this world. From this day forward, count me as your ally. If you return the items you have stolen from Jane Foster. ",MALE
PHIL COULSON,Not stolen. Borrowed.,MALE
PHIL COULSON,"You'll get your equipment back. You're going to need it to continue your research... which, after today's events, SHIELD would like to fully sponsor. If that's all right with you.",MALE
THOR,"Whatever fate lies before me, you are part of it.",MALE
THOR,Get him to the healing room! Leave my brother to me.,MALE
LAUFEY,"It's said you can still see and hear what transpires around you, even in this state. I hope it's true, so that you may know your death came by the hand of Laufey.",MALE
LOKI,And your death came by the son of Odin.,MALE
LOKI,"I swear to you, mother, they will pay for what they've done today. I will end the Jotun threat, now and forever!",MALE
LOKI,And I will make you proud.,MALE
FRIGGA,Thor!,MALE
LOKI,"Found its way back to you, did it? ",MALE
THOR,No thanks to you.,MALE
FRIGGA,What?,MALE
THOR,Why don't you tell her? How you sent the Destroyer to kill our friends? To kill me?,MALE
LOKI,It must have been enforcing Father's last command.,MALE
THOR,"You're a talented liar, brother. Always have been. ",MALE
LOKI,"It's good to have you back. Now, if you'll excuse me, I need to destroy Jotunheim.",MALE
THOR,Jotunheim...,MALE
LOKI,"All these years, and no one's ever dared to use it as a weapon.",MALE
LOKI,You can't stop it. The Bifrost will build until it rips Jotunheim apart.,MALE
THOR,Why have you done this?,MALE
LOKI,"To do what Father never could. To destroy their kind forever. When he awakens, he'll see the wisdom of what I've done. ",MALE
THOR,He won't! You can't kill an entire race!,MALE
LOKI,"What is this newfound love for the Frost Giants? You, who would have killed them all with your bare hands. ",MALE
THOR,I've changed.,MALE
LOKI,So have I.,MALE
LOKI,Fight me.,MALE
THOR,Is the throne really worth what you've done? What you would become?,MALE
LOKI,I never wanted the throne. I only wanted to be your equal. Now fight me!,MALE
THOR,"I will not fight you, brother. ",MALE
LOKI,I am not your brother. I never was.,MALE
THOR,"Loki, this is madness...",MALE
LOKI,Is it?,MALE
LOKI,What happened to you on earth that turned you so soft? Don't tell me it was a woman.,MALE
LOKI,It was.,MALE
SELVIG,Jane?,FEMALE
JANE,Something's wrong.,FEMALE
LOKI,"If you care so much for the Jotuns, then die with them.",MALE
LOKI,Thor! Help me!,MALE
LOKI,Please...,MALE
LOKI,I was always more clever than you.,MALE
THOR,Yet still not clever enough.,MALE
LOKI,"Look at you, the Mighty Thor. With all your strength, what good does it do you now?",MALE
LOKI,Stop! What are you doing?!,MALE
LOKI,"If you destroy the Bridge, you'll never see her again!",MALE
THOR,Forgive me.,MALE
THOR,No!,MALE
ODIN,It is over.,MALE
JANE,It's gone.,FEMALE
VOLSTAGG,"...and then, with a mighty bellow, I flew at the great metal beast and laid it low... ",MALE
FANDRAL,Is that another way of saying you fell on your huge a--,MALE
VOLSTAGG,"As a matter of fact, falling down was a tactic. Lulling the Destroyer into a false sense of security! ",MALE
FANDRAL,"Well, I was the one who had to drag your enormous carcass off the battlefield. That makes me the real hero. Doesn't it, Hogun?",MALE
HOGUN,Big stomach. Big mouth.,MALE
FANDRAL,"Well, how about that? A smile! I'd say that calls for another drink!",MALE
SIF,My Queen. I am so sorry for your loss.,FEMALE
FRIGGA,"Thank you, Sif.",MALE
FRIGGA,How is he?,MALE
SIF,He mourns for his brother. And he misses her. The mortal.,FEMALE
FRIGGA,He will need his friends now more than ever.,MALE
SIF,I will always be at his side.,FEMALE
ODIN,You'll be a wise King.,MALE
THOR,"There will never be a wiser king than you. Or a better father. I have much to learn. I know that now. But some day, perhaps, I will make you proud. ",MALE
ODIN,You've already made me proud.,MALE
THOR,Can you see her?,MALE
HEIMDALL,Yes.,MALE
THOR,How is she?,MALE
DARCY,Here you go.,MALE
JANE,Thanks.,FEMALE
DARCY,He would have come back if he could.,MALE
JANE,I know. But if he can't get here on his own...,FEMALE
JANE,...maybe we can help him find his way back.,FEMALE
