character,line,gender,happy,sad,disgusted,angry,fearful,neutral,surprised
COL. CHESTER PHILLIPS,"He’s gonna kill you anyway, Doc. You’re a liability. You know more about Schmidt than anyone. And the last guy you cost us was Captain Rogers’ closest friend. So, I wouldn’t count on the very best of protection. There’s you or Schmidt. It’s just the hand you’ve been dealt.",MALE,happy,sad,disgusted,angry,fearful,neutral,surprised
DR. ARNIM ZOLA,Schmidt believes he walks in the foot steps of the Gods.,MALE,happy,sad,disgusted,angry,fearful,neutral,surprised
COL. CHESTER PHILLIPS,Mmm.,MALE,happy,sad,disgusted,angry,fearful,neutral,surprised
DR. ARNIM ZOLA,Only the world itself will satisfy him.,MALE,happy,sad,disgusted,angry,fearful,neutral,surprised
COL. CHESTER PHILLIPS,"You do realize that’s nuts, don’t you?",MALE,happy,sad,disgusted,angry,fearful,neutral,surprised
DR. ARNIM ZOLA,But the sanity of the plan is of no consequence.,MALE,happy,sad,disgusted,angry,fearful,neutral,surprised
COL. CHESTER PHILLIPS,And why is that?,MALE,happy,sad,disgusted,angry,fearful,neutral,surprised
DR. ARNIM ZOLA,Because he can do it!,MALE,happy,sad,disgusted,angry,fearful,neutral,surprised
COL. CHESTER PHILLIPS,What’s his target?,MALE,happy,sad,disgusted,angry,fearful,neutral,surprised
DR. ARNIM ZOLA,His target… is everywhere.,MALE,happy,sad,disgusted,angry,fearful,neutral,surprised
RED SKULL,"Tomorrow, Hydra will stand master of the world. Born to victory on the wings of the Valkyrie. Our enemies weapons will be powerless against us. If they shoot down one plane, hundreds more will rain fire upon them! If they cut off one head, two more shall take its place. Hail Hydra!",MALE,happy,sad,disgusted,angry,fearful,neutral,surprised
MAN ON THE RADIO,"Blackout is still in effect throughout the London area. Please wait for the all-clear. Your attention, please. All citizens shall remain indoors until further notice. Blackout is still in effect throughout the London area.",MALE,happy,sad,disgusted,angry,fearful,neutral,surprised
STEVE ROGERS,"Dr. Erskine said that… the serum wouldn’t just effect my muscles, it would effect my cells. Create a protective system of regeneration and healing. Which means um…I can’t get drunk. Did you know that?",MALE,happy,sad,disgusted,angry,fearful,neutral,surprised
PEGGY CARTER,Your metabolism burns four times faster than the average person. He thought it could be one of the side effects.  It wasn’t your fault.,FEMALE,happy,sad,disgusted,angry,fearful,neutral,surprised
STEVE ROGERS,Did you read the reports?,MALE,happy,sad,disgusted,angry,fearful,neutral,surprised
PEGGY CARTER,Yes.,FEMALE,happy,sad,disgusted,angry,fearful,neutral,surprised
STEVE ROGERS,Then you know that’s not true.,MALE,happy,sad,disgusted,angry,fearful,neutral,surprised
PEGGY CARTER,You did everything you could. Did you believe in your friend? Did you respect him?  Then stop blaming yourself. Allow Barnes the dignity of his choice. He damn well must have thought you were worth it.,FEMALE,happy,sad,disgusted,angry,fearful,neutral,surprised
STEVE ROGERS,I’m goin’ after Schmidt. I’m not gonna stop till all of Hydra is dead or captured.,MALE,happy,sad,disgusted,angry,fearful,neutral,surprised
PEGGY CARTER,You won’t be alone.,FEMALE,happy,sad,disgusted,angry,fearful,neutral,surprised
COL. CHESTER PHILLIPS,"Johann Schmidt belongs in a bug house. He thinks he’s a God. He’s willing to blow up half the world to prove it, starting with the USA.",MALE,happy,sad,disgusted,angry,fearful,neutral,surprised
HOWARD STARK,"Schmidt’s working with powers beyond our capabilities. He gets across the Atlantic, he will wipe out the entire eastern sea board in an hour.",MALE,happy,sad,disgusted,angry,fearful,neutral,surprised
GABE JONES,How much time we got?,MALE,happy,sad,disgusted,angry,fearful,neutral,surprised
COL. CHESTER PHILLIPS,"According to my new best friend, under twenty four hours.",MALE,happy,sad,disgusted,angry,fearful,neutral,surprised
JACQUES DERNEIR,Where is he now?,MALE,happy,sad,disgusted,angry,fearful,neutral,surprised
COL. CHESTER PHILLIPS,Hydra’s last base is here.  In the Alps. Five hundred feet below the surface.,MALE,happy,sad,disgusted,angry,fearful,neutral,surprised
JIM MORITA,"So, what are we supposed to do. I mean, it’s not like we can just knock on the front door.",MALE,happy,sad,disgusted,angry,fearful,neutral,surprised
STEVE ROGERS,Why not? That’s exactly what we’re gonna do.,MALE,happy,sad,disgusted,angry,fearful,neutral,surprised
RED SKULL,"Arrogance may not be a uniquely American trait, but I must say you do it better than anyone. But there are limits to what even you can do, Captain. Or did Erskine tell you otherwise?",MALE,happy,sad,disgusted,angry,fearful,neutral,surprised
STEVE ROGERS,He told me you were insane.,MALE,happy,sad,disgusted,angry,fearful,neutral,surprised
RED SKULL,"Ah. He resented my genius and tried to deny me what was rightfully mine. But he gave you everything. So, what made you so special?",MALE,happy,sad,disgusted,angry,fearful,neutral,surprised
STEVE ROGERS,Nothin’. I’m just a kid from Brooklyn.  I can do this all day.,MALE,happy,sad,disgusted,angry,fearful,neutral,surprised
RED SKULL,"Oh, of course you can. Of course. But unfortunately I am on a tight schedule.",MALE,happy,sad,disgusted,angry,fearful,neutral,surprised
STEVE ROGERS,So am I!,MALE,happy,sad,disgusted,angry,fearful,neutral,surprised
JAMES MONTGOMERY FALSWORTH,Rogers! You might need this!,MALE,happy,sad,disgusted,angry,fearful,neutral,surprised
STEVE ROGERS,Thanks!,MALE,happy,sad,disgusted,angry,fearful,neutral,surprised
JIM MORITA,"We’re in! Assault team, go!",MALE,happy,sad,disgusted,angry,fearful,neutral,surprised
COL. CHESTER PHILLIPS,Move out!  Keep your spacing!,MALE,happy,sad,disgusted,angry,fearful,neutral,surprised
HYDRA SOLDIER,"Cutt off one head, two more shall…",MALE,happy,sad,disgusted,angry,fearful,neutral,surprised
COL. CHESTER PHILLIPS,Let’s go find two more!,MALE,happy,sad,disgusted,angry,fearful,neutral,surprised
STEVE ROGERS,You’re late.,MALE,happy,sad,disgusted,angry,fearful,neutral,surprised
PEGGY CARTER,Weren’t you about to…,FEMALE,happy,sad,disgusted,angry,fearful,neutral,surprised
STEVE ROGERS,Right.  Keep it steady!,MALE,happy,sad,disgusted,angry,fearful,neutral,surprised
PEGGY CARTER,Wait!  Go get him.,FEMALE,happy,sad,disgusted,angry,fearful,neutral,surprised
COL. CHESTER PHILLIPS,I’m not kissin’ you!,MALE,happy,sad,disgusted,angry,fearful,neutral,surprised
RED SKULL,"You don’t give up, do you?",MALE,happy,sad,disgusted,angry,fearful,neutral,surprised
STEVE ROGERS,Nope!,MALE,happy,sad,disgusted,angry,fearful,neutral,surprised
RED SKULL,"You could have the power of the gods! Yet you wear a flag on your chest and think you fight a battle of nations! I have seen the future, Captain! There are no flags!",MALE,happy,sad,disgusted,angry,fearful,neutral,surprised
STEVE ROGERS,Not my future!,MALE,happy,sad,disgusted,angry,fearful,neutral,surprised
RED SKULL,What have you done? No.,MALE,happy,sad,disgusted,angry,fearful,neutral,surprised
STEVE ROGERS,Come in. This is Captain Rogers. Do you read me?,MALE,happy,sad,disgusted,angry,fearful,neutral,surprised
JIM MORITA,"Captain Rogers, what is your…",MALE,happy,sad,disgusted,angry,fearful,neutral,surprised
PEGGY CARTER,"Steve, is that you? Are you alright?",FEMALE,happy,sad,disgusted,angry,fearful,neutral,surprised
STEVE ROGERS,Peggy! Schmidt’s dead.,MALE,happy,sad,disgusted,angry,fearful,neutral,surprised
PEGGY CARTER,What about the plane?,FEMALE,happy,sad,disgusted,angry,fearful,neutral,surprised
STEVE ROGERS,That’s a little bit tougher to explain.,MALE,happy,sad,disgusted,angry,fearful,neutral,surprised
PEGGY CARTER,"Give me your coordinates, I’ll find you a safe landing site.",FEMALE,happy,sad,disgusted,angry,fearful,neutral,surprised
STEVE ROGERS,There’s not going to be a safe landing. But I can try and force it down.,MALE,happy,sad,disgusted,angry,fearful,neutral,surprised
PEGGY CARTER,"I’ll get Howard on the line, he’ll know what to do.",FEMALE,happy,sad,disgusted,angry,fearful,neutral,surprised
STEVE ROGERS,There’s not enough time. This thing’s moving too fast and it’s heading for New York.  I gotta put her in the water.,MALE,happy,sad,disgusted,angry,fearful,neutral,surprised
PEGGY CARTER,"Please, don’t do this. We have time. We can work it out.",FEMALE,happy,sad,disgusted,angry,fearful,neutral,surprised
STEVE ROGERS,"Right now I’m in the middle of nowhere. If I wait any longer a lot of people are gonna die. Peggy, this is my choice.  Peggy?",MALE,happy,sad,disgusted,angry,fearful,neutral,surprised
PEGGY CARTER,I’m here.,FEMALE,happy,sad,disgusted,angry,fearful,neutral,surprised
STEVE ROGERS,I’m gonna need a rain check on that dance.,MALE,happy,sad,disgusted,angry,fearful,neutral,surprised
PEGGY CARTER,"Alright. A week, next Saturday, at the Stork Club.",FEMALE,happy,sad,disgusted,angry,fearful,neutral,surprised
STEVE ROGERS,You got it.,MALE,happy,sad,disgusted,angry,fearful,neutral,surprised
PEGGY CARTER,Eight o’clock on the dot. Don’t you dare be late. Understood?,FEMALE,happy,sad,disgusted,angry,fearful,neutral,surprised
STEVE ROGERS,"You know, I still don’t know how to dance.",MALE,happy,sad,disgusted,angry,fearful,neutral,surprised
PEGGY CARTER,I’ll show you how. Just be there.,FEMALE,happy,sad,disgusted,angry,fearful,neutral,surprised
STEVE ROGERS,We’ll have the band play somethin’ slow. I’d hate to step on your…,MALE,happy,sad,disgusted,angry,fearful,neutral,surprised
PEGGY CARTER,Steve? Steve? Steve?,FEMALE,happy,sad,disgusted,angry,fearful,neutral,surprised
JAMES MONTGOMERY FALSWORTH,To the Captain.,MALE,happy,sad,disgusted,angry,fearful,neutral,surprised
STARK'S ENGINEER,Sir?,MALE,happy,sad,disgusted,angry,fearful,neutral,surprised
HOWARD STARK,Take us to the next grid point.,MALE,happy,sad,disgusted,angry,fearful,neutral,surprised
STARK'S ENGINEER,But there’s not trace of wreckage. And the energy signature stops here.,MALE,happy,sad,disgusted,angry,fearful,neutral,surprised
HOWARD STARK,Just keep looking.,MALE,happy,sad,disgusted,angry,fearful,neutral,surprised
DODGERS ANNOUNCER,"Curve ball, high and outside for ball one. So the Dodgers are tied, 4-4. And the crowd well knows that with one swing of his bat, this fellow’s capable of making it a brand-new game again. Just an absolutely gorgeous day here at Ebbets Field. The Phillies have managed to tie up at 4-4. But the Dodgers have three men on. Pearson beaned Reiser in Philadelphia last month. Wouldn’t the youngster like a hit here to return the favour? Pete leans in. Here’s the pitch. Swung on. A line to the right. And it gets past Rizzo. Three runs will score. Reiser heads to third. Durocher’s going to wave him in. Here comes the relay, but they won’t get him.",MALE,happy,sad,disgusted,angry,fearful,neutral,surprised
SHIELD AGENT,"Good morning.  Or should I say, afternoon?",MALE,happy,sad,disgusted,angry,fearful,neutral,surprised
STEVE ROGERS,Where am I?,MALE,happy,sad,disgusted,angry,fearful,neutral,surprised
SHIELD AGENT,You’re in a recovery room in New York city.,MALE,happy,sad,disgusted,angry,fearful,neutral,surprised
DODGERS ANNOUNCER,"The Dodgers take the lead, 8-4. Oh, Dodgers! Everyone is on their feet. What a game we have here today, folks. What a game indeed.",MALE,happy,sad,disgusted,angry,fearful,neutral,surprised
STEVE ROGERS,Where am I really?,MALE,happy,sad,disgusted,angry,fearful,neutral,surprised
SHIELD AGENT,I’m afraid I don’t understand.,MALE,happy,sad,disgusted,angry,fearful,neutral,surprised
STEVE ROGERS,"The game, it’s from May, nineteen forty one. I know, cause I was there.  Now, I’m gonna ask you again. Where am I?",MALE,happy,sad,disgusted,angry,fearful,neutral,surprised
SHIELD AGENT,Captain Rogers…,MALE,happy,sad,disgusted,angry,fearful,neutral,surprised
STEVE ROGERS,Who are you?,MALE,happy,sad,disgusted,angry,fearful,neutral,surprised
SHIELD AGENT,"Captain Rogers, wait!  All agents, code 13! I repeat. All agents, code 13!",MALE,happy,sad,disgusted,angry,fearful,neutral,surprised
NICK FURY,"At ease, soldier! Look, I’m sorry about that little show back there, but… we thought it best to break it to you slowly.",MALE,happy,sad,disgusted,angry,fearful,neutral,surprised
STEVE ROGERS,Break what?,MALE,happy,sad,disgusted,angry,fearful,neutral,surprised
NICK FURY,"You’ve been asleep, Cap. For almost seventy years.  You gonna be okay?",MALE,happy,sad,disgusted,angry,fearful,neutral,surprised
STEVE ROGERS,Yeah. Yeah. I just…I had a date.,MALE,happy,sad,disgusted,angry,fearful,neutral,surprised
NICK FURY,Trouble sleeping?,MALE,happy,sad,disgusted,angry,fearful,neutral,surprised
STEVE ROGERS,"You’re here with a mission, sir?",MALE,happy,sad,disgusted,angry,fearful,neutral,surprised
NICK FURY,I am.,MALE,happy,sad,disgusted,angry,fearful,neutral,surprised
STEVE ROGERS,Trying to get me back in the world?,MALE,happy,sad,disgusted,angry,fearful,neutral,surprised
NICK FURY,Trying to save it.,MALE,happy,sad,disgusted,angry,fearful,neutral,surprised
